video_id,title,description,category,sub_category,tags
-2WmGlV96YM,jason statham best action movies full hd new movie english hollywood movies action,jason statham best action movies full hd new movie english hollywood movies action subscribe channel watch best action movies full movies english top action movies english best action movies chinese action movie latest action movies best fantasy adventure movies action movies full hollywood hd movies best sci fi movies best horror movies best romantic movies adventure movies new hollywood movies full length english super action movie اقوي افلام اكشن مترجم كامل افلام جيسون ستاثام اقوى افلام الاكشن اقوى افلام الرعب اقوى افلام اكشن اقوى افلام رعب اقوى افلام الاكشن اقوي افلام الاكشن المترجمه اقوى افلام اكشن اقوى افلام الزومبي اقوى افلام الخيال العلمي اقوى افلام الرعب اقوى افلام ويل سميث اقوي افلام وثائقية عن حرب اكتوبر اقوي افلام الاكشن والخيال اقوي افلام الحروب والاكشن التاريخيه اقوي افلام الوحوش والخيال العلمي اقوي افلام الاكشن والقتال اقوي افلام الاكشن والرعب اقوي افلام الاكشن والخيال العلمي اقوي افلام الاكشن والدراما والمغامرات اقوي افلام الاكشن والحروب اقوى افلام هندي اكشن اقوى افلام هندي اكشن اقوي افلام هندي الاكشن المترجمه اقوى افلام هجوم القرش اقوي افلام هندي اقوى افلام محمد رمضان اقوى افلام محمد سعد من اقوي افلام الاكشن اقوي افلام القتال مترجم افلام اكشن اقوي مان من اقوي افلام الرعب مشاهدة اقوي افلام الاكشن اقوي افلام الرعب مترجمه اقوي افلام الرعب مترجم من اقوى افلام الاكشن من اقوى افلام الرعب من اقوي افلام سرقة البنوك thetown اقوى افلام كرتون اقوى افلام كونغ فو اقوى افلام كوميدي اقوى افلام كريشنا اقوى افلام كريم عبد العزيز اقوي تطبيق لصنع افلام كارتون بصوتك اقوي افلام الرعب كاملة مترجمة للعربية اقوي افلام الاكشن اقوي افلام توم كروز اقوي افلام اكشاي كومار اقوي افلام قتال بويكا اقوي افلام رعب قصيره اقوي افلام قتال اقوى افلام فريد شوقي اقوى افلام فان ديزل مترجمه اقوى افلام فاندام قلب الاسد اقوي افلام فان دام قلب الاسد lion heart vandamme اقوى افلام فانتازيا اقوي افلام الكونغ فو اقوي افلام الاكشن فيلم توني جاي اقوي افلام اكشن فاندام اقوي افلام عيد الفطر اقوى افلام عامر خان اقوى افلام عادل امام اقوى افلام عادل ادهم اقوي افلام عمرو سعد اقوي افلام الاكشن علي الاطلاق اقوي افلام خيال علمي اقوي افلام كريم عبد العزيز اقوى افلام شاروخان اقوي افلام جاكي شان اقوي افلام فريد شوقي اقوي افلام تايجر شروف اقوي شيلات افلام اقوي افلام توماس شيلبي اقوى افلام سمك القرش اقوى افلام سلمان خان اقوى افلام سلفستر اقوي افلام ستعرض في عيد الفطر المبارك الاحداث كاملة اقوي افلام ويل سميث اقوي افلام محمد سعد اقوي افلام رعب زومبي اقوى افلام رعب اقوى افلام رعب تركي اقوى افلام رعب اقوى افلام رعب قصيره اقوي افلام رامبو اقوى افلام رعب زومبي اقوى افلام رعب تركيه اقوي افلام رعب اجنبي اقوي افلام رعب تركي اقوى افلام ديزني اقوي افلام فان ديزل اقوي افلام فان ديزل مترجمه اقوى افلام خيال علمي اقوي افلام سلمان خان اقوي افلام عامر خان اقوى افلام حربيه اقوى افلام حرب السيوف اقوى افلام جاكي شان على الاطلاق اقوي افلام جيسون اقوي افلام اكشن جديدة مترجمة,Film & Animation,Hollywood Movies,"action movies 2019,new action movies 2019,action movie 2019,action movies,best action movie,best action movie 2019,new action movie,best sci fi movies 2019,super action movie 2019,action movie,movie 2019,new sci fi movies 2019,best action movies 2019,action,action movies jason statham,افلام اكشن,افلام اكشن 2019,افلام 2019,اكشن,افلام,فيلم,فيلم اكشن,اقوى افلام الاكشن,افلام اكشن مترجمة,اقوي افلام اكشن 2019,افلام الاكشن,اقوى فيلم اكشن,افلام اكشن رعب"
-EJgZwwiZE0,zombie virus horror movies official hd full movie español latino sub english,visit full vidios link,Film & Animation,Horror Movies,"Zombie Virus,Zombie Virus 2,Horror Movies 2019,Official HD Full Movie,Sub English,(Español Latino)"
-UUFbJvOaX0,larva super strength cartoon comics larva official,explore larva plush toy us httpsshoplarvacom uk available via entertainer httpswwwthetoyshopcombrandslarva smyths toy green liquid fall red yellow something weird thing happen incredibly strong subscribe larva season storm drain red yellow two strange larva live underneath storm drain encounter many surprise fall outside world underground universe two wriggly friends anything good excuse fun see world red yellow point view experience dangerous excite place world small friends season house eager explore world red yellow squat old house stick highrise build big city explore new home meet new creatures mean laugh comic duo sometimes fight sometimes find trouble together story two cute hilarious larva season new york new york city watch red yellow incredible abilities explore city whole new adventure bigger scale excite survival story two little larva new york character yellow yellow dimwitted happygolucky yellow color larva antenna yellow always abuse red never endanger friendship although usually obey red lose mind front food red red mostly hottempered greedy red color larva specialty shout kick like bruce lee always show abuse yellow often end hurt instead violet violet oversized ghost slug sometimes show lower half bury grind threaten expose whole body roar brown brown cloy dung beetle gather poop poop either food treasure hat insects touch prize poop long strand hair right cheek black black horn atlas beetle great strength usually punch cocoon use punch bag hes aggressive beat whoever think mess hello black turn slug wear beetle armor rainbow rainbow snail red green shell shell hes slow action muscular humanlike body function like humans pink pink pink larva two antennae recur female character love yellow red love hide great strength behind cute beautiful face larva cartoon tuba,Film & Animation,Cartoons,"larva,larva official,tuba,larva 2016,larva season 4,larva 2016 full movie,larva song,larva tuba,larva full movie,larva animation,larva cartoon,larva cartoon 2016,larva compilation,larva episodes,larva english full episodes,larva english,larva full episode,larva funny,larva hd,larva rangers,larva netflix,larva island,larva 2019,larva new york,lava,lavra,larva 2017,larva 2017 movie,larva island full episodes"
-nPbxtWzBGg,magical money tree bangla cartoon bengali morel bedtime stories point,magical money tree bangla golpo bangla cartoon golpo short bedtime stories bangla youtube cartoon point parental guidance material video may suitable children years age watch videos bengali hope enjoy videos love receive comment feedback subscribe us youtube like us facebook disclaimer point channel videos direct children within mean title cfr childrens online privacy protection act usa intend children years age point channel owners agents representatives employees collect information children years age expressly deny permission third party seek collect information children years age behalf channel point channel deny liability responsibility practice policies youtube agents subsidiaries affiliate third party regard data collection banglacartoon banglagolpo,Film & Animation,Cartoons,"যাদুর টাকার গাছ,magical money tree,টাকার গাছ,money tree,bangla cartoon,bedtime stories,bengali fairy tales,bengali morel stories,thakurmar jhuli new,rupkothar golpo,bengali cartoon,ধাঁধা Point"
-xiIkoON1NU,best fantasy movies new action movies full movie english hollywood sci fi movies,best fantasy movies new action movies full movie english hollywood sci fi movies new action movies best action movies best drama war movies httpsbomtofrvbf new sci fi movies httpsbomtovfevx best hollywood movies please like comment subscribe best hollywood action channel see interest videos thank watch please leave like enjoy tell think comment thank,Film & Animation,Hollywood Movies,"action movies,super action movie 2019,new action movies 2019,action movie 2019,new action movies,action movie,action movies 2019,best action movie 2019,best action movies,action,best action movies 2019,new sci fi movies 2018,new action movie,sci fi movies,best action movie,movies,best sci fi movies 2019,movie 2019,action movies 2019 full movie"
0348Y1jQCW8,upcoming bollywood movies high expectations must watch movies,upcoming bollywood movies high expectations must watch movies many big budget bollywood film set release good content film gear release today mehsaan stardust try include await upcoming movies list detail information let take look bollywood upcoming movies list cast release date mehsaan stardust make video entertain people valuable information anticipate bollywood movies video video anticipate bollywood movies super director vikas bahl star cast hrithik roshan mrunal thakur release date july arjun patiala director rohit jugraj release date july judgementall hai kya director prakash kovelamudi release date july jabariya jodi director prashant singh release date august section director ajay bahl release date august mission mangal director jagan shakti release date august batla house director nikhil advani release date august saaho director sujeeth star cast prabhas shraddha kapoor damini chopra neil nitin mukesh jackie shroff chunky pandey release date august commando director aditya datt release date september laal kaptaan director navdeep singh release date september dream girl director raaj shandilya release date september jhund director nagaraj manjule release date september marjaavaan director milap zaveri release date october war director siddharth anand hrithik roshan tiger shroff vani kapoor release date october sky pink director shonali bose release date october housefull director farhad samji release date october pagalpanti director anees bazmee release date november bhoot part one haunt ship director bhanu pratap singh release date november bala director amar kaushik release date november jawaani jaaneman director nitin kakkar release date november dil bechara director mukesh chhabra release date november panipat director ashutosh gowariker release date december pati patni aur woh director mudassar aziz release date december dabangg director prabhu dheva salman khan sonakshi sinha release date december good news director raj mehta release date december mehsaanstardust highlyexpected please write favorite movie name comment u like video please like dont forget share mehsaan httpswwwyoutubecomcmehsaanstardust play list career analysis hit flop movies list top gross top top videos upcoming movies detail box office news videos social link httpstwittercommehsaans httpswwwfacebookcommehsaanstardust httpswwwredditcomusermehsaanstardust videos channel own mehsaan stardust please note media content use channel entertain people valuable information thank track arm dealer music provide youtube audio library watch,Film & Animation,Bollywood Movies,"25 upcoming bollywood movies of 2019,25 bollywood upcoming movies list 2019,25 most awaited Bollywood movies of 2019,25 upcoming bollywood movies 2019,2019 की 25 सबसे ज्यादा प्रतीक्षित बॉलीवुड फिल्में,upcoming bollywood movies of 2019,2019 upcoming 25 movie list,2019 upcoming movie list,bollywood movies 2019,#MehsaanStardust,dabangg 3,panipat,sahoo,bollywood upcoming movies 2019,upcoming bollywood movies,bollywood movies,bollywood upcoming movies,mehsaan stardust"
04d-hQsW4jA,hollywood horror movies hindi dub full action hd ii dark ii hollywood horror hindi movie,dont afraid dark hollywood movies hindi dub full action hd hollywood movie hindi hollywood movie hindi dub hollywood hindi movie hollywood hindi hollywood hindi dub hollywood dub hindi hollywood dub movies hindi hollywood hindi dub movies hollywood horror hindi movie hindi hindi movie hindi movies hindi dub new hollywood movie new bollywood movie new hindi dub movie horror movie movies action movies punjabi movie latest hollywood,Film & Animation,Horror Movies,"hollywood movies in hindi dubbed full action hd 2020,hollywood movie in hindi,hollywood movie hindi dubbed,hollywood hindi movie,hollywood hindi,hollywood hindi dubbed,hollywood dubbed in hindi,hollywood dubbed movies in hindi,hollywood hindi dubbed movies,hollywood horror hindi movie,hindi,hindi movie,hindi movies,hindi dubbed,new hollywood movie,new bollywood movie,new hindi dubbed movie,horror movie,movies,action movies,punjabi movie,Latest Hollywood"
0U9veZedjkc,old guard official trailer charlize theron action movie hd,old guard official trailer charlize theron action scifi movie hd netflix,Film & Animation,Trailers,"One Media,One,Cinema,Trailer,Official,Movie,Film,2020,The Old Guard,Netflix,Charlize Theron,Action,Sci-Fi"
0UE4cCrz6NQ,samuthirakani tamil full movie latest tamil full movie hd tamil romantic comedy movie full hd,speed audio video sharjah uae subscribe like httpsgooglujswyz samuthirakani tamil full movie latest tamil full movie hd tamil romantic comedy movie full hd,Film & Animation,Romantic Movies,"tamil movies,new release tamil full movies,latest tamil full movie,tamil news live,tamil movie,full tamil movie hd,hd tamil movies,tamil hd songs,new tamil full movies,2018 tamil full movies,new tamil movie,tamil full movie,full tamil movie,tamil online movies,tamil movies 2016,kaali venkat,tamil new movie hd video songs,kaali venkat movies,uruthikol comedy,tamil hd movies,tamil rockers,tamil comedy movies,tamil action movies,sasikumar"
0danYA3zpl8,khooni murda full hindi horror movie deepak parashar sriprada hd,download lehren app download lehren app khooni murda bollywood film direct mohan bhakri star deepak parashar javed khan sriprada movie low budget indian version nightmare elm street movie grade adult certificate nude scenes lead actress shagufta ali body double use shagufta ali shoot fully nude one scene behind label b grade horror movie movie average grosser year direct mohan bhakri cast deepak parashar sriprada shagufta ali kiran kumar others write mohan bhakri anil pandit playback singer kavita krishnamurthy blockbuster superhit hindi movies subscribe lehren movies today httpbitlylehrenmovies log official website httpwwwlehrencom instagram httpswwwinstagramcomlehrennetworks facebook httpswwwfacebookcomlehrennetworks twitter httpstwittercomlehrennetworks pinterest httpsinpinterestcomlehrennetworks google httpsplusgooglecomlehrenco,Film & Animation,Horror Movies,"Khooni Murda,Khooni Murda hindi movie,Deepak Parashar,Sriprada,खूनी मुर्दा,horror hindi movie,hindi full movie,hindi movie songs,hindi hd movie,hindi movie 2016,old hindi movie,classic hindi movie,evergreen hindi movie,superhit hindi movie,blockbuster hindi movie,vintage movies,hindi new movie,youtube movies,hindi old hits,action hindi movies,hindi comedy movies,hindi dubbed movies,romantic hindi movie"
1NTaDm3atkc,happy death day trailer movieclips trailers,happy death day trailer check new trailer star jessica rothe israel broussard ruby modine first watch comment share trailers movie teasersclips drop soon movieclipstrailers buy ticket happy death day watch trailers hot new trailers playlist watch playlist even come soon tree must relive day figure try kill movieclips trailers subscribe snapchat like us facebook follow us fandango movieclips trailers channel destination hot new trailers second drop fandango movieclips trailers team day night make sure hottest new movie trailers available whenever wherever want,Film & Animation,Trailers,"Happy Death Day,Happy Death Day trailer,Half to death,half to death trailer,trailer,2017"
1f-K_MBE1J8,balli thakur new south indian movies dub hindi full movie sudeep priyamani,man dream make easy money fall series complex situations accidentally find gangsters phone,Film & Animation,Bollywood Movies,"balli thakur hindi dubbed movies 2019,balli thakur kannada hindi dubbed movie 2019,sudeep hindi dubbed movies 2019,sudeep kannada movies full hindi dubbed 2019,Priyamani kannada movies full hindi dubbed 2019,Mr Mobile 2 Hindi Dubbed Full Movie,Mr Mobile 2 2019 Hindi Dubbed Full Movie,kannada movies full hindi dubbed 2019,new released full hindi dubbed movie 2019,south indian movies dubbed in hindi full movie 2019 new"
27EmM_wht5c,new action movies full movie english best adventure movies hollywood action movies,new action movies full movie english best adventure movies hollywood action movies subscribe watch video new action movies best action movies best drama war movies httpsbomtofrvbf new sci fi movies httpsbomtovfevx best hollywood movies please like comment subscribe best hollywood action channel see interest videos thank watch please leave like enjoy tell think comment thank,Film & Animation,Hollywood Movies,"action movies,super action movie 2019,new action movies 2019,action movie 2019,new action movies,action movie,action movies 2019,best action movie 2019,best action movies,action,best action movies 2019,new sci fi movies 2018,new action movie,sci fi movies,best action movie,movies,best sci fi movies 2019,movie 2019,action movies 2019 full movie"
2M-KjwTOV5E,black water wilderness horror film hd full movie suspense,black water wilderness happen mix deliverance friday touch breakfast club result black water wilderness black water wilderness director michael william gordon writers michael william gordon adam david hunnicutt star bailey blaise alaina boukedes jasmine cunningham genres horrorsuspense runtime country usa language english release date april usa also know blackwater wilderness storyline happen mix deliverance friday touch breakfast club result black water wilderness pulsate pound action horror set frighten dark backwoods alabama go camp woods never review im big fan find footage film saw movie back youtube see anything quite like sinceor even start basic group friends camp creepy woods film progress something totally unexpected incredible write debra follow us twitter httpstwittercomboohtv support us membership movies classic horror thriller zombie movies playlists watchfree horrormovies fullmovies copyright film publish us legally license acquire right least specific territories rightholders contract question please send email infoamogode amogo networx avod channel network wwwamogonetworxcom,Film & Animation,Horror Movies,"Black Water Wilderness Full movie,#suspensemovies,free scary movies,free movie on youtube,imdb,imdb movies,imdb free movies,free movies,movies,#horrormovies,scary movies,full horror movies,free horror movies,scary movies full movie to watch,full movies,full movies horror,free full movies,free movie on youtube full movie,horror movies full movies,free youtube movies,free horror movies on youtube full length,suspense movies,horror movies full movies english"
2uighS4u_ZU,poonam full movie hindi hd movie raj babbar poonam dhillon shakti kapoor bollywood movie,watch superhit hindi movie poonam star poonam dhillon raj babbar shakti kapoor madan puri jeevan kushboo pankaj dheer director harmesh malhotral producer harmesh malhotra,Film & Animation,Bollywood Movies,"Poonam Full Movie,Poonam Dhillon movie,Raj Babbar movie,Shakti Kapoor movie,Madan Puri movie,Jeevan movie,Pankaj Dheer movie,latest hindi movies,latest bollywood movies,superhit hindi movies,superhit bollywood movies,latest hindi movie 2019,latest bollywood movies 2019,latest hindi hd movies 2019,latest bollywood hd movies 2019"
3NYq60fydKo,tenet official trailer robert pattinson christopher nolan movie hd,tenet official trailer robert pattinson christopher nolan movie hd subscribe rapid trailer latest movie trailers like us facebook follow us twitter arm one word tenet fight survival entire world protagonist journey twilight world international espionage mission unfold something beyond real time,Film & Animation,Trailers,"Tenet,Trailer,Tenet Trailer,Tenet Trailer 2,Movie,2020,Robert Pattinson,Christopher Nolan,Sci-Fi,Sci-Fi Movie,Official,International,Film,Clip,TV Spot,Tenet (Movie),Trailers 2020"
3WJW5rjH_zA,naba rag bengali romantic movie full hd uttam kumar suchitra sen,watch bengali full movie naba rag youtube bengali film naba rag release year direct bijoy bose star uttam kumar suchitra sen bikash roy jahor roy nimu bhowmick basabi nandi kanika mozumdar others subscribe bengali songs channel unlimited bengali movie video songs httpswwwyoutubecomangelsongs movie naba rag language bengali genre classic romance producer girindra singha director bijoy bose story ashutosh mukherjee music director hemanta mukherjee lyricist rabindranath tagore playback sandhya mukhopadhyay sumitra sen release star cast uttam kumar suchitra sen bikash roy jahor roy nimu bhowmick basabi nandi kanika mozumdar ajanta chowdhury jhuma mukherjee amit roy dhiraj das bijon bhattacharya montu banerjee nirmal ghosh raja mukherjee robin mukherjee click watch videos trijama bengali full movie naba rag bengali movie video jukebox synopsis reena honest beautiful tomboy type village girl live grandfather east bengal develop close relationship simple style live partition india create problems reena come kolkata maternal uncles home face totally different scenario lifestyles different able adjust properly social gather local entrepreneur mr bagchi observe begin like reena get marry together bless child reena comfortable child value system psychology complication bear story different perspectives force live life together bond relationship click watch videos bengalimovie banglamovie bengalifullmovie banglamovies newbengalimovie superhitbengalimovie tollywoodhitmovies bengaliletestmovie latestbengalimovie bengalidramamovie bengalioldhitmovie tollywoodmovies bengalitophitsmovies banglaromanticfilm banglanewmovies bengaliactionmovies enjoy stay connect us watch favourite bengali movies subscribe unlimited entertainment httpswwwyoutubecomangel official website httpswwwangeldigitalcoin like us facebook httpswwwfbcomangeldigitalvideos twitter circle us g httpsplusgooglecomangeldigitalvideos,Film & Animation,Romantic Movies,"uttam kumar full movie,uttam kumar movies,উত্তম কুমারের বই,সুচিত্রা সেন,suchitra sen movies,uttam suchitra movies,nabarag bengali movie,nabarag bangla movie,nabarag full movie,old bengali movie,old bangla movie,bengali romantic movie,bangla romantic movie,bangla boy,bangla boi,bangla cinema,উত্তম কুমার,বাংলা সিনেমা,বাংলা বই,bengali classic movie,bangla classic movie,bengali hd movie,bangla hd movie"
3bCTkvZbs8A,magic portal astrolology cartoon cartoon children pop teen toons,funny cartoon compilation astrolology show click funny cartoon compilation astrolology doctor series click funny cartoon compilation astrolology love hack click funny cartoon compilation christmas episodes astrolology videos click hello welcome pop teen toons find variety funny quirky cartoon audience age show astrolology astrolology comedy webseries base members greek zodiac gaze wonder colourful series feature nonverbal universal character wacky personalities relationships show plenty fun create teens adults world,Film & Animation,Cartoons,"AstroLOLogy cartoon,magic portal,AstroLOLogy new episodes,cartoons for kids,cartoons for children,astrolology,AstroLOLogy 2020,astrolology 2020,games night,superhero marvels,video games,magic portal to jurassic world,superhero cartoon,astroLOLogy full episodes,funny cartoons,astrolology cartoon crush,astrolology superhero,star signs,horoscope,leo,Aries,taurus,pisces,sagittarious,kartun untuk anak anak,kartun superhero,kartun film,astrolology funny,kids"
