video_id,title,description,category,sub_category,tags
Dnqw94Az5hw,horror movies marathon south hindi dub movies pottu ek tantra maya mall bhoot ka khel,horror movies marathon south hindi dub movies pottu ek tantra maya mall bhoot ka khel moviesmarathon pottuektantra mayamallbhootkakhel enjoy super hit movies collection jaya jaanki nayaka khoonkhar phir hera pheri sher ka shikaar haseena parkar favorite bollywood movies subscribe subscribe best bollywood clip movies scenes pen multiplex channel favorite gujarati movies subscribe actionpacked movies click link pen action download app latest news gossip log official website httppenindiain enjoy stay connect us like us facebook httpswwwfacebookcompenmovies follow us twitter httpstwittercompenmovies follow us instagram httpswwwinstagramcompenmovies miss favourite love songs call dtmcable operator activate ilove music tv channel den siti cable hathway gtpl incable fastway airtel tatasky,Film & Animation,Horror Movies,"Horror Movies Marathon,south horror movies,Pottu Ek Tantra,Maya Mall Bhoot Ka Khel,pottu ek tantra,maya mall bhoot ka khel full movie in hindi dubbed,Movies Marathon,South Hindi Dubbed Movies 2020,south indian movies dubbed in hindi full movie 2020 new,south indian movies dubbed in hindi full movie,horror movies in hindi,telugu dubbed movies,new hindi movie,hindi dubbed movies 2020,pen movies,south movies,hindi movies"
ESHd_-gUBGc,ms dhoni untold story full movie sushant singh rajput disha patani kiara advani,watch ms dhoni untold story full movie full hd ms dhoni untold story indian hindilanguage biographical sport film write direct neeraj pandey base life former test odi captain indian national cricket team mahendra singh dhoni film star sushant singh rajput dhoni along disha patani kiara advani anupam kher film chronicle life dhoni young age series life events msdhonitheuntoldstory msdhoni sushantsinghrajput dishapatani kiaraadvani,Film & Animation,Bollywood Movies,"ms dhoni,ms dhoni full movie,ms dhoni the untold story full movie,ms dhoni the untold story,ms dhoni the untold story movie,ms dhoni the untold story full movie in hindi,ms dhoni the untold story full movie hd 1080p,ms dhoni full movie in hindi,ms dhoni full movie hd,ms dhoni full movie hd 1080p,ms dhoni movie,ms dhoni hindi movie,ms dhoni hd full movie,ms dhoni hd movie,ms dhoni hd,Sushant Singh Rajput,Disha Patani,Kiara Advani,Anupam Kher"
Edr6_-L3bi4,scoobydoo scaredy cat scooby shaggy classic cartoon compilation wb kid,easily duo get scar watch find wb kid home favorite clip feature character looney tune scoobydoo tom jerry available digital wb kid scoobydoo classiccartoon videos game activities warner bros relate character elements warner bros entertainment inc,Film & Animation,Cartoons,"Scooby-Doo!,Tom and Jerry,Looney Tunes,Bugs Bunny,Compilation,Cartoons,Classic Cartoons,Animation,full episodes,Scooby doo where are you,chuck jones,Mel Blanc,Spike the Dog,Daffy Duck,Porky Pig,Coyote & Roadrunner,CLASSIC2018,SD2018,FRIENDSHIP2018,SCOOBYSHAGGY,Scooby & Shaggy,Scobby Doo,Shaggy,tom y jerry,warner bros,meddling kids,scooby snacks,mystery inc,mystery machine,chase scene"
EtBhKTuPjEk,newness trailer movieclips trailers,newness trailer check new trailer star nicholas hoult laia costa danny huston first watch comment share trailers movie teasersclips drop movieclipstrailers c watch trailers hot new trailers playlist watch playlist indie trailers channel contemporary la two unacquainted millennials spend weekend swipe date app winx options endless less connection hookingup martin gabi meet find talk early hours connect excite new exhilarate rush relationship go date move together skip work make love love new film acclaim director drake doremus like crazy equal newness star nicholas hoult laia costa danny huston pom klementieff matthew gray gubler movieclips trailers subscribe trailers like us facebook follow us twitter snapchat fandango movieclips trailers channel destination hot new trailers second drop fandango movieclips trailers team day night make sure hottest new movie trailers available whenever wherever want,Film & Animation,Trailers,"newness,newness trailer,2017,newness movie,drake doremus,ridley scott,nicholas hould,laia costa,danny huston,matthew gray gubler,pom klementieff,albert hammond jr.,jessica henwick,los angeles,LA,millennials,hook up culture,love,dating,dating apps"
F0x5UOXmeXM,bernard bear fish min compilation cartoon children,bernard decide go fish find easy think little little able catch fish unexpected creature appear surprise subscribe bernard bear httpwwwyoutubecomsubscriptioncenteradduserbernardbear meet curious polar bear travel around world without know rule want see content bernard get httpsplaygooglecomstoreappsdetailsidcomadnstreambernip follow bernard facebook httpwwwfacebookcombernardbearofficial animakids httpanimakidscomenshowsbernard google bernard httpsplusgooglecombrbplaybernardbearposts like brb internacional facebook httpswwwfacebookcombrbinternacional follow brb internacional twitter httpstwittercombrbint add brb internacional google tumblr brb httpbrbinternacionaltumblrcom meet curious polar bear travel around world without know rule even something simple take picture face rainstorm turn everyday natural situations funny difficult challenge internacional sa screen ebs rg animation,Film & Animation,Cartoons,"cartoon,episodes,animation,funny,story,kids,films,dibujo animado,episodios,animación,divertido,historia,niños,películas,Folgen,lustig,geschichte,kinder,Filme,desenhos animados,episódios,animação,engraçado,história,miúdos,filmes,full episodes,episodios completos,Syu-peo Ppae-kkom:,Seu-pa-i Dae-jak-jeon,大衛貝肯之倒霉特工熊,大卫贝肯之倒霉特工熊,Медведь Бэкком: Агент 008,大衛貝肯之倒霉特工熊3D (大卫贝肯之倒霉特工熊3D),backkom,backkom 008,008,mr dinku,fishing,sea,water,fish,rod"
F42BGe2ej8Q,new south indian movies dub hindi full south movierashmika mandanna hindi dub movie,new south indian movies dub hindi full south movie rashmika mandanna hindi dub movie south indian movies dub hindi full movie new south indian movies dub hindi full movie new new south indian movies dub hindi full new south indian movies dub hindi full south movie south movie hindi rashmika mandanna hindi dub movie new south indian movies dub hindi full bhishma full movie new south indian movies dub hindi full new movies new movies love story new movies hindi dub keerthi suresh movies dub hindi rashmika mandanna hindi dub movie,Film & Animation,Bollywood Movies,"new south indian movies dubbed in hindi 2020 full,new south indian movies dubbed in hindi 2019 full,south indian movies dubbed in hindi full movie 2020 new,south indian movies dubbed in hindi full movie 2019 new,south movie,rashmika mandanna hindi dubbed movie"
FLKDmVOrN-w,ravimama kannada romantic movies full superhit kannada movies ravichandran nagma,ravi mama indian kannada language romancedrama musical film direct narayan produce k raju film star v ravichandran nagma lead roles film remake hindi blockbuster film aaj ka arjun star amitabh bachchan jayaprada lead roles inturn remake tamil film en thangachi padichava film release march across karnataka cinema halls receive well soundtrack score chaitanya l n shastry receive well subscribe us latest kannada movies trailers like us facebook httpswwwfacebookcomsuperhitkannadamovies follow us twitter httpstwittercomiamindiancinema like us google plus httpsplusgooglecomkannadabiscoot,Film & Animation,Romantic Movies,"Ravimama full movie,Ravimama,Ravimama kannada full movie,Nagma,Hema,Doddanna,Shivakumar,ravichandran,kannada,kannada songs,ravichandran movies,ravichandran full movie,ravichandran kannada movies full,ravichandran new kannada movies,Kannada Romantic Movies Full,Superhit Kannada Movies,new kannada movies full,latest kannada movies,new kannada movies full 2016,kannada hd movies,kannada movies,kannada new movies full 2016,kannada hit movies,ರವಿಮಾಮ"
FSlrozppess,relative worlds romantic full hd anime movie english sub subscribe videos,ashita sekai ga owaru toshitemo anime movie english sub hd romantic anime movie subscribe relative worlds ashita sekai ga owaru toshitemo therelativeworlds bestanimemovies bestanimeseries animemovies romanticanimemovies,Film & Animation,Romantic Movies,"Bestanimemovies,Bestanimeseries,Animemovies,Romanticanimemovies"
GEghPdHtM8g,rumah belanda horror film movies,raya author hire millionaire call hilda write biography aline get send live mansion write book peace two children become haunt target mysterious entity realise house hold deep dark secret raya set uncover mystery behind follow us fb twitter instagram association divo httpswwwfacebookcomdivomovies httpswwwtwittercomdivomovies httpswwwinstagramcomdivomovies,Film & Animation,Horror Movies,"hollywood,film,tamil,cinema,action,thriller,crime,horror film,2018 horror film,indonesian movie,ghost movies,hollywood movies,horror movie,2018,short horror film,trailer,horror,trailer 2018,international,tv spot,short,official,full movie,Rumah Belanda,rumah belanda full movie,rumah belanda di bandung,rumah belanda di indonesia,best horror,short horror movie,horror channel,evil horror movie,horror movies 2018,horror stories,short form,horror movies"
GK4YolHRKoc,tootoo boy miss key new episode cartoon animation children videogyan kid show,subscribe tootoo boy miss key new episode cartoon animation children videogyan kid show series feature tootoo boy various stint day day life episodes build around different object invite trouble fiddle majorly involve gag funny incidents grow boy carelessness zool baby series playlist,Film & Animation,Cartoons,"tootoo boy,tootoo boy missing key,tootoo boy cartoon,cartoons for children,videogyan kids shows,funny cartoons for children,cartoon for kids,cartoons for kids,cartoon for children,youtube cartoons,baby cartoons,kids cartoons,funny cartoon,funny cartoons,kids shows,cartoon animation for children,full episode,new episode,cartoons for babies,animated cartoon,tootoo,comedy,episode,cartoon,animation,cartoons,funny,cartoon shows,videos for kids,preschool"
GaoIWG51ZTc,force nature official trailer mel gibson kate bosworth movie hd,force nature official trailer mel gibson kate bosworth movie hd subscribe rapid trailer latest movie trailers like us facebook follow us twitter gang thieve plan heist hurricane encounter trouble cop try force everyone build evacuate,Film & Animation,Trailers,"Force Of Nature,Trailer,Force Of Nature Trailer,Movie,2020,Mel Gibson,Kate Bosworth,Action,Action Movie,Official,International,Film,Clip,TV Spot,Force Of Nature (Movie),Trailers 2020"
HIT_ulXX-6w,old guard trailer movieclips trailers,check new trailer old guard star charlize theron let us know think comment want notify latest indie movies subscribe channel click bell icon stay date us release date july star charlize theron chiwetel ejiofor harry melling direct gina princebythewood synopsis group mercenaries centuriesold immortals ablity heal discover someone onto secret must fight protect freedom watch trailers hot new trailers actionscifi trailers new tv trailers fuel movie obsession subscribe movieclips trailers watch movieclips originals like us facebook follow us twitter follow us instagram fandango movieclips trailers channel deliver hot new trailers teasers sneak peek best upcoming movies subscribe stay date everything come theaters favorite stream platform,Film & Animation,Trailers,"The Old Guard,The Old Guard Trailer,The Old Guard Movie Trailer,The Old Guard Trailer 2020,The Old Guard Official Trailer,Trailer,Trailers,Movie Trailers,2020 Trailers,The Old Guard Trailer 1,Movieclips Trailers,Movieclips,Fandango,Entertainment,Movies,Gina Prince-Bythewood,Charlize Theron,Chiwetel Ejiofor,Harry Melling,Fantasy,Action"
HeoLiTirRp4,men want official trailer paramount picture,check official trailer whatmenwant star taraji p henson theatres february facebook httpswwwfacebookcomwhatmenwantmovie twitter httpstwittercomwhatmenwant instagram httpswwwinstagramcomwhatmenwant paramount picture corporation ppc major global producer distributor film entertainment unit viacom nasdaq viab via home premier global media brand create compel television program motion picture shortform content apps game consumer products social media experience entertainment content audiences countries connect paramount picture online official site httpwwwparamountcom facebook httpswwwfacebookcomparamount instagram httpwwwinstagramcomparamountpics twitter httpstwittercomparamountpics youtube httpswwwyoutubecomuserparamount,Film & Animation,Trailers,"what men want,taraji p henson,will packer,adam shankman,james lopez,will packer productions,comedy,paramount players,max greenfield,aldis hodge,tracy morgan,erykah badu,kellan lutz,shaq,mark cuban,shaquille oneil,grant hill,pete davidson,funny,movie,trailer,official,paramount,taraji"
HqLw_WnfKwM,shalini full movie hd hindi dub full horror movie horror movies hindi,shalini full movie hd hindi dub full horror movie horror movies hindi,Film & Animation,Horror Movies,"Shalini Full Movie In Hd,Hindi Dubbed Full Horror Movie 2020,Horror Movies In Hindi,Shalini 2,New Release Full Horror Hindi Dubbed Movie 2019,South Action movies in Hindi dubbed,shalini full horror movie in hindi,shalini full movie,Shalini part 2 full horror movie scene,Mummy Hindi Dubbed Movie,new hindi dubbed horror movies 2018 full movies,2018 new hindi dubbed movies,south indian movies dubbed in hindi full movie 2018 new,horror scenes 2018,best horror scenes"
HrmDYrpGxl0,dont open eye free full movie horror l suspense,apathetic home hospice nurse learn share sinister connection mysterious old woman care force confront darkness never could imagine direct dmitry yun star tom kemnitz jr gergana mellin jamie carroll edit youtube ad standards popcornflix movies free youtube action romance horror crime drama comedy western popcornflix channel page watch free movies tv series popcornflixcom popcornflix app available roku amazon firetv ios android chromecast appletv popcornflix full length free movies tv series like us facebook httpswwwfacebookcompopcornflix follow us twitter httpstwittercompopcornflixnews popcornflix ownedoperated screen media venture,Film & Animation,Horror Movies,"dont open your eyes,dont open your eyes full movie,dont open your eyes movie,popcornflix full movies horror,popcornflix horror movies,popcornflix free horror movies,free movie on youtube,Popcornflix,free full length movies to watch on youtube,Full movies English,popcornflix full movies,free full movie,free horror movies,free horror movies on youtube full length,free horror movies on youtube full movies,suspense movies,horror movies,horror movies full movies"
HywMXZ7i2Q0,nate mistake infamous criminal animate cartoon character animate short film,nate mistake famous criminal nate want cakeman nate join contest lose city nate ants train police force secret life nate subscribe watch newest videos watch pencilmation popular upload compilations cartoon family dont fall watch nate pencilmate walk sit back relax nate pencilmate nate pencilmate traditional framebyframe animation channel many storytelling videos character name nate pencilmate join along cool journey everywhere nate pencilmate gon na provide various kind cartoon animate short film animate short cartoon film funny cartoon compilation funny animate cartoon say need notice cartoon make everyone viewer discretion adviced beside kind variety also hilarious cartoon compilation short animate film best cartoon movies cartoon short story pencil cartoon pencil cartoon animation hope enjoy natepencilmate animatedcartoonscharacters animatedshortfilms pencilmate woavideos pencilmation pencilcartoon cartoonscompilation cartoon animation woacartoon funny funnycartoons episode make use animation technique create fat media own sconnect co ltd audiojunglenet licence creative commons attribution,Film & Animation,Cartoons,"Nate Pencilmate,Nate pencilmation,animated short films,animated cartoons characters,pencilmation cartoon,cartoon series,2d animation,funny animation,stick figure,stick figure animations,funny shorts,family fun,family cartoon,movie animation,animation,Animation pencil drawing,drawing animation,pencil animation,funny cartoon,funny videos,criminal,thief,police"
I1AmD3uto5k,top horror movies watch,horror movies film filme scary must see watch recommendation best top creepy horror bestmovies trailers,Film & Animation,Horror Movies,"best,movies,horror,must,see,watch,full,movie,length,top,list,liste,filme,filmovi,horor,die,besten,beste,films,great,thriller,suspense,BestMovies,mystery,action,comedy,science,fiction,scary,creepy"
JJn-gLLauMo,hollywood hearts official extend trailer,hollywood hearts premier bet october star bobby v dc young fly carl payne benzino lyfe jennings patrice fisher walnette santiago willie hyn asia spark direct tangie b moore production company tier film executive producers ric atari tangie b moore courtney stewart bobby v music artist whos engross music industry lifestyle find difficult give ways woman love,Film & Animation,Hollywood Movies,"Hollywood Hearts,Tier 2 Films,Bobby V,Tangie B. Moore,Ric Atari,BET,Magnolia Films,DC Young Fly,Almost Christmas,Will Packer,Drama,Romantic,Comedy,Willie Hyn,Carl Payne,Benzino,Love And Hip Hop,Walnette Santiago,Lyfe Jennings,Patrice Fisher,Asia Sparks,Blu Kolla Dreams,Real Husbands Of Hollywood,#RHOH,Gary Owen,Douchebag,Couple's Therapy,2015,2016,2017,BET Hip Hop Awards,Metropolis,If U Love Her,Please,Kate Barnette,A Thousand Times"
JQbNWyNziHM,pencilmates science experiment animate cartoon character animate short film pencilmation,pencilmates new judge science fair new inventions discover subscribe pencilmation merchandise httpsteespringcomstorespencilmation watch newest videos follow pencilmation facebook httpsfacebookcompencilmation instagram httpswwwinstagramcompencilmationofficial watch pencilmation popular upload httpswwwyoutubecom compilations cartoon love burp pencilmate love soda effect come office cant refuse pencilmates boss wont let stop work everything break pencilmate soaplessly devote pencilmate drop soap get back mermaid honor pencilmate catch hungry mermaid big bad piggy hell huff puff blow house oh note mysterious note wreak havoc pencilmation world dumbbell dummy pencilmate get beat dumbbell game split hare pencilmate get magic hat rabbit come pencilmates science experiment animate cartoon character animate short film pencilmation pencilmation pencilmation cartoon channel everyone especially nottooserious grownups make love lot fun international team helm ross bollinger start channel alone room long time ago follow new wacky often time quite silly adventure pencilmate little blue man pencilmiss toons every tuesday thursday saturday pencilmation animatedshortfilms animatedcartoonscharacters foodanimation funnyvideos comedy comedyvideos cartoonmovie funnyclips compilation animation cartoon pencilmate pencilmiss funnycartoon splendidcartoon cartoonseries newcartoon fun america,Film & Animation,Cartoons,"pencilmation,animated short films,animated cartoons characters,pencilmate,pencil animation,youtube cartoons,animation,cartoons,pencil,animated shorts,animated cartoon,funny cartoon,splendid cartoon,funny clips,pencilmation cartoons,ross bollinger,pencil mation,pencilmiss,cartoon series,2d animation,funny animation,stick figure,stick figure animations,funny video,animation characters,pencilmation harry potter"
JQfjW0DLDr0,unfriended official trailer horror movie hd,subscribe trailers subscribe come soon subscribe indie trailers httpgooglipuuo like us facebook follow us twitter unfriended official trailer horror movie hd usher new era horror universal picture unfriended unfold teenager computer screen friends stalk unseen figure seek vengeance sham video lead vicious bully kill year earlier unfriended theaters april movieclips trailers channel destination hottest new trailers second drop whether latest studio release indie horror flick evocative documentary new romcom youve wait movieclips team day night make sure best new movie trailers moment theyre release addition movie trailers channel youtube deliver amaze engage original videos week watch exclusive ultimate trailers showdowns instant trailer review monthly mashups movie news much keep know movieclips love movies much,Film & Animation,Horror Movies,"movieclips,movie clips,movieclipstrailers,new trailers,trailers HD,hd,trailers,trailer,2014,official,HD,unfriended,unfriended movie,unfriended trailer,cybernatural,horror,thriller,horror movie,scary movie,high school,skype,video chat,classmate,death,video,online,vchan,web chat"
JSCF7qP9R6c,hollywood prosthetics make tv movies,take look behind camera see movie magic happen makeup department black panther snl heres compilation impressive prosthetics favorite tv show movies insider team believe life adventure subscribe channel visit us httpsthisisinsidercom insider facebook httpswwwfacebookcomthisisinsider insider instagram httpswwwinstagramcomthisisinsider insider twitter httpstwittercomthisisinsider insider snapchat,Film & Animation,Hollywood Movies,"INSIDER,Entertainment Insider,Hollywood,prosthetics,movies,tv,Game of Thrones,SNL,Saturday Night Live,Black Panther,Uncle Drew,Westworld,Wonder,Erik Killmonger,CGI,makeup,Darkest Hour"
JevQlOFU4hg,dawn official trailer horror movie hd,dawn official trailer horror movie hd kaleidoscope entertainment comedy kid family animate film blockbuster action cinema blockbuster scifi movie fantasy film drama keep know subscribe catch best movie trailers latest official movie trailer film clip scene review interview,Film & Animation,Horror Movies,"Cinema,Trailer,Official,Movie,Film,THE DAWN,THE DAWN trailer,2020"
JmhxUlt8Iy4,zig sharko zig little sailor sea compilation cartoon children,shark mermaid cartoon kid full episodes ready zig little sailor zig e sharko desenhos para criancas con pequeno marinheiro subscribe channel cartoon httpbitlyzigsharkotv watch zig sharko episodes httpbitlyzsvideo new episodes shark episodes httpbitlyzigbigsmile popular episodes httpbitlyzigrobot latest episodes httpbitlyzigcompilhair check new pencilmation channel httpbitlypencilmationtv desert island live starve hyena one obsession devour delicious mermaid rock lagoon ah lovely fishgirl best friend shark shark lot muscle love sabotage hyena every move season mermaid decide set house beach invite deepsea buddies join stake raise hyena win back turf cartoon funnycartoons animation sailor sea beach,Film & Animation,Cartoons,"new compilation,funny compilation,2019 compilation,kids compilation,cartoon compilation,new season,pencilmate,pencilmiss,pencil cartoons,pencil animations,compilation,zig and sharko,cute,writing,house,stamp,Zig and sharko,shark,mermaid,bernie,cartoon,sailor,beach,sea"
JsBDJTTZkmg,sandra brown white hot hallmark romantic movies,sandra brown white hot hallmark romantic movies,Film & Animation,Romantic Movies,"hallmark movies,hallmark romantic movies,romantic movies"
KFcxGHjaa_4,new action movies full movie english hollywood fantasy movies best action movies,new action movies full movie english hollywood fantasy movies best action movies new action movies full movie english hollywood fantasy movies best action movies,Film & Animation,Hollywood Movies,"NEW Action Movies,Action Movies 2019,Best Action Movies,Hollywood Fantasy Movies,Fantasy Movies 2019,Movie English"
KGWDJFus_f8,tootoo boy ketchup episode cartoon animation children videogyan kid show comedy series,subscribe tootoo boy ketchup episode cartoon animation children videogyan kid show series feature adventure tootoo boy various stint day day life zool baby series playlist,Film & Animation,Cartoons,"tootoo,tootoo boy,videogyan kids shows,ketchup episode,cartoons for kids,youtube cartoons,funny cartoons for children,baby cartoons,cartoon for kids,funny cartoons,cartoon animation for children,kids shows,kids cartoons,animated cartoon,funny cartoon,cartoons for babies,cartoon shows,children animation,tootoo boy cartoon,videos for kids,funny aminated cartoon,cartoon (tv genre),cartoon for children,new episode,cartoons for children,full episode"
KQ3pJh0qjzQ,zig sharko zig sharko clash cash compilation cartoon children,shark mermaid cartoon kid full episodes zig sharko clash zig e sharko desenhos para criancas con choque subscribe channel cartoon httpbitlyzigsharkotv watch zig sharko episodes httpbitlyzsvideo new episodes shark episodes httpbitlyzigbigsmile popular episodes httpbitlyzigrobot latest episodes httpbitlyzigcompilhair check new pencilmation channel httpbitlypencilmationtv desert island live starve hyena one obsession devour delicious mermaid rock lagoon ah lovely fishgirl best friend shark shark lot muscle love sabotage hyena every move season mermaid decide set house beach invite deepsea buddies join stake raise hyena win back turf cartoon funnycartoons animation waiter dinner restaurant,Film & Animation,Cartoons,"new compilation,funny compilation,2019 compilation,kids compilation,cartoon compilation,new season,pencilmate,pencilmiss,pencil cartoons,pencil animations,compilation,zig and sharko,cute,writing,house,stamp,Zig and sharko,shark,mermaid,bernie,cartoon,clash,fight"
