video_id,title,description,category,sub_category,tags
jyYeGQCXKyU,conjure new latest horrorthriller full movie continous moviez,hello viewrs saturday premier today back horror menia introduce conjure universe third movie conjure series saturday premier present conjure thedevilmadetodoit newhorrormovie horriblethrill check hit sunday blockbuster wrong turn shudder bloodshot meghttpsyoutubeowwlxkektg chapter ii nun thank watch movie hit like share friends comment dont forget subscribe continous moviez continousmoviez continous production,Film & Animation,Horror Movies,"Conjuring,Conjuring 3 Full movie,Conjuring 2,Horrors movie 2020,New Horror movie 2020,New Hollywood Horrors movie,Conjuring Horror scenes,New upcoming Horrible movie,Horror Full movie,Continous moviez,continousmoviez,conjuring 3 free movie,conjuring full movie,conjuring 2020 full movie,conjuring 3 2020 full movie,the nun,conjuring 2 full movie,conjuring 3 full movie in hindi,conjuring 3 in tamil,conjuring 3 trailer official,conjuring 3 release date"
kLbSqf9QJzQ,halloween special horror movies marathon hindi dub movies mahal ke andar khiladi khel ka,halloween special horror movies marathon hindi dub movies mahal ke andar khiladi khel ka pen movies bring something spooky halloween ghost ghouls horror stories ready horrify experience spooktacular halloween mahal ke andar khiladi khel ka shiva superhero halloweenspecial horrormovies moviesmarathon enjoy super hit movies collection jaya jaanki nayaka khoonkhar phir hera pheri sher ka shikaar haseena parkar favorite bollywood movies subscribe subscribe best bollywood clip movies scenes pen multiplex channel favorite gujarati movies subscribe actionpacked movies click link pen action download app latest news gossip log official website httppenindiain enjoy stay connect us like us facebook httpswwwfacebookcompenmovies follow us twitter httpstwittercompenmovies follow us instagram httpswwwinstagramcompenmovies miss favourite love songs call dtmcable operator activate ilove music tv channel den siti cable hathway gtpl incable fastway airtel tatasky,Film & Animation,Horror Movies,"halloween special,horror movies marathon,horror movies 2019,horror movies marathon 2019,new released hindi dubbed movies 2019,hindi dubbed movies 2019,shiva the superhero 3,raju gari gadhi 2,mahal ke andar,khiladi khel ka,dubbed horror movies,horror dubbed movies in hindi,hindi dubbed movies,horror movies in hindi,horror dubbed movie 2019,amavas horror movie,airaa horror movie,u turn movie,south movies dubbed in hindi,pen movies"
kWpiur1VeQc,ways get hollywood cinematic film look dslr,tip create cinematic film look dslr buy fog machine buy atmosphere aerosol airpods review use fog gear use make videos canon mkii canon eos r httpsgeniuseosrm favorite prime lens favorite zoom lens favorite mic httpgeniushbled complete gear list best deal camera gear amazon top deal httpgeniusamzdeals bh deal zone buy sell use camera gear httpsgeniusarmando shop store gear focus httpsgeniusarmandogearshop follow twitter httpstwittercommondobytes instagram httpinstagramcommondobytes facebook httpswwwfacebookcommondobytes music music track hear videos come epidemic sound merchandise tshirt design think look cool love wear youre interest buy visit store httpsteespringcomstoresmondobytes affiliate disclosure link use description direct amazon amazon associate earn qualify purchase additional cost,Film & Animation,Hollywood Movies,"cinematic,cinematic footage,cinema film look,film look,premiere pro,adobe,adobe premiere,adobe premiere pro,more cinematic,how to make my footage look cinematic,how to get the film look,color correction,color grading,cinematic film look tutorial,improve my footage,hollywood look,dslr,fog,atmosphere aerosol"
ka70yX1QS9U,new release kolkata bangla movie bangla romantic new movie new bengali movie full,torchlight new release full bengali movie,Film & Animation,Romantic Movies,"torchlight full movie,Bangla movie,Bangla movies,bollywood movies,Bangla movie 2020,Bangla film,south movie,south movie 2020,new south,Sadha,Riythvika,Thirumurugan"
kqNagEJ_Fns,jeene ki arzoo full movie mithun chakraborty movie rakesh roshan hindi movie bollywood movie,superhit hindi movie jeene ki arzoo star mithun chakraborty rati agnihotri rakesh roshan sujit kumar rajendra nath jagdeep bindiya goswami producer kumaran saravanan balasubramaniam director raja shekar,Film & Animation,Bollywood Movies,"Jeene Ki Arzoo Full Movie,Mithun Chakraborty movies,mithun chakraborty snake movie,Rati Agnihotri movies,Rakesh Roshan movies,Bindiya Goswami movies,hindi movies,bollywood movies,indian movies,latest hindi movies,latest bollywood movies,superhit hindi movies,superhit bollywood movies,hindi snake movies,bollywood snake movies"
ky2-Hlpm8uo,neighbour full movie hd hindi horror movie shakti kapoor shyam ramsay horror movie,hindi horror movie neighbour vampires bollywood horror movie star arbaaz ali khan shakti kapoor sunny singh hritu gavie chahal rufy khan kirti vaidhya roushika reikhi producer shyam ramsay director shyam ramsay,Film & Animation,Horror Movies,"Neighbours full movie,Neighbours They Are Vampires full movie,Vampires movies,vampire horror movies,vampire hindi horror movie,hindi horror movie,bollywood horror movie,indian horror movie,best hindi horror movie,Shakti kapoor horror movies,shakti kapoor movies,horror movies,indian hindi movies,bollywood movies,latest hindi horror movies,latest bollywood horror movies,shyam ramsay horror movies,shyam ramsay movies,latest hindi hd full movie"
l3-rHn58Grs,ratatat zombie scare night best cartoon new collection chotoonz kid funny cartoon videos,ratatat zombie scare night best cartoon new collection chotoonz kid funny cartoon videos afraid ghost zombies mice brothers try play check plan time enjoy funny bestepisode collection rat tat exclusively enjoy brothersday funny mice brothers watch best episodes collections every mondays subscribe channel new videos every week subscribe chotoonz channel click welcome official chotoonz tube channel subscribe watch new funny episodes enjoy hilarious comedy ratatat everyday chotoonz specials every wednesdays cartoon like chotoonz httpswwwfacebookcomchotoonz pin chotoonz httpsinpinterestcomchotoonz follow chotoonz httpstwittercomchotoonz chotoonz tumblr httpschotoonztvtumblrcom chotoonz instagram httpswwwinstagramcomchotoonztv httpsinpinterestcomchotoonz chotoonz tv complete online kid cartoon channel chotoonz best content kid feature character show ratatat one best slapstick comedy cartoon series cat keet om rabbitschai chai amongst others watch episodes free come visit us wwwchotoonztv,Film & Animation,Cartoons,"cartoons,rat a tat,funny cartoons,Tom,Animation,Jerry,splendid cartoon,zombie scare,cartoon movies,ghost,chotoonz tv,slapstick,cartoons for kids,crazy cartoon,night,cartoons for children,fun,best,new collection,zombie,cartoon cartoon,cartoon tv,funny cartoon,cartoon video,kids cartoon,comedy cartoon,pencilmation,zig and sharko,oggy and the cockroaches,animation short film,compilation,funny animation,short animation,bean animated,animated short film"
lCmcVA1xwEU,thailand movies english subtitle horror movies action english hollywood hd,thailand movies english subtitle horror movies action long weekend aka thongsook english hollywood hd director taweewat wantha writers sommai lertulan screenplay sommai lertularn eakasit thairaat screenplay credit star natpassara adulyamethasiri acharanat ariyaritwikol chinawut indracusin,Film & Animation,Hollywood Movies,Horror Movies
lFeZ4958OpU,follower exclusive premiere full horror movie english hd,original creepy horror film bring haunt house imdb title follower summary internet video blogger david baker invite carol eccentric lonely woman investigate supernatural occurrences home instruct free film everywhere except grandmothers room upstairs first see nothing however things take ghostly turn slowly discover things arent seem even worse could something want follow horror horrormovies director kevin mendiboure star nicolas shake chloe dumas benjamin polounovsky year produce certificate tvma become exclusive member sponsor channel interest get exclusive benefit nobody else please click subscribe movies httpbitlywatchmovies full horror stories still life barn darkness water leave behind dead body check docuchannel every week new breathtaking documentary remote place world rarest animal inhabitants business request please contact watchmoviesnowtvgmailcom attention film upload legally license youtube right specific territories copyright inquiries send watchmoviesnowtvgmailcom tag horror movies english best movies english,Film & Animation,Horror Movies,"horror movies,horror full movie,english,movies,movie,full movies,english movies,english movies full,free movies,film,mystery,full,scream,scary movie,horror,horror movies full movies,slasher film,survival horror,horror movie,horror movies full,horror movies english,new horror movies,full length movies,2020,best horror movies,horror movies 2020,best horror,thriller movies,best horror movies 2020,horror movie 2020,THE FOLLOWER,devil,found footage"
lU8NdG2P85E,top hollywood movies आई top mustwatch,list top must watch hollywood movies आई top parasite direct bong joonh production company barunson ea trailer lighthouse direct robert eggers production company regency enterprises trailer spiderman far home direct jon watts production company columbia picture marvel studios pascal picture trailer avengers endgame direct anthony russo joe russo production company marvel studios trailer direct sam mend production company dreamworks picture reliance entertainment new republic picture mogambo alibaba picture neal street productions amblin partner trailer httpsyoutubeyqnyryuimfg jumanji next level director jake kasdan production company columbia picture trailer escape room direct adam robitel production company columbia picture original film trailer ford v ferrari director jam mangold production company chernin entertainment tsg entertainment turnpike film trailer joker director todd phillips production company warner bros picture dc film joint effort bron creative village roadshow picture trailer upon time hollywood director quentin tarantino production company columbia picture bona film group heyday film visiona romantica trailer background music credit video clip music go respective production company content owner owner one video clip music want remove video please contact immediately remove thank,Film & Animation,Hollywood Movies,"best Hollywoo movies,top 10 best movies of 2019,Hollywood movies,must watch movies,2019 best movies,best movies,best movies ever,highly rated movies,2019 great movies,top 10 movies of Hollywood,Hollywood must watch movies,movies list"
m-54SEUIYec,tenet trailer movieclips trailers,check official tenet trailer star john david washington aaron taylorjohnson let us know think comment sign tenet fandango fanalert want notify latest movie trailers subscribe channel click bell icon stay date us release date july star aaron taylorjohnson robert pattinson kenneth branagh john david washington direct christopher nolan watch trailers hot new trailers drama trailers thriller trailers fuel movie obsession subscribe movieclips trailers watch movieclips originals like us facebook follow us twitter follow us instagram fandango movieclips trailers channel deliver hot new trailers teasers sneak peek best upcoming movies subscribe stay date everything come theaters favorite stream platform,Film & Animation,Trailers,"Tenet,Tenet Trailer,Tenet Movie Trailer,Tenet Trailer 2020,Tenet Official Trailer,Trailer,Trailers,Movie Trailers,2020 Trailers,Tenet Trailer 2,Movieclips Trailers,Movieclips,Fandango,Entertainment,Movies,Action,Drama,Thriller,Christopher Nolan,Aaron Taylor-Johnson,Robert Pattinson,Kenneth Branagh,John David Washington,Tenet Christopher Nolan"
m2RebNGTqjM,outpost trailer movieclips trailers,check official outpost trailer star scott eastwood orlando bloom let us know think comment visit fandango httpswwwfandangocomcmpmcytyoutubedesc want notify latest movie trailers subscribe channel click bell icon stay date us release date july star scott eastwood orlando bloom direct rod lurie synopsis small team us soldier battle taliban fighters afghanistan watch trailers hot new trailers actionscifi trailers thriller trailers fuel movie obsession subscribe movieclips trailers watch movieclips originals like us facebook follow us twitter follow us instagram fandango movieclips trailers channel deliver hot new trailers teasers sneak peek best upcoming movies subscribe stay date everything come theaters favorite stream platform,Film & Animation,Trailers,"The Outpost,The Outpost Trailer,The Outpost Movie Trailer,The Outpost Trailer 2020,The Outpost Official Trailer,Trailer,Trailers,Movie Trailers,The Outpost Trailer 1,Movieclips Trailers,Movieclips,Fandango,The Outpost Screen Media Films,Drama,Action,The Outpost Scott Eastwood,The Outpost Orlando Bloom,Scott Eastwood,Orlando Bloom,The Outpost Rod Lurie,Entertainment,Movies"
mC5AGYWwpBU,cartoon disney movies kid english full,credit go creator disclaimer video mine,Film & Animation,Cartoons,"english movies 2019 full movie,english movies full movie,english movies action,english movies 2018 full movie in hindi,english movies in hindi,english movies 2018 full movies,english movies with english subtitles,english movies for kids,english movies 2018 full movie comedy"
mbQkJR1u_o4,love reload new release full hindi dub movie hd romantic action movie,sanju fall love tanvi friends try arrange date sanju nervous time pass get along well sceptical relationship subscribe sde network hindi dub movies full movie,Film & Animation,Romantic Movies,"love reloaded full movie in hindi dubbed,love reloaded hindi dubbed movie,love reloaded,full movie,dubbed movie,hindi full movies,bollywood full movies,new released 2017 south dubbed movies,bollywood romantic action movie,south indian movies dubbed in hindi full movie 2017 new,south indian movies dubbed in hindi full movie 2016 new,popular hindi dubbed movies,hindi movies 2017 full movie,hindi dubbed movies 2017 full movie,bollywood latest movies 2017"
msG3xVt_PIg,pencilmates scary sock puppet animate cartoon character animate short film pencilmation,pencilmates new friend come alive mind subscribe pencilmation merchandise httpsteespringcomstorespencilmation watch newest videos follow pencilmation facebook httpsfacebookcompencilmation instagram httpswwwinstagramcompencilmationofficial watch pencilmation popular upload httpswwwyoutubecom compilations cartoon plane sight pencilmate try fly toy plane far get hair force one pencilmate set world record longest strand hair man hand pencilmate find arm whys attach host busters pencilmates stay hauntingly scary would usually think bride gloom pencilmate pencilmiss finally get marry talent show pencilmates performance lifetime great talent actually watch find gold fashion pencilmate find one partly cloudy chance pain little raincloud come play pencilmate stay belly idol pencilmiss expect crave grave zombies crave pencilmates scary sock puppet animate cartoon character animate short film pencilmation pencilmation pencilmation cartoon channel everyone especially nottooserious grownups make love lot fun international team helm ross bollinger start channel alone room long time ago follow new wacky often time quite silly adventure pencilmate little blue man pencilmiss toons every tuesday thursday saturday credit socky horror picture show executive producer ross bollinger producer jr gloyd associate producer additional writer ama bollinger script joe west additional writers andrew martin sonia likhari jar woods director francis florencio storyboards neil kohney palette gregory melo animatic lead animation color carlos iubel animation revisions dindo santos background corinne caro music brendan cooney voice characterization joe porter daphne garrington sound design strelok audio design compositing francis florencio thumbnail director ashlyn brandenberger thumbnail illustrator alyssa veysey compilation editor tiffany kao production manager tess mendoza production coordinators greg pearce tyler woll production analyst cameron jones pencilmation animatedshortfilms animatedcartoonscharacters foodanimation funnyvideos comedy comedyvideos cartoonmovie funnyclips compilation animation cartoon pencilmate pencilmiss funnycartoon splendidcartoon cartoonseries newcartoon fun america,Film & Animation,Cartoons,"pencilmation,animated short films,animated cartoons characters,pencilmate,pencil animation,youtube cartoons,animation,cartoons,pencil,animated shorts,animated cartoon,funny cartoon,splendid cartoon,funny clips,pencilmation cartoons,ross bollinger,pencil mation,pencilmiss,cartoon series,2d animation,funny animation,stick figure,stick figure animations,funny video,animation characters,pencilmation harry potter"
n1VWeLcTmmA,hack official trailer hina khan rohan shah vikram bhatt feb,watch lose control lose everything hack trailer stalker thriller vikram bhatt zee studios present association loneranger productions pvt ltd produce amar thakar krishna bhatt jatin sethi dop prakash kutty edit kuldip mehan choreography shabina khan action abbas ali moghul production designers priya satya lyric music write vikram bhatt dialogues vikram bhatt srivinay salian associate screenplay lrp writers room audiography adil sheikh sound design shantanu akerkar dinesh uchil visual promotions right studioz cfo farooque jahangir technical supervisor anand singh rajput music zee music company stay update httpswwwfacebookcomzeestudios httpstwittercomzeestudios httpswwwinstagramcomzeestudiosofficial httpwwwyoutubecomzeestudiosofficial,Film & Animation,Trailers,"Official Trailer,Upcoming Trailer,Must Watch Trailer,Promos,Stalker Thriller,Hina Khan,Vikram Bhatt,Trailer 2020,Thriller,Stalker,Hacking,New Promos"
nAoypPe_NPI,anjaane full movie hd amitabh bachchan hindi movie rekha movie bollywood thriller hd movie,superhit hindi movie anjaane star amitabh bachchan rekha prem chopra mithun chakraborty pradeep kumar utpal dutt lalita pawar jagdeep producer tito director dulal guha,Film & Animation,Bollywood Movies,"Do Anjaane Full Movie,Amitabh Bachchan movies,Rekha movies,amitabh bachchan and rekha movies,Prem Chopra movies,Mithun Chakraborty movies,hindi romantic movies,bollywood romantic movies,romantic hindi movies,romantic bollywood movies,latest bollywood romantic movie,latest hindi romantic movies 2019,latest bollywood romance movies 2019,new hindi romantic movie 2019 full hd,new bollywood romantic movies 2019 full movie hd,new bollywood romantic movies 2019"
nCKmqNTWsrg,ramta jogi best full punjabi movie english subtitle latest indian romantic movies,vijayta film present ramta jogi association impossible film star deep sidhu ronica singh rahul dev greesh sehdev zafar dhilon anil grover direct guddu dhanoa produce vijay singh dhanoa music harry anand santokh singh singers sukhwinder singh rahat fateh ali khan javed bashir harry anand tarannum labh janjua write santosh dhanoa country india language punjabi synopsis latest punjabi movie english subtitle intense action love story place land punjab main protagonist name jogi ramta jogi come humble background girl meet belong well family unlike traditional way film girl fall love jogi approach love story start term family get involve oppose love youngsters deeply love take charge journey start punjab unfold mumbai show struggle challenge face city like mumbai happen families take back punjab base unwanted circumstances create families climax unfold best term emotion never witness punjabi cinema,Film & Animation,Romantic Movies,"Cinema,Full,Movies,Films,Movie,Popular,Superhit,Punjab,Bollywood,Indian,Feature,Most,Film,Download,Family,Action,Top,Best,Latest,New,Deep Sidhu,Rahul Dev,Ronica Singh,Guddu Dhanoa,Ramta Jogi (Film),punjabi movies 2015 full movie,movies 2015 full movies,new movies 2015 full movies,punjabi movies 2016 full movie,india,romantic,full movies,punjabi movies,punjabi film,ramta jogi,free,online,watch,hit,humour,favorite,punjabi full movie,english subtitles,comedy"
nX5PwfEMBM0,snowpiercer official us release trailer chris evans movie hd,subscribe trailers subscribe come soon like us follow us twitter snowpiercer official us release trailer chris evans movie hd ad passengers train survivors earth movieclips trailers channel destination hottest new trailers second drop whether latest studio release indie horror flick evocative documentary new romcom youve wait movieclips team day night make sure best new movie trailers moment theyre release addition movie trailers channel youtube deliver amaze engage original videos week watch exclusive ultimate trailers showdowns instant trailer review monthly mashups movie news much keep know movieclips love movies much,Film & Animation,Trailers,"movieclips,movie clips,movieclipstrailers,new trailers,trailers HD,hd,trailers,trailer,2014,official,HD,Chris Evans,alison pill,ewen bremner,john Hurt,Tilda Swinton,octavia spencer,snowpiercer movie,snow piercer red band trailer,weinstein company,captain america,Avengers,Joon-ho Bong,south korea,asian cinema,Jamie Bell,the hunger games,the hunger games on a train,twist ending,korean,exo"
nbZ0LwVtV-E,new release hindi dub south horror movies new release hindi dub south horror movies,thank watch video please like share subscribe channel old cinema,Film & Animation,Horror Movies,"Bollywood movies action,Hindi Dubbed South Movies,Hindi Dubbed Action movies,Hindi Dubbed English Movie,Romantic Action Movies,Rajnikant movies,salman khan bollywood movies,a grade bollywood movies,latest hindi movies,Horror Story 3,Beeni P. Thomas,Venus,Madhu Kishan,Vani Vishwanath,Vineeth,Suresh Krishna,Kalabhavan Narayanankutty,Mala Aravindan,New Release Hindi Movies,Comedy Movies,2018 Action Movies,2018 Hindi Movies trailer,Dubbed South Horror Movies"
o_JmCfiIvlg,best action movies full movie english hollywood fantasy adventure movies youtube,chinese action movie lastest action movies new chinese action movie best fantasy adventure movies action movies full movie english hollywood hd action movies action movies full movie full movie english hollywood best sci fi movie action adventure movies new hollywood movies full length english super action movie new action movies action movie new action movies action movie best action movie best action movies action new sci fi movies new action movie sci fi movies best action movie best sci fi movies movie action movies full movie action movies full movie english hollywood action movies full movie english hollywood action movies full movie english hollywood marina catalina sur novelas tv cinéma film complet hd film de guerre film drame jasmin dizdar luke mably harvey keitel ana ularu radu danzaru diana cavallioti paul ipate film complet en français action movies action movies full movie full movie english hollywood best sci fi movie action adventure movies new hollywood movies full length english super action movie new action movies action movie new action movies action movie best action movie best action movies action new sci fi movies new action movie sci fi movies best action movie best sci fi movies movie action movies full movie lastest chinese action movie lastest action movies new chinese action movie best fantasy adventure movies action movies full movie english hollywood hd action movies action movies full movie full movie english hollywood best sci fi movie action adventure movies new hollywood movies full length english super action movie new action movies action movie new action movies action movie best action movie best action movies action new sci fi movies new action movie sci fi movies best action movie best sci fi movies movie action movies full movie action movies full movie english hollywood action movies full movie english hollywood action movies full movie english hollywood marina catalina sur novelas tv pour ne manquer aucune de mes prochaines vidéos abonnetoi dès maintenant à la chaîne et active la cloche category,Film & Animation,Hollywood Movies,"action movies,action movies 2019,full movie,full movie english,hollywood,Best Sci Fi Movie,Action ADVENTURE Movies,New Hollywood,Movies Full Length English,super action movie 2019,new action movies 2019,action movie 2019,new action movies,action movie,best action movie 2019,best action movies,action,new sci fi movies 2019,new action movie,sci fi movies,best action movie,best sci fi movies 2019,movie 2019,action movies 2019 full movie,Lastest"
ofKbtp8UZ2U,horror katha chitram latest telugu full movie karan kundra nandini vaid ayush raina,watch horror katha chitram latest telugu full movie star karan kundra nandini vaid ravish desai hasan zaidi nishant malkani sheetal singh aparna bajpai radhika menon executive producer aditya reddy producer vinod kumar reddy director ayush raina subscribe update,Film & Animation,Horror Movies,"Horror Katha Chitram,Horror Katha Chitram full movie,Horror Katha Chitram telugu movie,Horror Katha Chitram horror telugu full movie,telugu horror movies,telugu dubbing movies,horror story hindi movie,horror story telugu dubbing movie,Karan Kundra,Nandini Vaid,Ravish Desai,Hasan Zaidi,Nishant Malkani,Sheetal Singh,Aparna Bajpai,Radhika Menon,Vinod Kumar Reddy,Ayush Raina"
