video_id,title,description,category,sub_category,tags
WzMHZwa-XKQ,zindagi love new release hindi dub full romantic movie full hindi movie,zindagi love new release hindi dub full romantic movie full hindi movie zindagi love new release hindi dub full romantic movie full hindi movie zindagi love new release hindi dub full romantic movie full hindi movie zindagi love new release hindi dub full romantic movie full hindi movie zindagi love new release hindi dub full romantic movie full hindi movie zindagi love new release hindi dub full romantic movie full hindi movie,Film & Animation,Romantic Movies,"latest romantic video 2020,Zindagi Love You new hindi dubbed movie,New Release South Hindi Dubbed Full Romantic Movie 2020,latest romantic movies 2020 released,latest romantic movies,latest romantic movie in hindi,new latest romantic movies 2020,latest romantic movies 2020 in hindi,romantic movies 2020 hindi dubbed,movies in hindi dubbed full 2020 love story,hindi dubbed full 2020 love story,Zindagi Love You film,Zindagi Love You picture"
XJzNyqiVG3A,pencilmates boat wont float animate cartoon character animate short film pencilmation,pencilmate play battleship pencilmiss win subscribe pencilmation merchandise httpsteespringcomstorespencilmation watch newest videos follow pencilmation facebook httpsfacebookcompencilmation instagram httpswwwinstagramcompencilmationofficial watch pencilmation popular upload httpswwwyoutubecom compilations cartoon force signature pencilmate buy new car long agreement pushy salesman try make sign sock hard place pencilmate really want find sock could full housemate pencilmate homeless everything work pencilmate stop press pencilmate crazy game play closet encounter pencilmate keep hide animals people closet whats go happen pencilmiss find easter eggscapade pencilmate discover truth easter egg outboxed pencilmate end vicious kind circle compliment pencil coffee craze much coffee pencilmate unfarted territory mini p gas pencilmate fishy fable pencilmates greedly little fish become love bug love bug indeed big gross bug girlfriend fell love pencilmates boat wont float animate cartoon character animate short film pencilmation pencilmation pencilmation cartoon channel everyone especially nottooserious grownups make love lot fun international team helm ross bollinger start channel alone room long time ago follow new wacky often time quite silly adventure pencilmate little blue man pencilmiss toons every tuesday thursday saturday pencilmation animatedshortfilms animatedcartoonscharacters foodanimation funnyvideos comedy comedyvideos cartoonmovie funnyclips compilation animation cartoon pencilmate pencilmiss funnycartoon splendidcartoon cartoonseries newcartoon fun america,Film & Animation,Cartoons,"pencilmation,animated short films,animated cartoons characters,pencilmate,pencil animation,youtube cartoons,animation,cartoons,pencil,animated shorts,animated cartoon,funny cartoon,splendid cartoon,funny clips,pencilmation cartoons,ross bollinger,pencil mation,pencilmiss,cartoon series,2d animation,funny animation,stick figure,stick figure animations,funny video,animation characters,pencilmation harry potter"
XqnQwYe7L6E,zig sharko real shark king sea cartoon children,shark mermaid cartoon kid full episodes real shark zig e sharko desenhos para criancas con tubarões reais subscribe channel cartoon httpbitlyzigsharkotv watch zig sharko episodes httpbitlyzsvideo new episodes shark episodes httpbitlyzigbigsmile popular episodes httpbitlyzigrobot latest episodes httpbitlyzigcompilhair check new pencilmation channel httpbitlypencilmationtv desert island live starve hyena one obsession devour delicious mermaid rock lagoon ah lovely fishgirl best friend shark shark lot muscle love sabotage hyena every move season mermaid decide set house beach invite deepsea buddies join stake raise hyena win back turf cartoon funnycartoons animation cartoonsforkids shark whiteshark ocean,Film & Animation,Cartoons,"new compilation,funny compilation,2019 compilation,kids compilation,cartoon compilation,new season,pencilmate,pencilmiss,pencil cartoons,pencil animations,compilation,zig and sharko,cute,writing,house,stamp,Zig and sharko,shark,mermaid,protect the shark,baby shark,shark kids,shark kids song,cute shark,nice shark,white shark,shark 2020,2020,kids 2020"
XsQMCGTxsYQ,old guard trailer rotten tomatoes tv,check new old guard trailer star charlize theron let us know think comment learn movie rotten tomatoes httpswwwrottentomatoescommtheoldguardcmprttvyoutubedesc want notify latest tv show subscribe channel click bell icon stay date us air date july star charlize theron chiwetel ejiofor harry melling network netflix synopsis group mercenaries centuriesold immortals ablity heal discover someone onto secret must fight protect freedom watch next tv movies certify fresh tv top scifihorrorfantasy tv show channel stream platform rotten tomatoes subscribe rotten tomatoes tv subscribe rotten tomatoes newsletter httpswwwrottentomatoescomnewslettercmprtytyoutubedesc follow us twitter like us facebook follow us instagram rotten tomatoes tv deliver fresh tv click subscribe best trailers clip sneak peek binge guide show love upcoming series tv movies radar,Film & Animation,Trailers,"The Old Guard,The Old Guard Trailer,The Old Guard Movie Trailer,The Old Guard Trailer 2020,The Old Guard Official Trailer,Trailer,Trailers,Movie Trailers,2020 Trailers,The Old Guard Trailer 1,Rotten Tomatoes TV Trailers,Rotten Tomatoes TV,Fandango,Entertainment,Movies,Gina Prince-Bythewood,Charlize Theron,Chiwetel Ejiofor,Harry Melling,Fantasy,Action"
Y9yXdQkRCs4,minority actors make hollywood movies michael galante,watch trailer man box actors color actors color racial stereotype hollywood chapter introduction connect michael galante httpwwwmichaelgalantecom httpswwwfacebookcommichaelmgalante httpswwwfacebookcomthefilmmaninabox httpstwittercommichaelmgalante connect us httpwwwfilmcouragecom httpwwwcanigoviralcom httptwittercomfilmcourage httpswwwfacebookcomfilmcourage httpfilmcouragetumblrcom httppinterestcomfilmcourage subscribe film courage youtube channel promote work film courage,Film & Animation,Hollywood Movies,"Actor (Profession),michael galante,man in a box,kevin davis,kevin eugene davis,interview,film courage,filmcourage,acting,actor,jay z,minority actors,multi ethnic actors,Minority Actors Make Up 15% Of Hollywood Movies,asian actors,latino actors"
YEmAZBR2PJw,aunty hindi movies full movie govinda movies latest bollywood movies hindi movies,bollywood blockbuster superhit movies bollywood comedy movies best bollywood romantic movies enjoy best bollywood thriller movies evergreen bollywood classic scenes movie aunty director kirti kumar writer sachin bhowmick producer suresh jethani star cast govinda raveena tandon kader khan harish mitra anupam kher others sandhya raveena tandon always dream meet prince charm wealthy man handsome debonair dash meet gopi govinda like instantly pretend man dream sandhyas dream shatter come know gopi poor nevertheless give heart fall love sandhya must return home gopi ask couple friends become aunt big favor hilarious result soon aunty two suitors colonel sadanand dhongre saeed jaffrey rai bahadur behl kader khan gopi eradicate mess make matter real aunt friends vijayalaxmi reema lagoo also show secretary guddi maruti tow update subscribe hit latest music httpswwwyoutubecomuservenus blockbuster movies httpswwwyoutubecomuservenusmovies movies music regional languages httpswwwyoutubecomuservenusregional heavenly peaceful devotional music httpswwwyoutubecomuservenusdevotional also like us facebook httpswwwfacebookcomvenusentertainment follow us twitter httpstwittercomvenusmovies circle us google httpsplusgooglecomvenusmovies,Film & Animation,Bollywood Movies,"hindi movies 2016 full movie,hindi movies 2015 full movie,hindi movies,hindi movie,hindi movies 2016,hindi full movie,new hindi movies 2016,Bollywood full movies,hindi full movie 2015,Bollywood movies,hindi dubbed movies 2016 full movie,south indian movies dubbed in hindi full movie 2016 new,hindi dubbed movies,latest hindi movies 2016 full movie,Aunty No.1,aunty no.1 full movie,Govinda Full Movies,raveena tandon movies,Bollywood Comedy Movies"
YieSL-wpnLM,peppa pig full episodes pottery cartoon children,peppa pig full episodes pottery cartoon children remember hit like button subscribe peppa pig subscribe httpsgooglregpyi welcome official peppa pig channel home peppa youtube create world peppa episodes compilations keep even dedicate peppa fan happy enjoy dont forget subscribe peppa pig astley baker davies ltdentertainment one uk ltd peppa pig create mark baker neville astley fun peppa pig friends suzy sheeprebecca rabbitdanny dogcandy catpedro ponyzoe zebraemily elephantfreddy foxkylie kangaroowendy wolfgabriella goatgerald giraffemolly molebelinda beardelphine donkey peggi pandora pandamandy mousesimon squirrel,Film & Animation,Cartoons,"pig cartoon episodes,cartoons,peppas,peppa pig clips,Peppa's,clips,funny,Mandy Mouse,cartoon,familyÊ,fun,peppa pig,peppa pig compilations,adventure,clip,peppa full episodes,peppa,peppa pig full episode,compilation,peppa pig toys"
YjFvloqAcA8,mother two fall hot construction boy romance rendezvous,mother two fall hot construction boy subscribe httpbitlycinehouseyt watch free web ioshttpbitlyyuyuios android httpbitlyyuyugp rendezvous dream achieve seem difficult think cast jennifer holfman loes haverkrot pierre boulanger direct antoinette beumer rendezvous cinehouse romance best cinehouse casa amor httpbitlycasaamormovie romeo juliet httpbitlyromeoandjulietmovie httpbitlyallaboutthemmovie cinehouse social facebook httpbitlycinehousefb instagram httpbitlycinehouseig cinehouse community arthouse cinema romance enthusiasts fan old new always welcome subscribe watch favorite love stories around world bitlychytsubscribe whether swoon french romantic comedy savor every detail production design fantasy stories like beauty beast cinderella break hearts timeless love tragedies like across sea anna karenina come join us comment section discuss cant get enough one scene turn cinephile part yuyutv network seriesmovies feature available stream amazon prime video roku fire tv vizio smartcast samsung tv plus website android ios apps stream legally cinehouse httpsyoutubecomccinehousetv,Film & Animation,Romantic Movies,"short films,film,short film,films,short film (film genre),short films romantic,cinema,award winning,movie,indie film,romantic comedy,rom-com,celebrities,tv,festivals,independent films,arthouse,cinehouse,period pieces,historical dramas,complicated relationships,Jennifer Holfman,Loes Haverkrot,Pierre Boulanger,Antoinette Beumer,Romance,Love,Cheating,attraction,kids,family,unfaithful,obsession,Rendezvous,midlife crisis,mother,falls,hot,construction"
YoHD9XEInc0,inception official trailer christopher nolan movie hd,check official inception trailer star edward norton let us know think comment watch fandangonow subscribe channel click bell icon stay date favorite movies star leonardo dicaprio joseph gordonlevitt ellen page direct christopher nolan synopsis skilled extractor offer chance regain old life payment task consider impossible watch classic trailers horror film comedies dramas scifi movies animate movies documentaries musicals romantic comedies superhero film westerns war movies trailers year fuel movie obsession subscribe classic trailers watch movieclips originals like us facebook follow us twitter follow us instagram subscribe fandango movieclips classic trailers channel rediscover favorite movie trailers find classic may miss,Film & Animation,Trailers,"movieclips,movie clips,movieclipstrailers,new trailers,trailers HD,hd,trailers,movieclipsDOTcom,trailer,2013,official,HD,zefr,classic trailers,oldhollywoodtrailers,jslewis Inception,Inception movie,Inception trailer,action,adventure,mystery,Christopher Nolan,Leonardo DiCaprio,Joseph Gordon-Levitt,Ellen Page,Tom Hardy,Ken Watanabe,Marion Cotillard,Michael Caine,sci-fi,fantasy,dream"
YpaD9Q8PIJU,romantic kiss sence hollywood movies,,Film & Animation,Romantic Movies,"romantic kissing sence song status,romantic kissing sence song,romantic kissing sence song telugu"
ZNk6Sf9yo84,hollywood fake wake message keep fail,let talk entertainment lately many mistake make things seem change many fail movies soon lose count hollywood keep make error thoughts wake culture check also terminator dark fate rant review blame men charlie angels failure terminator set footage henry cavill superman rant john wick trailer reaction stranger things happen season terminator bet didnt know feel free support channel patreon httpswwwpatreoncomheyviv social media twitter httpstwittercomvivicaycaralangen instagram httpswwwinstagramcomvivicaycarahlen fb email heyvivchannelgmailcom inquiries check new york comic con,Film & Animation,Hollywood Movies,"hollywood culture,woke,diversity"
ZPqEQoO2U68,top south indian college romantic love story film hindi available youtubemrfilmiwala,top south college romantic love story movie hindi dub per imdb rat movies movie movie movie movie movie movie movie movie movie movie movie movie movie movie movie tag line south indian love story list hindi top south love story movies south movie hindi love story movie south best love movies hindi south indian movie news new south movie hindi dub new south movie news south movie hindi information south movie hindi news love story south movies hindi soutnindiansuspensethrillermovieshindubbed south new moviesouth love story movie hindi dub south love story movie hindi dub south love story movie hindi dub new south love story movie hindi dub latest south love story movie hindi dub best south love story movie hindi dub college love story south movie hindi dub college love story south movie hindi dub south indian love story movie hindi dub full new hd southmovienews southindianhindidubbedmovies southindianlovestorymovies lovestorymovies lovestorymoviesinhindilist southindianlovestorymoviesinhindi newsouthmovieshindidubbedinfo thank watch like subscribe share special note image title songs etc use video individual property owner copyright content material use promotional purpose use materials harm violate protect content use content inappropriate please let us know youtube message box immediately remove copyright issue please contact email,Film & Animation,Romantic Movies,"tik tok,Cary minati"
ZfObfPr8WxM,new south indian movies dub hindi full love story new hindi movie,baaghi tiger shroff full movie hindi movie south indianaction new bollywood movies movie hindi movies movies new hindi moviebaaghi movie hd baaghi film new movie tiger shroof shrof baaghi hdnew film baaghi new film baaghi action movie movie,Film & Animation,Bollywood Movies,"BAAGHI 3 #,TIGER SHROFF #,Full Movie #,बाघी 3 Hindi Movie 2020 #,South Indian,Action Movie,1080p,2020 new bollywood movies बाघी 3,hindi movie बाघी 3 2020,2020 hindi movies बाघी 3,2020 movies बाघी 3,बाघी 3 new hindi movie,baaghi 3 movie hd बाघी 3,2020 baaghi 3 बाघी 3,new film बाघी 3,baaghi 3 new movie बाघी 3,2020 tiger shroof बाघी 3,tiger shrof baaghi 3 hd,new films baaghi बाघी 3,HD 4k NEW FILM 3 baaghi बाघी 3,new Action Movie movie बाघी 3,2020baaghi3"
Zx7d9ALIAFE,pyaar sale south indian movies dub hindi full movie sai dharam tej regina cassandra,seetha run away home land america marry boyfriend abhi unfortunately dump boyfriend subramanyam give hope courage pose marry couple win nri rajashekar later seetha sister marriage fix afraid tell truth family subramanyam also come later govind men chase subramanyam warn go seetha home realise wed fix son nri rajashekar rest story govind subramanyam manage situation show comical hilarious way,Film & Animation,Bollywood Movies,"Goldmines Action,Hindi Dubbed Action movies,south indian movies dubbed in hindi full movie 2019 new,new release south indian movies dubbed in hindi 2019 full,Pyaar On Sale hindi dubbed full movie,Pyaar On Sale 2019 Hindi Dubbed Full Movie,Patel On Sale Hindi Dubbed Movie,Patel On Sale Full Hindi Dubbed Movie,Sai Dharam Tej movies in hindi dubbed 2019,Sai Dharam Tej new movie 2019 hindi dubbed,Regina Cassandra hindi dubbed movies 2019,Regina Cassandra new dubbed movie 2019"
ZyPCLM6iG9U,tenet trailer legendado,tenet trailer legendado confira novo trailer de tenet somos melhor destino para quem busca trailers assim que eles são lançados se você é fã de cinema como gente inscrevase e receba todas novidades do seus film favoritos baixe nossos apps android httpsgooglzoknfm ios httpsgooglhfbnmy compre ingressos para melhores estreias em httpswwwingressocom ingresso facebook,Film & Animation,Trailers,"Ingresso.com;,Trailers;,Lançamentos;,Filmes,2019;"
_5jVqHxtnBA,funhouse trailer horror movie hd,funhouse trailer horror movie hd ti bonny productions,Film & Animation,Horror Movies,"cinema,FUNHOUSE,FUNHOUSE Trailer,2020,Horror"
_LyoARi8Eko,family adventure movies full movie english hollywood hd,family adventure movies full movie english hollywood,Film & Animation,Hollywood Movies,"movies full length,family movies,full movies,full movie,movies,family movie,adventure movies,comedy movies,kids movies,movie"
_kbQAJR9YWQ,sinister official trailer ethan hawke horror movie hd,subscribe trailers subscribe come soon sinister official trailer ethan hawke horror movie hd find footage help truecrime novelist realize family murder new home though discoveries put entire family path supernatural entity,Film & Animation,Trailers,"Sinister trailer,Sinister HD,Sinister movie,hd,2012,Ethan Hawke,Juliet Rylance,James Ransone,horror,ghost,supernatural,Vincent D'Onofrio,Scott Derrickson,movieclips,movie,clips,movieclipstrailers,movieclipscomingsoon"
a0CPq-kbTP8,old guard official trailer charlize theron action movie hd,old guard official trailer charlize theron action movie hd subscribe rapid trailer latest movie trailers like us facebook follow us twitter covert team immortal mercenaries suddenly expose must fight keep identity secret unexpected new member discover netflix,Film & Animation,Trailers,"THE OLD GUARD,Trailer,THE OLD GUARD Trailer,Movie,2020,Charlize Theron,Action,Action Movie,Fantasy,Netflix,Official,International,Film,Clip,TV Spot,The Old Guard (Movie),Trailers 2020"
a3DzovQQ4PQ,antebellum trailer movieclips trailers,check official antebellum trailer star janelle monáe let us know think comment sign fandango fanalert antebellum want notify latest movie trailers subscribe channel click bell icon stay date us release date august star janelle monáe eric lange jena malone direct gerard bush christopher renz synopsis successful author veronica find trap horrify reality must uncover mindbending mystery late watch trailers hot new trailers horror trailers thriller trailers fuel movie obsession subscribe movieclips trailers watch movieclips originals like us facebook follow us twitter follow us instagram fandango movieclips trailers channel deliver hot new trailers teasers sneak peek best upcoming movies subscribe stay date everything come theaters favorite stream platform,Film & Animation,Trailers,"Antebellum,Antebellum Trailer,Antebellum Movie Trailer,Antebellum Trailer 2020,Antebellum Official Trailer,Trailer,Trailers,Movie Trailers,2020 Trailers,Antebellum Trailer 1,Movieclips Trailers,Movieclips,Fandango,Entertainment,Movies,Kiersey Clemons,Jena Malone,Janelle Monáe,Gerard Bush,Christopher Renz,Horror,Thriller"
aSiDu3Ywi8E,official trailer hd,theaters april httpwwwthefastsagacom matter fast one outrun past summer time ninth chapter saga endure almost two decades earn billion around world vin diesel dom toretto lead quiet life grid letty son little brian know danger always lurk peaceful horizon time threat force dom confront sin past go save love crew join together stop worldshattering plot lead skilled assassin highperformance driver ever encounter man also happen dom forsake brother jakob john cena next year suicide squad see return justin lin director helm third fourth fifth sixth chapters series transform global blockbuster action hurtle around london tokyo central america edinburgh secret bunker azerbaijan teem streets tblisi along way old friends resurrect old foes return history rewrite true mean family test like never film star return cast members michelle rodriguez tyrese gibson chris ludacris bridge jordana brewster nathalie emmanuel sing kang winner helen mirren winner charlize theron also feature grammywinning superstar cardi b new franchise character leysa woman connection dom past cameo reggaeton sensation ozuna produce neal h moritz vin diesel jeff kirschenbaum joe roth justin lin clayton townsend samantha vincent wwwthefastsagacom,Film & Animation,Trailers,"Fast & Furious,Hobbs & Shaw"
anHs58biR7s,indra shakti hindi horror movie hindi dub horror movie,sowkarpettai indra shakti tamil comedy horror film direct vadivudaiyan star srikanth lakshmi rai lead roles film release worldwide march story vetri srikanth maya raai laxmi fell love kill gothra singh suman goons come back ghost start take revenge people kill watch full movie leave like love movie forget subscribe channel find us facebook httpswwwfacebookcomcinekornent twitter cinekornent email cinekornmoviesgmailcom infocinekorncom,Film & Animation,Horror Movies,"Indra Shakti,Indra Shakti Hindi Movie,Indra Shakti Dubbed Movie,Indra Shakti Full Movie,Hindi Dubbed Movies,Hindi Dubbed Full Movies,Cinekorn Movies,Cinekorn Dubbed Movies,Lakshmi Rai Dubbed Movies,Hindi Action Movies,Latest Hindi Dubbed Movies 2017,Indra Shakti Horror Movie,Action Movies,Hindi Full Action Movies,Dubbed Action Movies,horror movies 2020,hindi dubbed movies 2020,2020 movie south,south horror movie,2020 new movie hindi,2020 latest movies,hd"
awgZfSUtT7Y,minute allah great break hollywood movies flv,,Film & Animation,Hollywood Movies,"‫فيلم,من,4,دقائق,يكسر,أفضل,أفلام,هوليوود,!!!‬,YouTube"
bFfG3fAUsWA,gentleman full movie govinda hindi movie anuradha patel superhit bollywood movie,superhit hindi movie gentleman star govinda anuradha patel shakti kapoor shamla ashalata om shivpuri director vinod k verma producer vinod kverma,Film & Animation,Bollywood Movies,"Gentleman Full Movie,Govinda movies,Anuradha Patel movies,Shakti Kapoor movies,hindi movies,bollywood movies,indian movies,latest hindi movies,latest bollywood movies,superhit hindi movies,superhit bollywood movies"
bgd7lLsK8Og,tom jerry jerry ally classic cartoon compilation wb kid,know jerry good outwit enemies sometimes good chance cant always surround friends lend hand include tom well occasionally anyway catch tom jerry chase avoid spike play friends like little quacker butch cat wb kid home favorite clip feature character looney tune scoobydoo tom jerry tom jerry available digital videos game activities warner bros relate character elements warner bros entertainment inc,Film & Animation,Cartoons,"Scooby-Doo!,Tom and Jerry,TJ,CLASSIC"
bkghf2mwnnE,peppa pig hindi tree house kahaniya hindi cartoon kid,peppa pig hindi tree house kahaniya hindi cartoon kid subscribe httpbitlypeppahindi aap dekh rahe hai peppa pig ka official channel peppa rehti hai apne mummy pappa aur chote bhai george ke saath welcome official peppa pig channel home peppa youtube create world peppa episodes compilations keep even dedicate peppa fan happy enjoy dont forget subscribepeppa pig astley baker davies ltdentertainment one uk ltd peppa pig create mark baker neville astley peppapighindi hindicartoons,Film & Animation,Cartoons,"Peppa Pig,Peppa Hindi,peppa pig in hindi,cartoons,peppa pig peppa pig,peppa pig cartoon,papa pig,pig peppa pig,हिंदी,Peppa Pig हिंदी,peppa pig hindi episodes new episodes 2017,peppa pig hindi episode,peppa pig hindi cartoon,hindi peppa pig,cartoons in hindi,cartoon,peppa pig hindi,#peppapigहिंदी,#peppapighindi,#hindicartoons,peppa pig hindi mai,peppa george,pig,peppa pig cartoon in hindi,pig cartoon,peppa pig in hindi new episodes"
bpAfkDzGPOw,korean romantic comedy movie eng sub gangster lover hd,korean romantic comedy movie eng sub gangster lover hd korean drama english subtitle korean romantic comedy movie eng sub latest korean drama eng sub dear desperado full movie eng sub synopsis sejin jung yumi leave small hometown big city seoul land job upstart company initially enjoy best days life seoul job go great boyfriend work computer programmer sejins honeymoon seoul soon come end company go bankrupt boyfriend find new job leave sejin behind sejin must also find cheaper apartment rent sejin move poor area seoul look new job although quite interview line none interviewers take seriously furthermore next door neighbor strange older man name dongchul park joonghoon dongchul park joonghoon low level gangster wait payback boss go prison place meantime dongchul usually break bad manners hot temper first think new neighbor odd girl thats somewhat pain one day sejin remark dongchul hey look like gangster live dongchul respond gangster neighbor get along sejin ever find another job romance bloom two disparate personalities koreanromanticcomedymovie koreandramaengsub movies please subscribe channel thank watch,Film & Animation,Romantic Movies,"latest korean drama 2020,korean drama eng sub,korean drama with english subtitles,korean drama 2020 eng sub,gangster lover full movie,my dear desperado,korean romantic comedy movie,korean drama,내 깡패 같은 애인"
