video_id,title,description,category,sub_category,tags
i2w85yvrbHk,fix spider crack hairline crack craze boat gelcoat materials boatus,boatus magazines mark corke show easily repair pesky spider crack show boat fiberglass gelcoat may seem like scary project little time patience something great result tackle repair hairline crack gelcoat youll need prepare area well wash clean acetone youll drill gelcoat craze use dremel tool scratch laminate go youll mix gelcoat add catalyst little colloidal silica help thicken apply spider crack use old credit card smooth let dry wet sand use wetdry sandpaper wrap around block use finer grain smooth apply compound buff apply glaze buff finish use wax buff clean cloth heres helpful list tool products use video acetone use evercoat product link acetone would fine acetone widely available pretaped mask plastic brand readily available home depot also find sherwin williams store west marine store dremel rotary tool dremel bite premixed gelcoat almost boat color httpswwwiboatscomshoppaintandmaintenancefiberglassandepoxyboatrepairboatgelcoatrepairhtml note catalyst include buy gelcoat syringe cheapest ive find walmart colloidal silica thicken gelcoat plastic mix stick west system respirator available home improvement store wetdry sandpaper available home improvement store polish compound buff machine one longer available equivalent polish pad polishglaze also available west marine collinite wax bottle look different product information visit httpswwwboatuscomexpertadvice boatus nation largest association recreational boaters half million members provide diverse offer service include marine insurance onthewater tow provide towboatus nation largest fleet plus boat finance graphics letter representation boaters capitol hill awardwinning boatus magazine much years boatus make boat safer affordable accessible boatus today httpsboatusesyjoin boatus app today access noaa marine weather tide exclusive member discount boatus account assistance water never easier towboatus connect boatus app fastest way get tow httpsboatussyapp us httpsfacebookcomboatus httpstwittercomboatus httpsinstagramcomboatus httpspinterestcomboatus httpslinkedincomcompanyboatus gelcoatrepair craze boatus,Howto & Style,How to Fix/Repair,"how to repair hairline cracks in gelcoat,spider cracks in gelcoat,repair spider cracks in gelcoat,gelcoat crazing repair,BoatUS,Boat US,spider cracks,how to repair gelcoat cracks,boat gelcoat repair,how to repair gelcoat,how to repair gelcoat on a boat,gelcoat,boat repair,gel coat repair,fiberglass gelcoat repair,boat fiberglass repair,gel coat,gelcoat repair,gelcoat fractures,colloidal silica,boat,BoatUS Magazine,how to,fiberglass repair"
iEDJFjAD6kY,fix dent car,today show fix dent car simple trick fix car dent matter locate big second leave car look brand new work cars accidentally damage someones car dont insurance problem simply follow step step instructions dent vanish thin air best part free wont pay cent youll amaze easy share quick car dent fix around tweet eggbook httpbitlycardentfix click eggscribe video suggestion post comment section contact facebook page tweet connect facebook twitter instagram channel tshirts eggy merchandise know someone thats accidentally dent car link quick fix,Howto & Style,How to Fix/Repair,"how to fix a dented car,dented car fix,diy dent fix,repair dented car free,removing car dents,car dent repair,fixing a car,how to repair dents on a car,free dent fix,howtobasic,fix dented car with hot water,damaged car fix,car dent fix tutorial,how to,dent repair"
iKBhe7L8VQA,eat day stay fit healthy realistic,eat day stay fit healthy teen favourite healthy foods realistic like eat stay fit healthy healthy important love fuel body healthy easy nutrient meals course love treat icecream addict lol hope u enjoy random realistic eat day xxx ig charlotterebecca get contact businesses would like work collaborate contact possible please put business collab subject title line get email quickly respond asap thankyou xx socials instagram snapchat twitter hi name charlotte year old gal melbourne australia love make youtube videos take instagram pics video sponsor,Howto & Style,Health,"what I eat in a day,what I eat in a day fit and healthy,What I eat in a day to be fit and healthy,fit and healthy,tone up,what I eat in a day to loose weight,What I eat in a day to tone up,what I eat in a day teen,What I eat in a day at high school,keto what I eat in a day,healthy recipes,healthy breakfast,oatmeal bake,what i eat in a day 2019,healthy food,misscharlottebeauty1 what i eat in a day"
iPBD_SvyCCQ,top smart diy inventions,hello amaze diy video see make top smart diy inventions simple trick build house easy things find home hope like inventions see next minutes craft video water dispenser disco light usb hub electric lighter music lensko circle ncs release free download stream httpncsiocircles watch httpsyoutubeztvihqvtrrw lensko youtube httpswwwyoutubecomuserlenskoof channel include life hack home make craft diy make top diy inventions lifehack trick inventor,Howto & Style,DIY,"inventions,how to make,life hacks,DIY,ideas,science,school,crafts,experiment,coca cola,tips,tricks,10,Top,Creative ideas,Inventor 101,Idea,Led ideas,Led,Light,Simple inventions,Smart inventions,DIY inventions,Top 4"
iSJCziTP3mw,diy giant miniature edible gadgets,subscribe diy rainbow hack craft amaze unicorn craft huge chocolate iphone mmm refuse thing like huge miniature sweets unusual shape rather watch new video supply tool white chocolate wafers knife fondant sugar paper food marker edible pearl powder chocolate candy gingerbread dough egg white powder sugar mixer pastry bag mint oreo skewer food color parchment paper tulle color glaze shred coconut marshmallows bowl cheerios wafer tube sponge cake blender sprinkle watch troom troom popular videos weird ways sneak food class back school prank funny prank prank war diy edible makeup funny prank weird ways sneak makeup class httpsyoutubebvhbismzhwe gummy food vs real food challenge popular playlists funny prank back school life hack beauty makeup hack home décor follow troom troom subscribe instagram httpswwwinstagramcomtroomtroom facebook httpswwwfacebookcomtroomhands pinterest httpspinterestcomtroomtroom troom troom español subscribe troom troom française subscribe troom troom russian subscribe troom troom deutsch subscribe troom troom chinese subscribe troom troom português subscribe troom troom japanese subscribe troom troom easy diy video tutorials diy accessories scrapbooking card home décor make tutorials life hack much make easy business enquire please contact troomtroomdiygmailcom question day like delicious gadgets comment forget turn notifications like subscribe,Howto & Style,DIY,"Gadgets,Edible,Edible Pranks,Pranks,Funny Pranks,How to,for beginners,prank video,How to make,for girls,girls,Funny,Easy,How to prank,Edible Gadgets,DIY Edible Gadgets,Funny Edible Gadgets,Tasty Gadgets,Sweet Gadgets,TRoom Troom"
ie9o3CQiFF8,fix brown patch lawn,garden expert katie rushworth show clear repair bare brown patch lawn start rake dead grass moss allow sunlight reach new grass seed ensure remove weed area lawn repair cover area thin layer top soil sow seed evenly apply pressure ensure seed make good contact soil subscribe instagram httpswwwinstagramcomsilverlinetools twitter httpstwittercomsilverlinetools facebook httpswwwfacebookcomsilverlineto buy tool httpwwwsilverlinetoolscom silverline tool videos reference purpose undertake project entirely risk read safety instructions operate power tool always wear appropriate protection,Howto & Style,How to Fix/Repair,"brown patches in lawn,brown patches on lawn,dead patches in lawn,how to fix lawn patches,yelloiw patches on lawn,bare patches in lawn,lawn care,how to fix patches in lawn,dead patches on lawn,lawn problems,how to reseed lawn patches,how ro fix lawn patches,grass care,silverline tools,silverline,katie rushworth"
imFYwyYX2FU,stay healthy holiday fitness routine,hi guy im partner special olympics send really deserve athletes winter game austria even make huge difference donate httpswwwgofundmecommeredithfoster thank much watch lot love mere twitter instagram vlog channel vlogsbymeredith httpswwwyoutubecomuservlogsbymeredith tumblr httpmeredithfostertumblrcom facebook vine meredith foster keek meredith foster ftc sponsor video,Howto & Style,Health,"stilababe09,fitness,health,routine,Winter,Exercise,Loss,Weight,Workout,Healthy Diet (Diet),Meredith Foster,vlogsbymeredith,stay healthy during the Holidays,how to stay fit during the Holidays,macbarbie07 fitness,macbarbie07 workout routine,bethany mota workout,meredith foster workout,meredith foster fitness routine"
iyiGJ-uwmKU,fix bathroom sink stopper old house,old house plumb heat expert richard trethewey show replace faulty popup sink stopper see shop list tool subscribe old house httpbitlysubscribethisoldhouse shop list fix bathroom sink stopper replacement popup assembly plumbers putty use seal sink strainer pipe dope use seal pipe thread tool fix bathroom sink stopper adjustable wrench pliers tube cutter two slot screwdrivers use hold sink strainer spin old house tv old house multimedia home enthusiast brand offer trust information expert advice awardwinning television highly regard magazine informationdriven website old house ask old house produce old house venture llc present pbs weta washington dc follow old house ask old house facebook httpbitlythisoldhousefb twitter httpbitlythisoldhousetwitter httpbitlyasktohtwitter pinterest httpbitlythisoldhousepinterest instagram httpbitlythisoldhouseig httpbitlyasktohig tumblr httpbitlythisoldhousetumblr old house ask old house visit us httpbitlythisoldhousewebsite fix bathroom sink stopper old house httpswwwyoutubecomuserthisoldhouse,Howto & Style,How to Fix/Repair,"This Old House,Ask This Old House,DIY,Home Improvement,DIY Ideas,Renovation,Renovation Ideas,How To Fix,How To Install,How To Build,bathroom,repairs,sink,drain,Repair,pop up assembly,replace,sink stopper,Installation,Cleaning,Construction,Design,Inc,Interior,Maintenance,and operations,Episode,Richard Trethewey,plumbing 101,plumbing basics,plumbing tricks,house plumbing system,how to plumb a house"
j0uxHmficjE,stay healthy travel,thank sponsor video shop sneaker fitness casual fashion use code get style minimum purchase require use promotion code checkout valid phone mail apply prior purchase open order combine offer may use toward purchase gift card team order select nike adidas style exclude exclusions apply promotion may modify terminate time offer expire pm ct workout videos abs booty full body business inquire nilsaniytgmailcom instagram httpsinstagramcomnilsani snapchat nilsani facebook httpswwwfacebookcomofficialnilsanirefbookmarks twitter httpstwittercomnilsani none songs belong copyright go owners,Howto & Style,Health,"nilsani,nil sani,nil,sani,get fit with me,what i eat in a day,fitness,healthy,workout routine,how to be healthy,abs,booty,how to get motivated,how to get fit,rebacca louise,summer body,hourglass body,summer workout,full body workout,nike beautiful powerful,nike track jacket,nike skirt,nike tshirt,nike pro swoosh bra,nike sports bra,fila tshirt,fila crop top,fila disruptor,nike air max ul17,model workout,victoria secret workout"
jILYAmAaCc0,fix fray cable charge cord diy methods,video show ways repair fray cable home easy solutions give cable extend life something still repair better repair instead buy new stuff time video use methods telephone cord style cable wrap glue gun cable bite shrink tube electrical tape way able fix fray cable charge cord hope help thank watch please subscribe youtube channel httpsubscribebobbeenl fix fray cable,Howto & Style,How to Fix/Repair,"diy,charging,cord,fix,fraying cables,repair,how to,broken,damaged,cable,fraying,frayed,ripped,teared,shrink tube,glue gun,cable bites,bite,animals,funny,electrical tap,tape,do it yourself,tutorial,home,easy,guide,iPhone cord,iPhone cable,5 easy fixes for fraying cables,how to fix fraying cables,how to repair frayed cables,wires,exposed,phone,iPhone,samsung,lightning,protector,replace,apple fraying cable,apple cable fraying,howto fix fraying charger"
ja07c3BoDn0,top secrets stay fit home hiit workout,excite share go tip secrets help stay fit healthy home follow one favourite hiit workouts passionate keep motivate hard time one best ways exercise sure join along try exercise second long second rest repeat twice always please leave feedback comment section would like see hiit like button alexandra xx instagram httpswwwinstagramcomalexandralouise happy body plan instagram httpswwwinstagramcomalexandrashappybody happy body plan website httpswwwthehappybodyplancom twitter httpstwittercomalexandracane hiitworkout fullbody hiit,Howto & Style,Health,"alexandra,alexandra cane,alexandra fitness,business,fitness,fitness motivation,alexandra louise,happy body plan,alexandra cane workout,workout,entrepreneur,female entrepreneur,hiit workout for fat loss,fat loss workout,cardio,cardio hiit,hiit workout,home hiit workout,HIIT,hiit workout at home,hiit workout for beginners,hiit step workout,hiit workout cardio,home workout,body workout,body hiit workout,body hiit,abs,10 minute hiit,10 minute hiit workout"
jy-ykxR49Uc,funny diy ideas prank,hilarious prank ideas nobody think play around tease prank friends best memories grow give inspiration help fun buddies show cool prank ideas hilarious clip try open new bag crisp coat nutella around side offer crisp friends go reach snack get nutella hand prank flatmates take friends earpods place inside balloon inflate rest stuff get home break balloon get things back friends get new milk bottle say shake well use simply open bite leave fridge go open bottle shake big surprise another way prank friends make cereal breakfast leave freezer overnight morning serve able get spoon without lift whole plate timestamps prank flatmates whip cream vs balloon toilet paper prank hilarious break computer screen prank hand challenge layer nail polish challenge get bee prank prank prankideas funny social media facebook instagram twitter subscribe craft girly httpsgooglfwbjqz subscribe craft kid httpsgooglpeulvt subscribe craft men bright side youtube httpsgooglrqtjzz videos article visit httpwwwbrightsideme music epidemic sound httpswwwepidemicsoundcom video make entertainment purpose make warranties completeness safety reliability action take upon information video strictly risk liable damage losses viewers responsibility use judgment care precautions one plan replicate follow video might feature activity perform actors within control environment please use judgment care precaution plan replicate video make entertainment purpose make warranties completeness safety reliability action take upon information video strictly risk liable damage losses viewers responsibility use judgment care precautions one plan replicate follow video might feature activity perform actors within control environment please use judgment care precaution plan replicate,Howto & Style,DIY,"proyectos faciles,trucos de belliza,howto,tutorial,handcraft,tips,5 minute craft,useful things,life hacks,crafts,diy,5-minute crafts,tricks,do it yourself,diy projects,trucos,diy activities,5 minutes craft,lifehacks,prank,prank ideas,how to prank,funny,hilarious,clips,fail,funny fails,funny pranks,balloon,balloon prank,flatmates,friends,pranking friends,fun with friends,funny scenes,funny videos,fun challenges,100 layers challenge,youtuber challenge"
kXWyujQXb-s,repair gutter old house,old house general contractor tom silva show maintain aluminum gutter downspouts see shop list tool subscribe old house httpbitlysubscribethisoldhouse shop list repair gutter gutter bracket screw use attach gutter fascia board aluminum panhead screw fasten together gutter downspout part aluminum downspout strap use secure downspout house tool repair gutter drilldriver use drive screw old house tv old house multimedia home enthusiast brand offer trust information expert advice awardwinning television highly regard magazine informationdriven website old house ask old house produce old house venture llc present pbs weta washington dc follow old house ask old house facebook httpbitlythisoldhousefb twitter httpbitlythisoldhousetwitter httpbitlyasktohtwitter pinterest httpbitlythisoldhousepinterest instagram httpbitlythisoldhouseig httpbitlyasktohig tumblr httpbitlythisoldhousetumblr old house ask old house visit us httpbitlythisoldhousewebsite repair gutter old house httpswwwyoutubecomuserthisoldhouse,Howto & Style,How to Fix/Repair,"This Old House,Ask This Old House,DIY,Home Improvement,DIY Ideas,Renovation,Renovation Ideas,How To Fix,How To Install,How To Build,gutters,alumium gutters,Home Repair,Do It YourselfConstruction,Design,Installation,drainage,Tom Silva,Interior Design,Interior,Cleaning,tom silva this old house,tom silva house,tom silva construction,tom silva tools,tommy silva"
l68jE-fKFOo,budget diy jewelry ideas handmade ring bracelets necklaces,amaze jewelry ideas budget moneysaving diys know expensive jewelry even simplest ones see store cost fortune video show make jewelry scratch use smart lifehack trick come design use items already home first video section show make beautiful ring use coin cut make smooth even make gem use glass another way make beautiful ring use nut though look something simpler less timeconsuming show ideas use spoon cut fill shimmery epoxy resin wait dry voila make beautiful diy necklace use wine cork cut paint markers attach together use jewelry accessories also show grow crystals simply add alum powder cup fill water add choice dye let ring sit mixture remove voila watch end discover easy bracelet tutorials many jewelry ideas timestamps make ring use coin make ring nut diy epoxy necklace grow crystals adorable diy choker sweet diy cement earrings make earrings use hotglue jewelry diy craft social media facebook instagram twitter subscribe craft girly httpsgooglfwbjqz subscribe craft kid httpsgooglpeulvt subscribe craft men bright side youtube httpsgooglrqtjzz videos article visit httpwwwbrightsideme music epidemic sound httpswwwepidemicsoundcom video make entertainment purpose make warranties completeness safety reliability action take upon information video strictly risk liable damage losses viewers responsibility use judgment care precautions one plan replicate follow video might feature activity perform actors within control environment please use judgment care precaution plan replicate,Howto & Style,DIY,"proyectos faciles,trucos de belliza,howto,tutorial,handcraft,tips,5 minute craft,useful things,life hacks,crafts,diy,5-minute crafts,tricks,do it yourself,diy projects,trucos,diy activities,5 minutes craft,lifehacks,jewelry,diy jewelry,how to make a ring,50 cent ring,nut ring,diy diamond ring,necklace,diy necklace,jewelry ideas,hot glue earrings,bracelet,cement jewelry,crystals,growing crystals,diy bracelet,choker,embroidery earrings"
lb3ewu_Jp28,diy ideas youre bore af home,sub vlog channel httpswwwyoutubecomlaurdiyvlogs bore house im house bore diys lol hope youre hold okay need get booty animal cross tiktok immediately figure might others look ways stay creatively occupy stay safe stay home huge thank essential workers lauren laur snapchat laurdiy instagram httpinstagramcomlaurdiy twitter httpstwittercomlaurdiy text hi diy babes welcome prettylittlelaur fam im lauren canadian live la makin diy dream come true every single day youll find everything diy relate include haul room decor clothe tryons product test many fail slime diys hack vlogs feature mini bull terrier moose im excite youre make sure leave comment ur new diy babe fam fav videos buy youtuber merch diying jam charles david dobrik dolan twin diys actually ask room decor easy affordable diy thrift store showdown best friend vs best friend alisha maries assistant day try aerial silks try guy,Howto & Style,DIY,"DIY,do it yourself,how to,laurDIY,lauren riihimaki,lauren diy,laurdiy room decor,laurdiy diy master,laurdiy diy challenge,at home,stay home,with me,home with me,bored,DIYs for when you're bored,ideas for when you're bored,bored at home,bored at home DIY,room decor,DIY room decor,DIY jewelry,easy diy,easy diy jewelry"
lj7YK1lIRUM,repair drywall fix hole wall,repair drywall fix hole wall make many homemade toy weapons channel make bind get hole wall well son accidentally put hole wall recently want show fix case happen home fix fix crack hole bathtub silence squeak door hinge httpsyoutubebihpjroczji cheap easy way extend fence height best way hang heavy display case mirror picture fix zipper jacket httpsyoutubecojobgwsuw use video content personal project risk,Howto & Style,How to Fix/Repair,"how to repair drywall,How to Fix a Hole in the Wall,drywall repair,how to patch drywall,How to Patch a Hole in Drywall,how to fix drywall,sheetrock,drywall,wall,repairing,large hole,diy,diy repair,do it yourself,Repair"
m5KK0zRDINg,stay fit college get best shape life,certify want share personal tip especially try work spring break bods show apps love nike train app httpwwwnikecomusenuscnikeplustrainingapp kayla itsines bbg httpswwwkaylaitsinescom photography website facebookcombeautybynatxo nataliebarbu nataliebarbu nataliebarbu doubtyourdoubtstumblrcom email business inquiries beautybynatxogmailcom friends website girls place feel safe secure love wwwbecomingrootedcom use airbnb code get edit hack title use video gabrielle marie httpswwwyoutubecomuserglamsolutions let know want see college vlogs high school advice college advice get ready videos makeup tutorials back school makeup look back school outfitslookbook along videos greek life sororities fraternity party frats wear college anything like travel vlogs always look travel video fitness video stay fit college get best shape life fitness routine workout routine workout gym gym routine shape stay shape kayla itsines bbg video etc ftc disclaimer video sponsor,Howto & Style,Health,"beautybynatxo,beautybynat,fitness,workout routine,fitness routine,fitness hacks,gym,workout,gym routine,nike training club,kayla itsines,before and after,how i became fit,fit,bbg"
nPlXdQQf-Us,busy girl life hack stay healthy,subscribe new videos every week today healthnut nutrition im share hack stay healthy every busy girl know ive collaborate mattress firm talk importance good sleep start day right mattress follow mattress firm instagram facebook twitter learn little choices make affect sleep camera equipment canon mm lens mm lens manfrotto video tripod manfrotto vlog tripod ride lav microphone follow social media website httpwwwhealthnutnutritionca twitter urhealthnut instagram urhealthnut snapchat urhealthnut facebook urhealthnut pinterest urhealthnut,Howto & Style,Health,"7 Busy Girl Hacks to Staying Healthy,life hacks,how to be healthy when busy,10 morning routine life hacks that every girl should know,life hacks every girl should know,10 girl life hacks you should know,how to be productive,30 lazy life hacks,food hacks,weightloss life hacks,how to sleep better,life hacks you need to know,diet hacks,how to be healthy,busy girl life hacks"
ocQzC4HgVFk,amaze diy ideas epoxy resin,timestamps pine cone resin volcano diorama epoxy resin diy miniature resin brush strip epoxy plate epoxy resin jewelry ideas video make entertainment purpose make warranties completeness safety reliability action take upon information video strictly risk liable damage losses viewers responsibility use judgment care precautions one plan replicate follow video might feature activity perform actors within control environment please use judgment care precaution plan replicate craft facebook instagram twitter subscribe craft girly httpsgooglfwbjqz subscribe craft kid httpsgooglpeulvt subscribe craft men bright side youtube httpsgooglrqtjzz videos article visit httpwwwbrightsideme music epidemic sound httpswwwepidemicsoundcom video make entertainment purpose make warranties completeness safety reliability action take upon information video strictly risk liable damage losses viewers responsibility use judgment care precautions one plan replicate follow video might feature activity perform actors within control environment please use judgment care precaution plan replicate,Howto & Style,DIY,"parents,how to,howto,tutorial,children,handcraft,tips,5-minute crafts family,useful things,easy life hacks,crafts,diy,5-minute crafts,tricks,do it yourself,diy projects,kids,diy activities,simple life hacks,family,lifehacks"
pSuytHWg8Qg,best diy craft ideas,timestamps awesome jewelry ideas cute polymer clay miniatures diy amaze easy bowl ideas decorate phone case resin video make entertainment purpose make warranties completeness safety reliability action take upon information video strictly risk liable damage losses viewers responsibility use judgment care precautions one plan replicate follow video might feature activity perform actors within control environment please use judgment care precaution plan replicate craft facebook instagram twitter subscribe craft girly httpsgooglfwbjqz subscribe craft kid httpsgooglpeulvt subscribe craft men bright side youtube httpsgooglrqtjzz videos article visit httpwwwbrightsideme music epidemic sound httpswwwepidemicsoundcom,Howto & Style,DIY,"parents,how to,howto,tutorial,children,handcraft,tips,5-minute crafts family,useful things,easy life hacks,crafts,diy,5-minute crafts,tricks,do it yourself,diy projects,kids,diy activities,simple life hacks,family,lifehacks"
