video_id,title,description,category,sub_category,tags
bnRit6gDGmg,stay fit reduce belly fat,shop link click show subscribe check healthy recipes blog httpswwwhotandflashycomcategoryhealthrecipes heritage flake cereal organic canellini bean truroots ancient grain spaghetti favorite workout dvds cathe friedrich low impact series tracie long longevity series tracie long focus series fitbit versa fitbit versa band amazon shop httpswwwamazoncomshophotandflashy discount cod curology prescription tretinoin httpcurologyhotandflashy first month free save tao clean aura orbital face brush system use code hotandflashy httpbitlyhotandflashy timeless skincare httpswwwtimelesshacom use code order colleen rothschild skincare use code full price item cant combine offer faves haircare line matcha toner mandelic acid serum channel httpwwwyoutubecomuserhotandflashy blog httpwwwhotandflashycom instagram httpinstagramcomangiehotandflashy liketoknowit facebook httpswwwfacebookcomangiehotandflashy twitter today makeup revlon colorstay prep protect primer ulta l oreal tru match super blendable makeup natural buff ulta amazon covergirl simply ageless instant fix concealer medium cosmetics bye bye pore hd powder ulta sephora amazon charlotte tilbury hollywood flawless filter medium nordstrom sephora covergirl serve sculpt palette bloom babe walmart amazon fenty beauty amplify eye primer milani bold obsessions eyeshadow palette walmart marc jacobs highliner gel eye crayon think sephora sephora hr contour eyeliner pencil lavender field marc jacobs velvet noir mascara sephora amazon urban decay double brow putty taupe trap ulta sephora nordstrom urban decay glideon lip pencil naked sephora ulta nordstrom maybelline super stay ink crayon lead way ulta walmart nail polish opi bossa nova around choker bracelet top right reserve hot flashy llc ftc sponsor opinions always honest link affiliate link click link buy something receive commission sale doesnt cost anything extra free use link choose use link appreciate support,Howto & Style,Health,"Anti-aging,skincare,style,how to,hotandflashy,hot and flashy,over 50,over 40,50 +,40 +,50 and,mature,skin,face"
c54WSOI-MMc,fix ugly lawn result step step beginners renovation,get lawn want get rid ugly bad look lawn yes see lawn renovate place transform show step step easy follow directions teach renovate lawn without wipe create beautiful lawn without spend lot money unlike videos show result grass seed starter fertilizer best deal tenacity tenacity weed control domyowncom surfactant domyowncom dyecolorant domyowncom gallon sprayer domyowncom also available amazon tenacity weed control amazon surfactant dyecolorant gallon sprayer pump gallon sprayer battery walk behind mower disclaimer video description comment contain affiliate link mean click one product link receive small commission help support channel allow us continue make videos like thank support check instagram great photos project update httpswwwinstagramcomsilvercymbal safety due factor beyond control silver cymbal guarantee improper use unauthorized modifications information silver cymbal assume liability property damage injury incur result information contain video use information risk silver cymbal recommend safe practice work machine tool see imply video due factor beyond control silver cymbal information contain video shall create express imply warranty guarantee particular result injury damage loss may result improper use tool equipment information contain video sole responsibility user silver cymbal,Howto & Style,How to Fix/Repair,"lawn care,lawn,lawn tips for beginners,renovating a lawn,renovating your lawn,lawn renovation,fixing my lawn,improving lawn,ugly lawn,awesome lawn,lawn beautfiul,beautiful lawn,lawn transformation,lawn before and after,fixing a bad lawn,lawn looks dead,wiping out my lawn,lawn care for dummies,get the lawn you want,lawn you want,silvercymbal,silver cymbal,ultimate lawn fix,diy lawn care,diy lawn,fix an ugly lawn,fix a bad lawn,overseeding"
c7vSxoMpi14,common design mistake bathroom remodel makeover mistake fix julie khuu,please subscribe stylish simple interior design tip love top design mistake video turn roombyroom series first common design mistake see make bathrooms remodel renovate simply make exist bathroom watch video catch make costly mistake come designbuild background specialize home renovations tip favor help drive value property come select materials finish detail design installation comment let know question come bathroom design thank watch let connect subscribe instagram httpswwwinstagramcomjuliekhuu twitter httpswwwtwittercomjuliekhuu facebook httpswwwfacebookcomhautekhuuture website httpswwwjuliekhuucom blog httpswwwhautekhuutureblogcom business inquiries httpsinfojuliekhuucom edit kelly nguyen julie khuu interior design music gil wander still morning juliekhuu interiordesigntips homedecor diy tutorial howto designmistakes bathroommistakes bathroomremodel bathroommakeover bathroomtips bathroomtile stoneandtile interiordesign,Howto & Style,How to Fix/Repair,"Interior design,decorating,home decor,how to's,diy,tutorials,bathroom remodel,bathroom makeover,bathroom tips,bathroom,bathroom tile,stone and tile,interior design,common mistakes,design mistakes,how to fix"
cYI8fYaIBAc,fix repair break internet connector replacement without crimp tool,diy without crimp tool fix repair break internet connector main tool flat head screwdriver fix ethernet cable connector like video please leave like share subscribe thank watch disclaimer video description contain affiliate link mean click one product link receive small commission help support channel allow us continue make videos like thank support crimp tool affiliate link connector affiliate link pcs rubber boot affiliate link,Howto & Style,How to Fix/Repair,"ethernet cable,repair internet,internet connector,rj45 connector,crimping tools,no connection,crimp RJ-45,crimp RJ-45 Connector,fix ethernet cable,broken cable,Without Crimping Tool,how to,rj-45,rj45,ethernet,crimp,lan port,crimping lan rj45,crimping rj45,crimping lan cable"
dX6OCgXRrpA,clever hack easy life craft diy ideas,amaze trick help get life order go spend ton money everyday necessities today show make scratch cook freeze pizza place clothe iron brick block foil remove security tag clothe use pair fork also show simple makeup tutorial try get things excuse weather key break lock stick hot glue attach key pull spoon fork turn fork use tape maximize space fridge attach magnets top part suspend drink mirror shave face front camera laptop timestamps cook pizza without oven remove security tag diy tablet stand awesome trick fan get rid pimples awesome hot glue hack toothpaste trick video make entertainment purpose make warranties completeness safety reliability action take upon information video strictly risk liable damage losses viewers responsibility use judgment care precautions one plan replicate follow video might feature activity perform actors within control environment please use judgment care precaution plan replicate social media facebook instagram twitter subscribe craft girly httpsgooglfwbjqz subscribe craft kid httpsgooglpeulvt subscribe craft men bright side youtube httpsgooglrqtjzz videos article visit httpwwwbrightsideme music epidemic sound httpswwwepidemicsoundcom,Howto & Style,DIY,"proyectos faciles,trucos de belliza,howto,tutorial,handcraft,tips,5 minute craft,useful things,life hacks,crafts,diy,5-minute crafts,tricks,do it yourself,diy projects,trucos,diy activities,5 minutes craft,lifehacks"
e5btJ0_KTU8,make mask home easy diy mask,wear mask hi want get vid asap help give resources make mask home confidence world diy mask things already help part protect community please safe please stay home lauren coronavirus laur snapchat laurdiy instagram httpinstagramcomlaurdiy twitter httpstwittercomlaurdiy text hi diy babes welcome prettylittlelaur fam im lauren canadian live la makin diy dream come true every single day youll find everything diy relate include haul room decor clothe tryons product test many fail slime diys hack vlogs feature sweet mini bull terrier moose im excite youre make sure leave comment youre new fav videos buy youtuber merch diying jam charles david dobrik dolan twin diys actually ask room decor easy affordable diy thrift store showdown best friend vs best friend alisha maries assistant day try aerial silks try guy,Howto & Style,DIY,"DIY,do it yourself,how to,laurDIY,lauren riihimaki,lauren diy,laurdiy room decor,laurdiy diy master,laurdiy diy challenge,how to make a mask,diy mask,how to make a mask at home,diy masks for COVID,COVID,COVID19,corona virus,corona,CDC,no sew mask,easy diy mask,easy at home mask,how to sew a mask,mask,easy mask,laurdiy mask"
eSpwKTWYnJQ,repair dry rot window sill,use method repair dry rot damage window avoid replace entire window frame sill httpbitlyjlgdey home improvement online ron hazelton hundred free diy ideas tip howtos suggestions video tutorials available help turn home improvement plan finish project project add every month goto place doityourselfers professionals alike check site httpwwwronhazeltoncom follow us twitter httpstwittercomronhazelton like us facebook httpswwwfacebookcomronhazeltonhousecalls follow us google view pinterest httpswwwpinterestcomronhazelton dont forget subscribe,Howto & Style,How to Fix/Repair,"window dry rot,repair dry rot,do it yourself,ron hazelton,home improvement"
ehJWnhoY4oo,lose weight fat sprint stay fit ramya,hey guy todays video talk keep fit explain sprint help lose weight fat hope enjoy video motivate way look start healthy lifestyle change cheer ramya follow twitter httpstwittercomramyavj like fb httpswwwfacebookcomvjramyaofficial insta httpswwwinstagramcomramyasub association divo httpwwwfacebookcomdivomovies httpstwittercomdivomovies,Howto & Style,Health,"workout,RamyaVJfitness,WorkoutwithRamya,VJRamya,ramya vj fitness,fitness workout for women,crossfit workouts,fitness workout,stayfit with ramya,stay fit with ramya,ramya fitness,ramya exercise,vj ramya workout,vj ramya fitness,ramya workout,fitness with ramya,fit with ramya,ramya subramanian,sprinting for fat loss,how to lose weight"
fBbKagy1dD8,diy ideas need life right,awesome craft ease life check many cool craft ideas prepare time find incredibly helpful project home make perfect pair dishwashing gloves attach kitchen sponge grab hot glue gun watch full tutorial besides find collection repair hack ease life right size wrench use coin coin fill gap bolt wrench unexpected ways use drill easiest way fix wall forget safety kid keep safe fall wardrobes chests drawers use safety strap attack wardrobes dressers wall another handy idea drill hole bigger screw use matchstick solve problem put matchstick hole tighten screw right sometimes change decoration wall simply tire picture face annoy problem hole nail screw wall share cool decision fix small hole crayon melt crayon press crayon hole throw away use laundry detergent bottle make lot craft home cut top laundry detergent bottle glue stainlesssteel sponge make cool clean tool kitchen one useful idea make toothbrush holder watch video bonus find lot decoration ideas make home even cozier several tutorials make beautiful soap hand minutes timestamps cool soap idea repair lifehack reuse detergent bottle decorate ceramic tile cool storage solution shoe social media facebook instagram twitter subscribe craft girly httpsgooglfwbjqz subscribe craft kid httpsgooglpeulvt subscribe craft men bright side youtube httpsgooglrqtjzz videos article visit httpwwwbrightsideme music epidemic sound httpswwwepidemicsoundcom video make entertainment purpose make warranties completeness safety reliability action take upon information video strictly risk liable damage losses viewers responsibility use judgment care precautions one plan replicate follow video might feature activity perform actors within control environment please use judgment care precaution plan replicate,Howto & Style,DIY,"5-Minute Crafts,DIY,Do it yourself,crafts,trucos,5 minutes craft,life hacks,5 minute craft,trucos de belliza,proyectos faciles,useful things,lifehacks,tricks,tips,DIY projects,DIY activities,Handcraft,Tutorial,howto,craft,crafts for home,repairing lifehacks,crafting ideas,drill,reuse,upcycle,laundry detergent bottles,handmade,soap,crystal soap,safety tips,ceramic tile,decor ideas,diy furniture,storage solutions"
fRJP66YHojE,stay healthy sehat kaise banaye motivational speaker anuragrishi,video health stay healthy health hindi tip health wealth sehat kaise banaye stayhealthy anuragrishi howtostayhealthy motivational video health anurag rishi transformational motivational speaker human potential trainer life coach work field personal development since videos live sessions mr anurag rishi empower lakhs people become part mission empower people realise true potential program mind success every year anurag address thousand people walk life whether private public sector ngos small medium entrepreneurs professionals school college students teachers doctor many inspirational videos keenly watch countries worldwide youtube mr anurag rishi conduct seminars workshops goal set structure life style public speak financial emotional success communication relationship skills leadership quality time management pressure handle skill firmly believe thatsuccess depend attitude rather talent connect anurag rishi social media click link connect anurag rishi connect anurag rishi youtube httpsgooglmyjhyd connect facebook fbmeanuragrishipage follow linkedin linkedincominanuragrishi connect instagram httpswwwinstagramcomanuragrishi website anurag rishi httpwwwanuragrishicom check best videos link list sell secrets anurag rishi sales train motivation आप कर goal set new year resolutions httpsyoutubeuvqlaomoncw brand बन band best prepare worst law gratitude goal set motivation video hindi anurag rishi failure disease excusitis motivational video kya life challenge inspirational video impossible nothing powerful motivational ｌｉｋｅ ｃｏｍｍｅｎｔ ｓｈａｒｅ ｓｕｂｓｃｒｉｂｅ,Howto & Style,Health,"motivational video in hindi,Anurag Rishi,Motivational Speaker,Best motivational video in hindi,best motivator,best video on health,health hindi video,health hindi tips,health benefits in hindi,health care urdu hindi,hindi tips for health,health is wealth,health video in hindi,sehat kaise banye,sehat banane ke tarike,sehat or life,how to stay healthy,how to become healthy and fit"
flx5KXWk4vE,diy baby doll hack craft miniature baby cradle diapers,subscribe toy story real life barbie friends stop motion appearance baby barbie family require take care watch new video make necessary babydoll accessories supply tool baby mold tape clear epoxy resin acrylic paint dry pastel half egg shape lol package scissor flitter fabric hot glue gun towel lace different bead wire tulle straw party cap decorative cardboard faux fur lead light colorful kid band aid wet wipe package marker wet wipe candle print label wet wipe pill capsule light clay utility knife model tool plastic ampoule old headphone plastic ring barbie phone baby picture ziploc bag foam paper fabric ribbons stickers sock plastic deodorant cap plastic cap cord fabric wooden skewer metallic ring light clay glue glitter glow dark ring light cap follow lalilu subscribe facebook instagram httpswwwinstagramcomthelalilu tiktok httpsvmtiktokcomqrmfva likee lalilu deutscher lalilu español lalilu français lalilu italiano lalilu polski lalilu português lalilu russian lalilu arabic lalilu chinese lalilu japanese lalilu indian lalilu indonesian lalilu korean lalilu thai lalilu türkçe lalilu vietnamese lalilu channel easy diy make video tutorials parent creative people dolls collectors lalilu channel put basis development creativity grow imagination need create original craft follow us interest forget turn notifications like subscribe,Howto & Style,DIY,"Barbie,for Barbie,baby,for baby,for baby doll,for dolls,ideas,hacks,life hacks,DIY,DIYs,crafts,creative,how to make,LaLiLu,quarantined,self-isolation,sitting at home,at home"
fzeJ_HVaSGE,creative diy phone case recipes gadget,fancy phone case ideas try round awesome phone case ideas upgrade device youll find unusual diys phone phone case decor ideas cool phone feature start use right away dont forget subscribe click timestamps unusual way reuse plastic straw phone case decor use polymer candy clay cute fluffy phone case handy phone case headphones flamingo phone case easy way upgrade phone case handmade phone case amaze diy phone case ideas make creative contact list rat message use animoji make emojis bigger video make entertainment purpose make warranties completeness safety reliability action take upon information video strictly risk liable damage losses viewers responsibility use judgment care precautions one plan replicate follow video might feature activity perform actors within control environment please use judgment care precaution plan replicate social media craft youtube facebook instagram twitter subscribe decor subscribe craft girly httpsgooglfwbjqz subscribe craft kid httpsgooglpeulvt subscribe craft men bright side youtube httpsgooglrqtjzz videos article visit httpwwwbrightsideme brand partnership enquiries brandsthesoulpublishingcom music epidemic sound httpswwwepidemicsoundcom,Howto & Style,DIY,"starbucks phone case,cooking tips,diy phone cover ideas,yummy phone case,recipes,kitchen lifehacks,anti-stress case,easy food to make at home,phone case decor,dinner,quick recipes,headphone holder,how to cook,delicious recipes,kitchen tips,best recipes,phone hacks,food hacks,easy recipes,diy phone case,kitchen crafts,cooking hacks,diy device,how to make,5-minute recipes,kitchen hacks,recetas,fluffy phone case,hidden phone functions"
fzhR6PNlI4E,fix repair hook time sew machine,video demonstrate fix adjust repair time hook sew machine thread needle isnt get catch hook rotate around video explain adjust fix require basic tool take minutes maybe less thank nigel chapman helpful comment time time singer machine time line needle bar help get exact time require needle bar lowest position see two line one mark lowest point use needle bar rise stop second line adjust hook point stop needle perfect time without guess,Howto & Style,How to Fix/Repair,"How To Crafts And Such,Sewing,Machine,Repair"
g-7ZWPCWv0U,fix posture move permanently,fix posture days httpathleanxcomxmyworkouts subscribe channel poor posture aware likely would welcome easy way fix video show step plan attack common posture flaw give nice tall upright posture sooner think go show hit correct round shoulder hunch back crook neck forward head tilt pelvis apply easy drill show start feel better almost instantly work towards permanently fix bad posture four biggest problem areas bad posture neck shoulder mid back pelvis specifically spend lot time sit desk behind wheel wind get slump shoulder round back counteract head pull downward wind tilt head look straight ahead effect overarch neck weaken deep neck flexors finally upper spine curve forward pelvis wind curl posterior pelvic tilt something adaptively tighten hamstring weaken lower back want fix posture hit areas individualize attention actually address depth follow videos fix round shoulder httpswwwyoutubecomwatchvolwtclajws fix anterior pelvic tilt fix posterior pelvic tilt fix round upper back say something areas help correct postural problems without spend long time day efficient effective need consistency order make last impact correction funny thing posture often spend lifetime things ruin posture first place yet expect able fix hour hour posture correction exercise immediate impact way feel feel mobility tighten areas body begin move free easy bite consistency able make permanent change posture feel stronger look much better important note posture work reference earlier good idea lift weight body severely alignment strengthen poor posture dysfunction lift weight presence dysfunction quickly go lead compensations elsewhere kinetic chain likely wind injury much smarter fix issue posture first strengthen body reinforce new perfect posture complete program help correct posture time actually build new muscle get rip head httpathleanxcom get athleanx train system use exact workout routine use jesse add muscle frame dramatically improve look stand videos fix bad posture best way get rid scapular wing round shoulder sure subscribe channel youtube,Howto & Style,How to Fix/Repair,"fix posture,bad posture,correct posture,posture fix,how to fix rounded shoulders,slumping shoulders,hunch back,round shoulders,forward head,forward neck,forward shoulders,poor posture,how to fix bad posture,how to fix poor posture,how to correct your posture,proper posture,body alignment,posture stretches,stretches for bad posture,exercises for bad posture,exercises for posture,athlean x,athleanx,jeff cavaliere"
gOFGxI4wlh0,make biggest diy hot cheetos world quarantine,make giant largerthanlife hot cheetos biggest cheetos world thrive find facebook httpsmfacebookcomthekarinabear check reality show awesomenesstv know launch new kit target also walmart also find craft city products amazon diy bath bomb geode kit diy clear slime kit premade seaside taffy information craft city find us httpscraftcitylifecom three book musttry diys craft life hack diy slime nextlevel diy slime like diy hot cheeto video see previous video link instagram twitter karinaabear snapchat karinaabear tiktok realkarinagarcia,Howto & Style,DIY,"hot cheetos,giant,karina garcia,karina garcia diy,diy,diy hot cheetos,hot cheetos recipe,recipe,giant recipe,family recipe,quarantine,giant food,stunt,funny,delicious,flamin hot cheetos,hot cheetos challenge,challenge,experiment,hot cheetos bread,how to,how to cook,flaming hot cheetos,mukbang,asmr hot cheetos,huge,testing tiktok recipes,funny videos,garcia,viral,bored in the house,boredom,mozzarella cheese,churro recipe,churro,attempted,fry em up"
gOu2c2GvXR4,fix leak bathtub faucet quick easy,quick easy clear step step tutorial fix leak bathtub faucet leak single handle bathtub faucet fix quick easy water leak handle turn water fix quick easy clog bathroom sink quick easy tutorial fix leak kitchen sink faucet check tutorial fix quick easy faucet handle stick puller get get get bathtub faucet washers please show support like us facebook,Howto & Style,How to Fix/Repair,"bathtub,faucet,leak,plumbing,leaking,running,water,fix,repair"
gwBQxhZhKnE,fix bike shift gear,often ask fix bike wont shift gear shift gear problem shifters derailleurs cable walk step isolate locate issue fix cover front derailleur rear derailleur fix shifter catchingclicking wont shift bike shifters wont shift common cause diagnoserepair stiffsticky shift bike repair shimano stx rc trigger shifter wont shift derailleur limit screw adjust limit screw straighten bend derailleur hanger subscribe hit httpbitlysubrjthebikeguy please give video thumb httpswwwfacebookcomrjthebikeguy httpwwwrjthebikeguycomtools httpbitlyrjbikeguyshirts httpwwwrjthebikeguycom,Howto & Style,How to Fix/Repair,Bikes
hgvMjJVr0x4,cool decor diy ideas gadget,useful trick craft try things get tire get damage way fix video show give old stuff second life use genius trick solve annoy problems cut multiple straw place greaseproof paper create beautiful colorful case phone also apply mask tape clear phone case spray paint gold rise gold make look elegant show use polymer clay cut mold cheese create cool organizer earphones mix epoxy resin dye turn bite transparent brown color add blob clear phone case attach cocacola logo back make look like real soda timestamps beautiful phone case ideas amaze polymer clay craft cat astronaut phone case cool engineer trick beautiful denim case melt icecream phone case emoji phone case video make entertainment purpose make warranties completeness safety reliability action take upon information video strictly risk liable damage losses viewers responsibility use judgment care precautions one plan replicate follow video might feature activity perform actors within control environment please use judgment care precaution plan replicate social media facebook instagram twitter subscribe craft girly httpsgooglfwbjqz subscribe craft kid httpsgooglpeulvt subscribe craft men bright side youtube httpsgooglrqtjzz videos article visit httpwwwbrightsideme music epidemic sound httpswwwepidemicsoundcom,Howto & Style,DIY,"proyectos faciles,trucos de belliza,howto,tutorial,handcraft,tips,5 minute craft,useful things,life hacks,crafts,diy,5-minute crafts,tricks,do it yourself,diy projects,trucos,diy activities,5 minutes craft,lifehacks"
hhjnL42kYVE,minutes total body workout stay fit ramya,hey guy todays video talk minutes total body workout anywhere min longso u game healthy competition join post score comment column cheer ramya follow twitter httpstwittercomramyavj like fb httpswwwfacebookcomvjramyaofficial insta httpswwwinstagramcomramyasub association divo httpwwwfacebookcomdivomovies httpstwittercomdivomovies,Howto & Style,Health,"StayfitwithRamya,RamyaVJfitness,WorkoutwithRamya,VJRamya,ramya vj fitness,fitness motivation,fitness workout for women,crossfit workouts,fitness workout,stay fit with ramya,stayfit with ramya,ramya fitness,ramya exercise,vj ramya workout,vj ramya fitness,ramya stay fit,anchor ramya hot"
