video_id,title,description,category,sub_category,tags
N-Kt3eUbia4,repair drywall fix large hole plaster wall easy way,fast easy way patch large hole plasterboard wall simple way repair large hole plasterboard wall need simple tool repair drywall straight edge sharp stanley knife similar scrap piece plasterboard drywall plaster tape plaster spreader short piece timber screw electric drill small drill bite pencil premixed plaster filler paint brush cover finish repair ask could repair large drywall hole plasterboard wall rental property decide make short video show go repair plasterboard restore back new condition day repair onsite unrelated work didnt tool source bits use dumpmaster bin front property ps better instruction video tool plasterboard call gyprock make csr coat side grey paper find onsite tape fiberglass make specially plaster screw anything long countersink find onsite wood use piece scrap timber find onsite plaster spak find onsite checkout videos garry purcells youtube channel httpswwwyoutubecomgarrypurcell,Howto & Style,How to Fix/Repair,"Repair Drywall and Fix a large Hole in the Plaster Wall,repairing a large hole in plasterboard,plasterboard hole repair,how to fix a hole in plasterboard wall,easy way to Repair a hole in plasterboard wall,repair plaster wall hole,repairing hole in plasterboard wall,fix a large hole in a plaster wall,repair large hole in plasterboard wall,drywall repair large hole,how to fix drywall holes in wall,how to fix drywall holes,hole in wall repair,Repair Drywall,repair"
NBF7M2LKBFQ,transform room decorate ideas cool diy ideas crafty panda,always better enjoy time lovely decorate room trust always spend ridiculous amount money achieve fun room design whole bunch cool diy home decorate ideas create lovely cushion learn different ways create stylish lamp dive world diy magic stay tune many amaze diy house decor ideas decorate hack crafty panda enjoy video might also like fun home decor ideas diy mini garden plant hack crafty panda love music use video find music epidemicsound check merch httpsstoredftbacomcollectionscraftypanda chair cushion plastic bottle vase bucket planter branch lamp decoration coconut planter photo display mirror portals diy mattress subscribe crafty panda bubbly español deutsch français português pусский arabic hindi little top crafty panda playlists home decor diy ideas diy hack clean organize hack like us facebook httpsfacebookcomcraftypanda visit bore panda website httpswwwboredpandacom get animate stickers crafty panda httpbitlybpandastickers sponsor content contact us craftyboredpandacom homedecor decorations roomdiy,Howto & Style,DIY,"Home decor ideas,Home craft ideas,Home hacks,Home decor,Room decor ideas,Room decor,Indoor decor ideas,Decoration ideas,Decorating tips,Decor hacks,Decor ideas,Decor,Creative decor tips,Easy decorations,Colorful decorations,DIY for home,DIY home decor,DIY home decorating,DIY room decor,DIY projects,How To,Simple,Easy,Life Hacks,Hacks,Tips,Tricks,Do It Yourself,DIY,Crafty Panda"
NFN0rn0XKJs,eat day lose weight stay healthy isolation,main channel httpswwwyoutubecommollyslife happy april hope guy enjoy simple eat day struggle stay healthy meals work home friendly easy recreate home enjoy white plate bowl business inquiries please email mollybaileyprgmailcom follow instagram mollybails twitter mollybails snapchat mollybails spotify molly bailey fitness instagram mollyannefit ftc disclaimer video sponsor whatieatinaday loseweight whatiatetoday,Howto & Style,Health,"missmollyanne14,molly bailey,what i eat in a day,what i ate today,what i eat in a day to lose weight,lose weight,weight loss,how to lose weight,how i lost weight,work from home,healthy at home,healthy meals at home,how to stay healthy,how to get healthy,healthy,meal ideas,at home meals,meals at home"
NVVcAt73C3c,fix bend crankshaft engine taryl,taryls halloween extravaganza begin haunt podunk taryl inherit haunt old part bad things begin happen around shop intro end taryl go properly fix bend crankshaft small engine hit something yard push mower vibrate gotcha cover taryl go couple different methods straighten crank well else look hit something another fun educational howto video pal grass rat garage always theres dinner sure pick taryl apparel ship worldwide daily httpwwwtarylfixesallbigcartelcom follow gang facebook instagram tarylfixesall httpwwwfacebookcomtarylfixesall httpwwwinstagramcomtarylfixesall subscribe channel look brand new howto video every sunday morning central,Howto & Style,How to Fix/Repair,"how to,how,to,fix,repair,straighten,straight,bent crank,crankshaft,crank shaft,crank,shaft,bent,hit something,uneven,balance,off balance,vibrating,straightener,machine,hammer,magnet,podunk,haunting,halloween,taryl,fixes,all,grass rats,garage,haunted part,hit,whacked,bent blade,blade,sheared key,sheared,flywheel,key,timing,running bad,vibrates,shakes,protection sleeves,stens,proparts direct,pro parts,crooked,pushmower,push mower,lawn mower,mower"
NqsdhgqMv3Q,school diy fun cool school hack diy ideas crafty panda,school soon never late create lovely school accessories school craft also learn awesome cheat note ideas tell learn sort awesome ways create cute pencil case paperclips simply turn bracelet pencil cup stay tune nerdy pandas many fun school hack school craft crafty panda enjoy video might also like easy science experiment trick show school crafty panda httpsyoutubecdobfqeobjc love music use video find music epidemicsound markers paint delete bad grade loose cord cheat balloon bracelets pencil cup cute pencil case cute paperclips sneak chip brush holder hide phone phone back subscribe crafty panda bubbly español deutsch français português pусский arabic hindi little top crafty panda playlists school hack lifehack couple diy hack like us facebook httpsfacebookcomcraftypanda visit bore panda website httpswwwboredpandacom get animate stickers crafty panda httpbitlybpandastickers sponsor content contact us craftyboredpandacom schoolsupplies backtoschool schoolhacks,Howto & Style,DIY,"School DIY,School Hacks,School Ideas,School Tips,School Tricks,School Activities,School Supplies,School Crafts,School Accessories,School Funny,School Life,School Guide,High School,School,College DIY,College Hacks,College Ideas,College Life,College Funny,College Situations,College,Backs To School,Fool Teacher,Into School,Into Class,DIY Ideas,DIY Crafts,Tutorial,Guide,How To,Simple,Easy,Life Hacks,Hacks,Do It Yourself,DIY,Crafty Panda"
NzJSWBMBBBI,tip lose weight stay fit,stay fit doesnt rocket science video partner lifesum share ten tip keep trim lose weight try lifesum get lifesum subscription use code jennim wwwlifesumcomredeem code valid june subscribe become jem today shop clothe line eggie httpeggieus instagram httpinstagramcomimjennim twitter httptwittercomimjennim facebook httpfacebookcomimjennim spotify snapchat httpsnapchatcomaddjennimsnaps video film ben jolliffe video graphics animations chrisline thumbnail dld studio music dj grumble soundcloud dj grumble spotify ftc video sponsor lifesum,Howto & Style,Health,"imjennim,jenn im,how i lost weight,how i lose weight,tips to lose weight,how i stay fit,fitness advice,weight loss,weight loss advice,health hacks,fitness hacks,losing weight,health tips,clothesencounters,diet tips"
OSerOs-wH9o,simple ways stay fit without gym,people want work fitness likely think first join gym thing go gym always best method especially encourage stay put home fact hit gym costly pocket precious time besides gym really fun sure social reward one enjoy treadmill hour exercise room sweaty people fortunately tons ways stay fit without gym interest keep watch know options acro yoga get bore home keep busy fit time acro yoga type exercise combine traditional yoga acrobatics heal arts together grab partner family member give abs legs arm great work fun way pass time keep body engage walk walk probably underrate exercise go favorite cafe block ahead walk want save buck gas walk plenty ways incorporate extra step day walk around bite instance park away compel walk rock climb rock climb do indoors outdoors sport intensely challenge cardio strength mental flexibility work various muscle group body moreover rock climb mental workout require make quick decisions navigate route correctly dance whether shower kitchen backyard live room dance heart content dance effective workout reduce stress boost flexibility keep fit without go gym run stairwell tire go outside run make use stairs build take ipod run stairs minutes feel sweaty work time free workout videos countless workout videos internet today access free take advantage home plus also take exercise routine outside backyard front lawn want vitamin may also inspire powerwalk neighborhood run wooded trail video game game console collect dust home worry time use wiifit plus xbox several activities appeal fitness exercise enthusiasts like activities help get fit home without take fun factor suggestions leave let talk comment section subscribe channel,Howto & Style,Health,"7 Simple Ways to stay fit without a gym,how to get fit at home,how to get fit without gym equipment,how to get fit body without gym,how to get fit without going to the gym"
QWNE3KN9Icw,fix rip furniture fittings particle board furniture repair,fix rip furniture fittings particle board furniture repair part craftroom channel huge collection useful tip handymen find variety lifehack trick interest solutions subscribe channel miss new video videos new tool make old metal cut blades amaze simple life hack aluminum plus wood diy project sand addon device jigsaw replaceable sandpaper httpsyoutubeytrlzxmsvkw cool homemades come useful superlifehacks handyman,Howto & Style,How to Fix/Repair,"tips,money saving,hacks and tricks,helpful tips,best tips,best tip,life hacks,useful tips around your home,house tips,hacks,tips and ideas,money saving tips and ideas,house,home,around the house,around the home,tutorial,tricks,how to,home tips,tips and tricks around the house,money,money saving ideas,how to save money,tip,Money,saving money,money saving hacks,money saving life hacks,money saving life hacks and tricks,do it yourself,useful things"
RPhAw6Mzb4k,one exercise tone abs ramya,disclaimer remember exercise risk injury dont use correct techniques health issue physical ailments like joint problems back trouble always speak doctor begin new fitness routine advantage plank every day increase core strength tone tummy strengthen back increase flexibility posture balance get improve help improve bone joint health plank variations side plank reverse plank straight arm plank plank leg lift plank stabilitymedicine ball side plank crunch min plank workout every day equipment need muscle target abs core chest butt back exercise full plank min elbow plank sec raise leg plank side sec side plank side sec full plank sec elbow plank min cheer ramya follow twitter httpstwittercomactorramya like fb httpswwwfacebookcomvjramyaofficial insta httpswwwinstagramcomramyasub snapchat ramsub association divo httpswwwfacebookcomdivomovies httpswwwtwittercomdivomovies httpswwwinstagramcomdivomovies,Howto & Style,Health,"StayfitwithRamya,workout,RamyaVJfitness,WorkoutwithRamya,VJRamya,ramya vj fitness,fitness motivation,fitness workout for women,crossfit workouts,fitness workout,plan ramya,plank workout,plank benefits,plank position,plank challenge,stay fit with ramya,stayfit with ramya,home workout,total body workout series,vj ramya workout,workout videos,ramya fitness,vj ramya,ramya subramanian,ramya workout,ramya stay fit,exercise,at home workout"
RbwQXVUaIGw,foods boost immune system stay healthy fallwinter,go back grocery store show foods keep healthy strong fall winter season eat foods boost immune system foster gut bacteria immune systems cells locate guy best interest help flourish spoiler alert sugar destroy gut bacteria addition negative side effect know bone broth must cold flu season make easy way cheaper think eat foods ferment load live active culture probiotic bacteria gut need mad love bobbydessiand art xoxo redmond real salt promotry toothpaste incredible stuff httpsshopredmondlifepagesbobbyparrishbundle httpsshopredmondlifepagesbobbyparrishearthpastebundle subscribe new podcast order new keto cookbook recipes ghee recipe httpswwwflavcitycomclarifiedbutter immune tea recipe httpswwwflavcitycomimmuneboostingtea ferment cod liver oil wo natural flavor cinnamon mint four videos every week two grocery store weekend two cook videos include live stream week follow social media facebook httpswwwfacebookcomflavcity instagram httpswwwinstagramcomflavcity twitter httpswwwtwittercomflavcity,Howto & Style,Health,"immune system,boost immunity,health tips,healthy eating,immune boosters,vitamin c,healthy food,boost immune system,natural health,how to increase immunity power,immune system booster,how to boost immune system naturally,immune boosting foods,how to boost immune system,what to eat,staying healthy,healthy,how to be healthy,how to stay healthy,flavcity,bobby parrish,grocery haul,healthy grocery haul,fall grocery haul,fall grocery haul 2019"
RldP8SYkXVU,fix curve nail manicure transformation,fix curve nail manicure transformation video show fix curve nail transformation fresh manicure also fix break nail refresh shape try new design think watch video dont forget subscribe wont miss new tutorials secrets instagram daily nail hack inspiration instagram httpswwwinstagramcomnailcou use control gel clear favourite products use daily basis httpamazoncomshopnailcou videos acrylic infill safe acrylic removal acrylic nail baby boomer let keep touch instagram httpswwwinstagramcomnailcou httpswwwinstagramcomnailsproacademy httpswwwinstagramcomnailsproacademy facebook httpfacebookcomnailsproacademy periscope nailcouture snapchat nailcou tiktok nailsproacademy pinterest httppinterestcomaluksha gelnails nailcou nailtransformation подпишитесь на мой русский канал чтобы не пропустить новые мастерклассы обзоры и влоги,Howto & Style,How to Fix/Repair,"nailcou,anastasia luksha,nail art videos,nail art tutorial,nail art video,simple nail designs,gel nails,gel fill,gel infill,curved nail,almond nails,broken nails,nail transformation,manicure nails,before and after,polygel nails,sculptured nails,fix curved nails,gel polish,nail art ideas,nail art at home,for beginners,nail technician,Russian manicure,e file manicure,electric file manicure,gel infill at home,diy,tips,tricks"
RpP99RLzXAE,day life stress teenager try stay fit lol,day life stress teenager follow instagram carolinemanning pinterest carolinemanningg vsco caromanningg spotify carolinemanning business inquire carolinemanningselectco another country click link translate language business inquiries email locate section hi caroline man teen base texas sophomore high school channel find vlogs music cover originals challenge videos life love vlogging fashion travel adventure also sometimes film videos older sister currently college air force academy make sure subscribe follow journey see soon xx caro,Howto & Style,Health,"12-15-19,Caroline Manning,Workout,Teenager,Teen,Friends,School,High School,Sophomore"
SIEyAPEgPaI,colorful diy ideas whole family,timestamps cute crayon ideas decorate shower curtain colorful experiment whole family diy glow jar amaze glitter art make shine satisfy color video make entertainment purpose make warranties completeness safety reliability action take upon information video strictly risk liable damage losses viewers responsibility use judgment care precautions one plan replicate follow video might feature activity perform actors within control environment please use judgment care precaution plan replicate craft facebook instagram twitter subscribe craft girly httpsgooglfwbjqz subscribe craft kid httpsgooglpeulvt subscribe craft men bright side youtube httpsgooglrqtjzz videos article visit httpwwwbrightsideme music epidemic sound httpswwwepidemicsoundcom,Howto & Style,DIY,"parents,how to,howto,tutorial,children,handcraft,tips,5-minute crafts family,useful things,easy life hacks,crafts,diy,5-minute crafts,tricks,do it yourself,diy projects,kids,diy activities,simple life hacks,family,lifehacks"
SKoCMGmzUnA,tip stay fit,turn forty milestone celebrate also age certain health condition start creep tip dr sheela nambiar author book fit forty stay fit age ndtv one leaders production broadcast unbiased comprehensive news entertainment program india abroad ndtv deliver reliable information across platforms tv internet mobile subscribe videos like us facebook httpswwwfacebookcomndtv follow us twitter httpstwittercomndtv download ndtv apps httpwwwndtvcompageapps watch videos httpwwwndtvcomvideoyt,Howto & Style,Health,"shotonsamsung,Tips To Stay Fit,Tips To Stay Fit After 40,Stay Fit After 40,how to Stay Fit After 40,Fit At Forty,health conditions after 40,NDTV,Dr Sheela Nambiar"
U3rKPexoEcA,fix lean fence,fix lean fence access neighbor side one post concrete base second post concrete side two different install methods use fence mender find online instal interest ez mender similar product available amazon affiliate link thank watch please click like subscribe,Howto & Style,How to Fix/Repair,"How to fix a leaning fence,fix post,replace fence post,fix fence post,how to repair fence post,straighten leaning fence,leaning fence,how to replace post,weekendhoneydolist,fence post concrete,fix a fence,build a fence,install fence post,artisticzeal,AZP,repair falling fence How-to"
U9biw0l-0ik,eat day stay fit healthy realistic,eat day stay fit healthy favourite foods realistic like eat stay fit healthy healthy important love fuel body healthy easy nutrient meals course love treat icecream addict lol hope u enjoy random realistic eat day xxx ig charlotterebecca get contact businesses would like work collaborate contact possible please put business collab subject title line get email quickly respond asap thankyou xx socials instagram snapchat twitter hi name charlotte year old gal melbourne australia love make youtube videos take instagram pics video sponsor whatieatinaday healthy teenwhatieatinaday,Howto & Style,Health,"what I eat in a day,what I eat in a day realistic,what I eat in a day to loose weight,tone up,fit,healthy,food ideas,healthy breakfast,ehat I eat in a day as a model,what I eat in a day healthy,healthy meals,what I eat in a day as a teen,what I eat in a day in high school,misscharlottebeauty1 what i eat in a day"
UYRHPXWscwk,start healthy lifestyle get fit stay organize eat healthy,dont forget enter huge giveaway win ipad polaroid camera urban decay naked palettes free huge giveaway win ipad polaroid camera naked pallettes open get customize planner wwwpersonalplannercom instagram personalplanner facebook personalplanner much discount code dbsalasft august hope enjoy start healthier lifestyle video share simple yet effective things like drink water eat healthier stay organize video physical health mental health well live get really overwhelm sometimes may forget take care guy cant take body grant home health fitness relate videos exercise diet tip fitness routine get bikini body stay fit healthy food ideas healthy breakfast ideas p r e v u v e huge giveaway win ipad polaroid camera naked pallettes open thank sis film nilsani music fwu kehlani cool summer demi lovato shes kinda hot hans deck tinashe jessie j songs copyright go owners dont forget buy something online store everyone order get feature video tag paradisecouture everyting worldwide ship love online store httpwwwparadisecouturecom link twitter httpstwittercomberrypinklips instagram httpsinstagramcomhaileybpl email business berrypinklipsgmailcom vlog channel httpwwwyoutubecomuserhaileysluyf tumblr httpthegoldensoulstumblrcom snapchat haileybpl faq old camera editor use use canon rebel edit final cpx love pluto back hailey,Howto & Style,Health,"berrypinklips,berry,pink,lips,beauty,makeup,cosmetics,guru,hauls,reviews,tutorials,macbarbie07,General Fitness Training,Weight,Look,Loss,how to start a healthy lifestyle,get fit,get fit for summer,bikini body,stay organized,fitness,workout routine,summer workout routine,fitness routine,how to eat healthy,training,running,walking,personal planner,how to stay organized,how to lose weight"
VoGHFJ7H_MI,repair drywall,video make hole drywall show repair drywall start finish join mr build team httpswwwyoutubecommrbuildit merch channel httpwwwpatreoncommrbuildit social media instagram httpswwwinstagramcommrbuildit facebook httpswwwfacebookcommisterbuildit twitter httpswwwtwittercommisterbuildit pinterest httpswwwpinterestcommrbuilditan blog wwwmrbuilditandmrsstyleitcom tool affiliate link inch drywall knife inch drywall knife mud pan drywall mud pre mix hawk,Howto & Style,How to Fix/Repair,"how to repair drywall,drywall repair,how to patch drywall,how to mud drywall,drywall,drywall taping and mudding,drywall installation,drywall patch,drywall finishing,how to repair drywall holes,patching drywall,repair drywall hole,how to fix drywall,how to tape drywall,damaged drywall,patching drywall holes,repair drywall hole in wall,hole in wall,patching drywall with texture,home repair (interest),repair drywall tape,drywall patch texture match"
WCiXBhzTx8Q,cool scarf hack ways tie scarf diy fashion hack crafty panda,know scarf one essential items wardrobe use clothe item accessory even instead bag learn create lovely dress scarf necklace even awesome hairstyle forget stay tune see awesome diy ideas many cool fashion hack crafty panda enjoy video might also like whoop diy clothe hack fashion ideas fix outfit crafty panda love music use video find music epidemicsound check merch httpsstoredftbacomcollectionscraftypanda scarf heel kitten scarf dress scarf ring hack scarf necklace scarf hair scarf bun tshirt scarf hack bag scarf scarf bow tie scarf flipflops scarf short blanket top subscribe crafty panda bubbly español deutsch français português pусский arabic hindi little top crafty panda playlists diy clothe fashion makeup beauty hack school hack like us facebook httpsfacebookcomcraftypanda visit bore panda website httpswwwboredpandacom get animate stickers crafty panda httpbitlybpandastickers sponsor content contact us craftyboredpandacom fashionhacks diyideas clothesdiy,Howto & Style,DIY,"Scarf Hacks,Scarf Ideas,Scarf Styling,Scarf,Fashion Ideas,Fashion Hacks,Fashion Tips,Fashion Tricks,Fashion DIY,Fashion,Outfit Ideas,Outfit Tips,Outfit Tricks,Outfit Hacks,Outfits,Clothes Upcycle,Clothes Recycle,Clothes DIY,Clothes Hacks,Clothes Ideas,Clothes,Wardrobe Ideas,Wardrobe Tips,Wardrobe Tricks,Wardrobe,Tutorial,Guide,Step By Step,How To,Simple,Easy,Life Hacks,Hacks,Tips,Tricks,DIY Activities,Do It Yourself,DIY,Crafty Panda"
Wqn5z259y88,diy clothe hack really smart girls,adorable clothe ideas trick improve life video show repurpose old clothe turn brand new items match current fashion trend turn pair wide pant adorable dress wear one part leg slice part tie around waist turn buggywide hoodie cute playsuit cut side sew back together make fit like glove lot plain shirt longer year take cut various place make shirt dress take oversized men short cut inside edge turn comfy skirt watch end see give color jeans brilliant hack timestamps recycle old shirt repurpose men short dye jeans brilliant clothe design try fix large trousers repurpose leggings swim pool leggings crop top video make entertainment purpose make warranties completeness safety reliability action take upon information video strictly risk liable damage losses viewers responsibility use judgment care precautions one plan replicate follow video might feature activity perform actors within control environment please use judgment care precaution plan replicate social media facebook instagram twitter craft craft kid httpsgooglpeulvt bright side youtube httpsgooglrqtjzz videos article visit httpwwwbrightsideme music epidemic sound httpswwwepidemicsoundcom,Howto & Style,DIY,"women,girly,proyectos faciles,5-minute crafts girly,girl,trucos de belliza,tutorial,handcraft,tips,useful things,crafts,diy,girls,5-minute crafts,beauty,tricks,do it yourself,diy projects,woman,trucos,diy activities,lifehacks"
