video_id,title,description,category,sub_category,tags
-EiAN6oa_oY,repair scratch car save hundreds dollars,repair scratch car save hundreds dollars repair scratch jeep cherokee cheap note comment suggest use higher grit sand paper paint dry right buff make shinier smoother also use wax buff compound polish thank watch good luck project get materials sandpaper blue painters tape plastic spreaders body filler compound polish microfiber towel sponge wax respiratormask goggle camera equipment camera lens light sd card please like comment share video please subscribe channel follow instagram instagramcomthomasofalltrades wax use video comment suggest use wax use compound polish amazon link affiliate link,Howto & Style,How to Fix/Repair,"How to,how to repair scratches on your car,how to repair scratches,how to repair scratches on car,repair,chrisfix,mad4motors,autoblog,ratchets and wrenches,crazyrussianhacker,nigahiga,ammonyc,how to fix scratch,how to repair deep scratches,how to paint your car,how to paint scratches,how to remove scratches,jeep,jeep cherokee"
-fByZlRRsuM,stay healthy winter dont want sniffle,vitamin day keep doctor away hello everyone sick suck decide put lil list stuff together help guy stay healthy feel like mom anyways hope youre great day love u much xx l k e instagram twitter snapchat pinterest spotify dote httpsdoteapplinkqadvrlglkp f q old live canada whats thing arm continuous glucose monitor type diabetes edit software final cut pro camera canon b u n e n q u r e sadiealdisgmailcom woah u make way ily,Howto & Style,Health,"how to be healthy for teenagers,how to be healthy and fit,how to be healthy,how to stay healthy,my fitness routine,how to not get sick,health tips,teen workout routine,how to be healthy in high school,how to be healthy in winter,healthy,tips,avoid getting sick,sadie aldis"
17XNEi1fJxM,common men hair problems fix,check old spice new dry shampoo httpbitlyosdryshampootmfed check best groom line men hudson mane httpshudsonandmanecomtmf want tshirts fit perfectly check esntls sell best ts world httpswwwesntlsco pick one let know think subscribe channel thank old spice sponsor video follow us social media website httpteachingmensfashioncom snapchat joseczuniga instagram email infoteachingmensfashioncom facebook twitter address sw village center dr port st lucie fl music httpssoundcloudcomlakeyinspired httpssoundcloudcomdyallas,Howto & Style,How to Fix/Repair,"TMF,Teachign mens fashion,Jose Zuniga,Mens Wear,Mens fashion,mens style,Style tips,menswear,mens fashion,GQ,Men's Style Tips,Men's Lifestyle,suits,reviews,men's Clothing,ESNTLS"
1gSBnMehzao,funny summer prank best diy prank war,prank girlfriend boyfriend summer friends love prank best diy hack ideas prank friends family instagram httpswwwinstagramcommaryanazdep mr degree present super cool videos video create entertainment purpose music httpsplayerepidemicsoundcom prank funny diy,Howto & Style,DIY,"prank,diy,life hacks,hacks,pranks,girls,summer,tricks,friends,funny"
2afHjjI2b3w,fix leaky hose spigot ask old house,ask old house plumb heat expert richard trethewey explain common failure point hose spigots repair thisoldhouse asktoh subscribe old house httpbitlysubscribethisoldhouse time hour cost skill level moderate tool wrench philips head screwdriver reseat tool shop list washer repair kit teflon tape step fix leaky hose spigot richard explain circumstances leaky hose spigot leak one two place bonnet spout leak bonnet start tighten bonnet wrench b work shut water fully remove shutoff bonnet check washer underneath bonnet wear replace washer replacement kit buy home center even pack thread connection tightly teflon tape trick leak spout process little involve turn water remove stem unit b loosen screw bottom stem unit screwdriver go hard loosen important use right size screwdriver enough force prevent strip c replace washer stem unit put screw back place take reseat tool push open stem unit twist around smooth seat stem unit rest e reinstall stem unit turn water back resources spare washer kit teflon tape spigot repair tool find home center plumb supply house ask old house tv homeowners virtual truckload question us smaller project ready answer ask old house solve steady stream home improvement problems face make house call ask old house feature familiar face old house include kevin oconnor general contractor tom silva plumb heat expert richard trethewey landscape contractor jenn nawada follow old house ask old house facebook httpbitlythisoldhousefb twitter httpbitlythisoldhousetwitter httpbitlyasktohtwitter pinterest httpbitlythisoldhousepinterest instagram httpbitlythisoldhouseig tumblr httpbitlythisoldhousetumblr keywords old house ask old house diy home improvement diy ideas renovation renovation ideas fix install build watch full episode fix leaky hose spigot ask old house httpswwwyoutubecomuserthisoldhouse,Howto & Style,How to Fix/Repair,"This Old House,Richard Trethewey,Kevin O’Connor,plumbing,yard,hose,spigot,leaks,DIY,Construction,Home Improvement,Ask This Old House,Building,4-6 minutes,DIY Ideas,Renovation,Renovation Ideas,How To Fix,How To Install,How To Build,Fix a Leaky Hose Spigot,How to Fix a Leaky Hose Spigot,leaky hose spigot,fix leaky hose to spigot connection,leaky spigot hose connection,richard leaky hose spigot,to fix leaky hose spigot,hose spigots,Richaed Ask this old house"
3t678W5zfMA,fix crack iphone screen,today show easily fix crack smartphone tablet screen free technique work smartphones tablets iphones dont spend hundreds dollars get screen professionally fix repair home free method incredibly easy simply follow step step instructions video youll able replace crack screen matter badly damage less minute show everyone easy replace crack smartphonetablet screen share tweet eggbook httpbitlyfreecrackedscreenfix click eggscribe video suggestion post comment section contact facebook page tweet connect facebook twitter instagram channel tshirts eggy merchandise know someone crack smartphone tablet screen link video howtobasic howtobasic basic,Howto & Style,How to Fix/Repair,"how to fix a cracked iphone screen,how to fix a cracked phone screen,how to fix a cracked ipad screen,how to replace a cracked screen,how to replace a cracked iphone screen,how to replace a cracked phone screen,how to fix a cracked smartphone screen,how to fix a broken iphone,how to fix a broken smartphone,how to fix a cracked samsung galaxy screen,how to fix a cracked samsung screen,how to fix a cracked iphone 5c screen,cracked tablet fix,fix cracked samsung tablet"
45CDGcTIhD4,fantastic food hack diy square fruit,delicious diy ideas fruit get ready summer video show use fruit create amaze dish decorate foods also create sort craft use piece wood create square oranges simply squeeze piece wood instead serve fruit cut cub show creative cut ways cut pineapple strip guests enjoy exotic look pineapples also show superfast way remove corn peel hand fast cut pomegranate always cut edge first able see inside cut x mark white part visible make peel lot less messy peel nectarine simply cut little x bottom knife place pan fill boil water transfer icecold water voila difference temperature peel skin right timestamps easy way break coconut brilliant trick corn easy way peel nectarine adorable fruit décor ideas brilliant fruit veggie cut trick dental floss vs watermelon tasty jell shots lime cool fruit cut ideas video make entertainment purpose make warranties completeness safety reliability action take upon information video strictly risk liable damage losses viewers responsibility use judgment care precautions one plan replicate follow video might feature activity perform actors within control environment please use judgment care precaution plan replicate social media facebook instagram twitter subscribe craft girly httpsgooglfwbjqz subscribe craft kid httpsgooglpeulvt subscribe craft men bright side youtube httpsgooglrqtjzz videos article visit httpwwwbrightsideme music epidemic sound httpswwwepidemicsoundcom,Howto & Style,DIY,"proyectos faciles,trucos de belliza,howto,tutorial,handcraft,tips,5 minute craft,useful things,life hacks,crafts,diy,5-minute crafts,tricks,do it yourself,diy projects,trucos,diy activities,5 minutes craft,lifehacks,fruit,fruit hacks,square orange,cook,cooking,food,food hacks,kitchen hacks,cooking hacks"
4gFckwlVKxM,workout stay healthy get fit,workout stay healthy get fit video bring along workout routine eat show stay healthy also talk body confidence little bite ive become comfortable skin comment anything youve struggle overcome tip stay motivate xoxo shop merch httpsavajulescom vlog channel fabletics leggings fabletics sport bra smoothie cup similar cross necklace httpsgomagiklymltprc pink crop top httpsgomagiklymltprh dainty necklace httpsgomagiklymltpri scrunchies httpsgomagiklymltprx hand weight httpsgomagiklymltprq backpack httpsgomagiklymltpru sneakers httpsgomagiklymltprr socials instagram httpswwwinstagramcomavajuleshlen twitter snapchat avajulesx spotify avajules subscribe help translate video language aloha ava jules welcome youtube channel post beauty lifestyle videos vlogs im currently online college live oahu hawaii subscribe want become part ohana see soon,Howto & Style,Health,"ava jules,how I workout,stay healthy,workout,healthy,lets get fit,what I eat,body confidence,workout routine,ava jules workout,fit,how I workout & stay healthy! GET FIT WITH M,get fit with me"
4gUW-IhSMBc,repair squeaky floor carpet old house,old house general contractor tom silva silence carpet squeaky floor see shop list tool subscribe old house httpbitlysubscribethisoldhouse shop list repair squeaky floor carpet squeeeeek floor repair kit info available wwwsqueaknomorecom tool repair squeaky floor carpet drilldriver use drive specialty screw carpet joists hammer use locate floor joists old house tv old house multimedia home enthusiast brand offer trust information expert advice awardwinning television highly regard magazine informationdriven website old house ask old house produce old house venture llc present pbs weta washington dc follow old house ask old house facebook httpbitlythisoldhousefb twitter httpbitlythisoldhousetwitter httpbitlyasktohtwitter pinterest httpbitlythisoldhousepinterest instagram httpbitlythisoldhouseig httpbitlyasktohig tumblr httpbitlythisoldhousetumblr old house ask old house visit us httpbitlythisoldhousewebsite repair squeaky floor carpet old house httpswwwyoutubecomuserthisoldhouse,Howto & Style,How to Fix/Repair,"This Old House,Ask This Old House,DIY,Home Improvement,DIY Ideas,Renovation,Renovation Ideas,How To Fix,How To Install,How To Build,Episode,TV Show,Tom Silva,noise,squeaky floor,noisy floor,carpeting,repair,Do It Yourself home,Fire,house,video,tom silva this old house,tom silva house,tom silva construction,tom silva tools,tommy silva,home renovation ideas on a budget"
4gccla3VETM,morning habit help stay fit healthy,stay fit healthy dear friends promise brilliant hack make mornings whole lot easier ill teach wake minutes simply keep positive habit start day pleasant memories stretch body inhale exhale deeply massage back head temples eyebrows earlobes rub palm improve blood circulation drink glass water create atmosphere use bright color kitchen curtain colorful dish spray citrus essential oil turn favorite music radio station voila many great tip wait video timestamps positive habit start day happen cup coffee benefit hot cold shower morning workout give energy whole day ears reveal lot health better dont skip breakfast thats brush teeth correctly reason bad breath social media facebook instagram twitter subscribe magic subscribe craft girly httpsgooglfwbjqz subscribe craft kid httpsgooglpeulvt bright side youtube httpsgooglrqtjzz videos article visit httpwwwbrightsideme video make entertainment purpose make warranties completeness safety reliability action take upon information video strictly risk liable damage losses viewers responsibility use judgment care precautions one plan replicate follow video might feature activity perform actors within control environment please use judgment care precaution plan replicate,Howto & Style,Health,"5-Minute Crafts,DIY,Do it yourself,crafts,trucos,trucos de belliza,proyectos faciles,useful things,lifehacks,tricks,tips,DIY projects,DIY activities,Handcraft,Tutorial,fit and healthy,wake up in 5 minutes,morning routine,cold and hot showers,watch sunrises,watch sunsets,positive effect,yoga,fight depression,not to skip breakfast,healthy diet,eating,healthy meals,vitamins,coffee,bad breath,warning signs,saliva,tongue color,ear wax,see a doctor"
4jhicfrw1Y0,stay healthy high school day life conagh kathleen,day life start sorry focus much hello lovelies want commit maintain healthy lifestyle high school university college etc video im excite share personal tip trick make sure take healthy fill delicious lunch eat day social media instagram conaghkat music nocopyrightsounds ncs music without limitations axol ily ncs release axol httpssoundcloudcomaxolmusic httpswwwfacebookcomaxolmusicfrefts httpstwittercomaxolmusic ncs music without limitations cartoon feat daniel levi ncs release follow cartoon soundcloud httpssoundcloudcomcartoonbaboon facebook httpswwwfacebookcomcartoondband follow daniel levi vocalist facebook httpfacebookcomdaniellevimusic website httpdaniellevieu thank much subscribe hi name conagh kathleen year old australian channel passions life always want share love health fitness things makeup beauty world channel show many many makeup tutorials fitness information vlogs videos think stay tune new video every week conagh kathleen xoxo,Howto & Style,Health,"day in the life,how to stay healthy in high school,how to be healthy in school,how to be healthy,what i eat in a day high school,australian high school,how to lose weight in high school,how to eat healthy in high school,day in the life high school vlog,healthy high school lunches,how to stay healthy and fit for teenagers,how to stay healthy in college,healthy college recipes,healthy recipes,high school grwm,healthy lunch ideas,healthy breakfast ideas"
5MHPzGrkHeQ,fix repair chip crack break concrete,video show step step process patch break chip concrete slabs product work great repair break edge corner concrete step curb slabs wall support channel httpswwwgofundmecomsupportourconstructionvideos odellcompleteconcretetools funny trowel horse hair broom makita jack hammer lbs makita jack hammer lbs marshalltown premier line round end finish trowel curve durasofthandle marshalltown x margin trowel soft grip handle marshalltown premier line fully round finish trowel marshalltown premier line resin float bon round end spring steel fresno concrete trowel rock n roll bracket marshalltown stainless steel edger hilti w rotary hammer drill deluxe kit ridgid hyper cordless lithiumion drill driver impact driver combo kit odellcompleteconcretegmailcom odellcompeteconcretecom,Howto & Style,How to Fix/Repair,"How to repair cracked concrete,how to replace a broken concrete chip,how to fix cracked concrete,how to replace cracked concrete,how to fix chipped concrete,how to replace chipped concrete,what concrete cement should i use for cracked concrete,what cement should i use,what concrete should i use,How to Patch Concrete with Sakrete Top n' Bond Concrete Patcher,How to Make Thin Repairs to Damaged Concrete with,How to Repair Concrete Edges and Corners,cement concrete repair"
5YYb9vyj6zQ,band syndrome knee pain fix,fix tightness build athletically functional body httpathleanxcomxbuildthebodyofanathlete many lifters runners bikers get pain outside knee thigh think band syndrome tell unfortunately band catch middle pretty significant problems one likely four muscle video show four muscle hip actually contribute pain tension felt iliotibial band need fix hint want foam roll band unless want pain discomfort band thick fibrous tendon run along lateral aspect thigh connect hip tibia outside knee tendon ability withstand change tension pound resistive capacity think go able foam roll tightness may present structure sadly mistake say definitely influence tension present band address muscle insert band gluteus maximus lateral hamstring quads tensor fascia lata muscle fee iliotibial band muscle tight pull band cause tight also balance rest tension contribute feed cause pull femur make hard properly execute squat ride bike without feel pain outside thigh knee instead foam roll band want compress floss offend muscle feed tension show two mobility drill decrease tension hypertonic muscle tfl lateral quads want use resilient structure like lacrosse ball fat gripz use since much lower profile foam roller allow keep leg contact grind move hip flexion squat feel discomfort movements place muscle contact grip likely need work muscle one biggest place people waste time gym days see every mobility drill book want add routines realize wrong mobility drill perform actually put balance bring mobility work effective mobilize structure need first place go train workout program think look cool someone else tell prescription effective workout plan need do need do ignore rest broscience great way get result get faster get athleanx train system available httpathleanxcom hip mobility videos ways help stretch tight band sure subscribe channel youtube,Howto & Style,How to Fix/Repair,"IT band,Iliotibial band,IT band syndrome,iliotibial band syndrome,tight IT Band,IT band tightness,IT Band stretch,foam rolling,IT Band foam roll,Foam Roll IT Bands,mobility drill,hip mobility drill,knee pain when squatting,knee pain working out,knee pain when running,knee pain with biking,it band mobility drill,IT Band mobilization,mobility drill for IT band,mobility drill for tight IT band,athlean-x,athlean x,jeff cavaliere"
62kTNwtPmE8,fix crack plastic gas tank video,plastic fuel tank crack leak puncture two options replace repair try fix first time regular use tank may get damage entire fuel supply compromise try patch options solder trimmer line crack peel different compositions plastics bond together properly instead use sealall sealants epoxy solder iron ill show watch doesnt seal plastic gas tank time replace repair apply weedeaters hedgers chainsaws leaf blowers etc click solder iron click website httpwwwstevessmallenginesalooncom click part tool store httpswwwamazoncomshopstevessmallenginesaloon save money video please consider support efforts donation forget subscribe forget click turn video notifications money save videos feature top brand like stihl husky husqvarna echo honda briggs stratton john deere craftsman mtd ayp etc learn properly fix repair outdoor power equipment start bog rev chain blade dull cut good need sharpen simply run poorly simple basic diy tutorials help break lawn garden equipment best teach easily diagnose problems fastest quickest efficient way whether handheld two stroke two cycle engine like chainsaws weed eaters string trimmers grass trimmers line trimmers hedge trimmers strimmers brush cutters leaf blowers four stroke four cycle units like lawn mowers pressure washers generators ride mowers need part instal replace guy small engine mechanic many years videos load tip trick learn want pass want steve small engine saloon save time frustration important money google issue problem symptom may see one videos pop idea suggestion video please fill form httpswwwstevessmallenginesalooncomvideosuggestionshtml disclosure youtube video provide informational purpose steve qualify small engine mechanic work open fully ventilate shop purpose make video small engines operate outside fully ventilate areas important wear appropriate safety gear choose try one suggestions make video risk please ensure take proper safety measure attempt project,Howto & Style,How to Fix/Repair,"how,to,do,diy,lawn,replace,cut,tutorial,help,broken,stroke,four,two,garden,small,engine,repair,fix,learn,hedge,brush,start,simple,basic,easy,generator,mower,riding,blower,chain,saw,weed,eater,trimmer,grass,install,blade,bar,properly,tips,tricks,efficiently,google,stihl,husqvarna,husky,echo,honda,shindiawa,pressure,washer,hand,held,wont,dull,not,direction,diagnose,save,money,tech,clogged,bogging,idle,up,weedeater,outdoor,power,equipment,leaf blower,lawnmower,crack,plastic,gas,fuel,tank"
6Zi9MTmfjlM,diy home decor easy ideas,video recopilation new channel videos fashion diy home life hack hair trend much subscribe channel content help improve content,Howto & Style,DIY,"Home,DIY,Fashion,Hair,home,diy,fashion,hair,homebody lil durk,do it yourself,diy room decor,tumblr ban,tumblr girls g eazy,tumblr is dead,tumblr,diy christmas gifts,diy halloween costumes,diy room,how to,imdrewscott diy,room decor,home free,diy projects,diy crafts,diy ideas,diy projects for home,diy for home,home resonance,diy slime,homecoming grwm,aesthetic,2019,2020"
834sJmsdtOU,diy weird makeup ideas superhero makeup,subscribe weird ways sneak stress relievers class anti stress college supply superhero profession interest dangerous always look one hundred percent every superhero need coolest makeup supply tool foam paper highlighter palette star shape glitter markers gold makeup pigment rub alcohol empty eyeshadow palette glitter eyeshadow print superhero logos hair extensions thread needle glue glitter hot glue gun ribbons hair chalk concealer light clay model tool acrylic paint toy gun mascara spray paint black face mask scissor contact lens container nail polish sequins styrofoam ball utility knife hand lotion foam board hand sanitizer musiс tobu wholm motion source httpyoutubecomtobuofficial httpsfacebookcomwholmmusic future gladiator kevin macleod license creative commons attribution license source artist httpincompetechcom watch troom troom popular videos weird ways sneak food class back school prank funny prank prank war diy edible makeup funny prank weird ways sneak makeup class httpsyoutubebvhbismzhwe gummy food vs real food challenge popular playlists funny prank back school life hack beauty makeup hack home décor follow troom troom subscribe instagram httpswwwinstagramcomtroomtroom facebook httpswwwfacebookcomtroomhands pinterest httpspinterestcomtroomtroom troom troom español subscribe troom troom française subscribe troom troom russian subscribe troom troom deutsch subscribe troom troom chinese subscribe troom troom português subscribe troom troom japanese subscribe troom troom easy diy video tutorials diy accessories scrapbooking card home décor make tutorials life hack much make easy business enquire please contact troomtroomdiygmailcom question day like superhero makeup ideas comment forget turn notifications like subscribe,Howto & Style,DIY,"weird makeup ideas,DIY weird makeup ideas,superhero,superheroes,superhero makeup ideas,superhero makeup,makeup,troom troom,how to make,diy weird makeup ideas,diy weird makeup,how to,diy makeup,makeup tutorial,makeup ideas,weird makeup,makeup hacks,makeup tips,diy,for beginners,funny,tutorial,halloween makeup,halloween makeup tutorial,dc,halloween makeup ideas,marvel vs dc,wonder woman"
8KA3QNeh6ko,eat day stay fit healthy realistic,eat day stay fit healthy hey everyone full day eat meals love day legs gym also chat healthy eat good relationship food healthy lifestyle always really important able fuel body easy nutritious meals really hope enjoy thank always support xx teami blend discount code wwwteamiblendscom thank teami sponsor video f l l w e instagram httpswwwinstagramcomvanessatiiu twitter httpstwittercomvanessatiiu dote shop clothe vanessatiiu pinterest httpswwwpinterestcomvanessatiiu spotify u c chill noncopyrighted music business inquiries please feel free email contactvanessatiiugmailcom,Howto & Style,Health,"what i eat,what i eat in a day,what i eat in a day healthy,what i eat in a day to gain muscle,what i eat in a day to lose fat,what i eat in a day 2019,teen what i eat in a day,what i eat to gain muscle,what i eat to stay healthy,what i eat to lose fat,what i eat in a day realistic,what i eat in a day keto,healthy what i eat in a day,realistic what i eat in a day,hannah meloche,misscharlottebeauty1,fit what i eat in a day,hailey sani,sadie aldis"
8UPCq4OqwKk,simple fun diy ideas,crazy fun diy ideas try look easy fun craft ideas certainly right place put together fantastic video today bunch amaze diy ideas sure fun try call friends guarantee wan na try ideas begin show make mindblowing piece art feet yes feet need see eye learn cool rainbow design fruit everyone wan na know also show make mini gym bag dolls like draw feel like great worry super easy draw ideas love need pencil markers hand check video let us know ideas favorites timestamps feet paint artwork rainbow fruit mini doll gym bag easy snake draw hack cute mouse draw advise adult supervision care time video make entertainment purpose make warranties completeness safety reliability action take upon information video strictly risk liable damage losses viewers responsibility use judgment care precautions one plan replicate follow video might feature activity perform actors within control environment please use judgment care precaution plan replicate craft facebook instagram twitter subscribe craft girly httpsgooglfwbjqz bright side youtube httpsgooglrqtjzz videos article visit httpwwwbrightsideme music epidemic sound httpswwwepidemicsoundcom,Howto & Style,DIY,"handcraft tutorial,howto,tutorial,tips,useful things,life hacks,easy life hacks,crafts,diy,5-minute crafts,tricks,5-minute crafts play,do it yourself,diy projects,diy activities,simple life hacks,lifehacks"
