video_id,title,description,category,sub_category,tags
h5T78t7FEsg,truth dare girlfriend rohit soniya vlogs,instagram soniya rohit khatri httpswwwinstagramcomrohitkhatrifitness,People & Blogs,Vlogs,"truth and dare,truth & dare,boyfriend,girlfriend,truth and dare video,truth and dare question,vlogging,blogging,vlog,hot couple,rohit khatri,rohit khatri fitness,rohit soniya vlogs"
EiXptnhtdcU,eid mubarak vlog arishfa khan,thank watch like video like share comment forget subscribe youtube channel also forget turn bell social media instagram tiktok facebook iarishfakhan subscribe life arishfa pay collaboration promotion mail eshaan khan nomaan khan arshi naz,People & Blogs,Vlogs,"arishfa khan,easy hairstyles,hair tutorials,arishfa khan youtube,arishfa khan tiktok,arishfa youtube,arishfa makeup,arishfa vlog,arishta tutorial,makeup tutorial,#arishfaeidvlog"
joHbCQ4nUIo,dance road test report ss vlogs,query feedback please mail us sambhavnasethentertainmentgmailcom follow youtube httpbitlysambhavnasethentertainment facebook httpswwwfacebookcomimsambhavnaseth twitter httpstwittercomsambhavnaseth instagram httpswwwinstagramcomsambhavnasethofficial test report dance,People & Blogs,Vlogs,"sambhavnaseth,ss vlogs,hindi vlogger,celebrity vlogger,indian vlogger,bigg boss,bigg boss contestant,husband wife vlogs,funny vlogs,food vlogger,lifestyle vlogger,test reports negative,dancing on the road"
vRIxSj7zXB4,vlog lakshmi sil pandem kodi pulusu raagi sangati baby bath baby products,hello im ashasudarsan rayalaseema live bangalore vlog share rayalaseema special recipes baby bath products hope like vlog ask question hyderabadi chicken dum biriyani recipe httpsyoutubesagutrlmkly attayya kaaram attayya pappula podi attayya mirapakaya instagram page gmail account ashasudarsangmailcom tiktok ashasudarsan thank watch takecare bye byee,People & Blogs,Vlogs,"#AshaSudarsanTeluguVlogs,#TeluguVlogs,#AshaSudarsanTeluguChannel,#TeluguChannel,#Channel,#Vlogs,#TrendingTeluguVlogs,#TrendingVlogs,#AshaSudarsan,#Telugu,#AshaSudarsanVlogs,#Tirupathi,#TirupathiVlogs,#Rayalaseema,#FamilyVlogs,#Family,#SisterInLawsHouse,#SisterInLaw,#Lakshmi,#RayalaseemaSpecialRecipes,#RaagiSangati,#PandemKodiPulusu,#CountryChicjenCurry,#Chicken,#Recipe,#Curry,#Fry,#Sangati,#Raagi,#Baby,#BabyProducts,#BabyBath,#HowToDoBabyBath,#Bath,#DoveBaby,#HimalayaBaby"
JIfRvMGUEsE,fly beast relation indian family vlogs england sangwan family,hello friends ask question us answer todayapologies fan get offend welcome channel sangwan family find daily life vlogs relation family video weekend vlog answer one ask question live session know fly beast know gaurav taneja ritu us answer questioni hope like video channel cover various things like even routine family even routine various daily routine type videos also always try share various family activities guy hope guy like videos youtuber vlogger call us indian youtuber england indian vlogger england try show various things house england videos like videos please subscribe channel thank love support flyingbeast indianfamilyvlogs thesangwanfamily follow us instagram instagram httpswwwinstagramcomsangwansstudio main channel sangwans studio musicsongs credit toyt important notice copyright infringement intend sound picture use video take credit music songs video artist label copyright issue videos please send email remove instantly copyright disclaimer section copyright act allowance make fair use purpose criticism comment news report teach scholarship research fair use permit copyright statute might otherwise infringe nonprofit educational personal use tip balance favour fair use hope fly beast guy dont objection us answer question please let know look thank,People & Blogs,Vlogs,"VLOGS,VLOGGER,YOUTUBER,indian vlogger,indian youtuber,sangwans studio,sangwan,evening routine,indian housewife,flying beast,flying beast fans,indian family vlogs,family vlogs,lifestyle vlogs,lifestyle vlogger,ss vlogs,indian youtuber in England"
c4W9PFiNu-U,rich life japan,go check httpswwwinstagramcomsamuraieagle instagram movlogs httpswwwinstagramcommovlogs sisters instagram snapchat mohamedoo snapchat mohamedoo sisters snapchat twitter httpstwittercommovlogs sisters youtube channel lanas facebook facebook page email movlogsbusinessgmailcom sisters email lanarosebusinessgmailcom music use music credit please email make sure give credit thank email movlogsbusinessgmailcom happy mbb httpssoundcloudcommbbofficial creative commons attributionsharealike unported cc bysa free download stream httpsbitlyhappymbb music promote audio library sneaky snitch kevin macleod incompetechcom license creative commons attribution httpcreativecommonsorglicensesb music promote audio library track tobu turn ncs release music provide nocopyrightsounds watch free download stream httpncsiotobuturnitup music ukulele bensound source httpswwwbensoundcom support rfm ncm royalty free music victory hip hop beat copyright instrumental buy high quality beat httpsmgjproductioncom track name knockout kings music jay man httpsourmusicboxcom official ourmusicbox youtube channel httpwwwyoutubecomcourmusicbox license commercial use creative commons attribution international cc httpscreativecommonsorglicenses music promote ncm carefree melody twin musicom httpwwwtwinmusicomorg creative commons attribution cc free download stream httpsbitlycarefreemelody track glude dreamers ncs release music provide nocopyrightsounds watch free download stream httpncsiodreamersyocommovlogs sisters instagram snapchat mohamedoo sisters snapchat twitter httpstwittercommovlogs sisters youtube channel lanas facebook facebook page email movlogsbusinessgmailcom sisters email lanarosebusinessgmailcom music use music credit please email make sure give credit thank email movlogsbusinessgmailcom happy mbb httpssoundcloudcommbbofficial creative commons attributionsharealike unported cc bysa free download stream httpsbitlyhappymbb music promote audio library sneaky snitch kevin macleod incompetechcom license creative commons attribution httpcreativecommonsorglicensesb music promote audio library music ukulele bensound source httpswwwbensoundcom support rfm ncm royalty free music victory hip hop beat copyright instrumental buy high quality beat httpsmgjproductioncom track name knockout kings music jay man httpsourmusicboxcom official ourmusicbox youtube channel httpwwwyoutubecomcourmusicbox license commercial use creative commons attribution international cc httpscreativecommonsorglicenses music promote ncm carefree melody twin musicom httpwwwtwinmusicomorg creative commons attribution cc free download stream httpsbitlycarefreemelody track glude dreamers ncs release music provide nocopyrightsounds watch free download stream httpncsiodreamersyo,People & Blogs,Vlogs,"MO VLOGS,dubai,japan,nissan gtr"
AqCO1BfIrfg,dubai bikini beach rohit soniya vlogs,instagram soniya rohit khatri httpswwwinstagramcomrohitkhatrifitness song dizaro trust music provide vlog copyright music video link,People & Blogs,Vlogs,"dubai bikini beach,best beach in dubai,dubai visit,cheap dubai,best place in dubai,best hotel in dubai,bikini beach,best beach in goa,goa beach,travelling,bloggers,hot couple,rohit khatri fitness,rohit khatri,rohit soniya vlogs"
2-JBiu0BzxA,ultimate sambhar chawal ss recipe vlog,query feedback please mail us sambhavnasethentertainmentgmailcom follow youtube httpbitlysambhavnasethentertainment facebook httpswwwfacebookcomimsambhavnaseth twitter httpstwittercomsambhavnaseth instagram httpswwwinstagramcomsambhavnasethofficial sambhar chawal cook recipe vlog,People & Blogs,Vlogs,"sambhavnaseth,ss vlogs,hindi vlogger,celebrity vlogger,indian vlogger,bigg boss,bigg boss contestant,husband wife vlogs,funny vlogs,food vlogger,lifestyle vlogger,cooking vlog,sambhar chawal recipe"
ODdYtvyEnPU,thailand vlog bangkok phuket,hi guy hope u enjoy video love share travel memories fell free comment ask question regard vlog song asia cruise selfish thbd remix vlog copyright music music provide vlog copyright music video link httpsyoutubengdsaexdala dont forget subscribe channel vlogs update business inquire please email contactpandorakaakicom,People & Blogs,Vlogs,"thailand,bangkok,phuket,thaifood,thailanderfood,thailandfood,explorethailand,explorebangkok,explurephuket,filipina,filipinatraveller,travelwithfriends,bangkokmarket,pandorakaaki,pandora kaaki,travel,asia"
KMtfZr0AYWo,eid,vlog long time finally eid vlog hope like love everyone thank watch like video like share comment forget subscribe youtube channel also forget turn bell social media instagram tiktok facebook iarishfakhan website httpsarishfakhanin subscribe life arishfa pay collaboration promotion mail teamarishfakhangmailcom eshaan khan nomaan khan arisha khan arshi naz video editor,People & Blogs,Vlogs,
5iAA1Bwaguk,maldives vlog divya varun,finally wait vlog guy wait vlog near dear us try level best capture travel experience best hope like video video edit vedant pandya httpswwwinstagramcomvedantpandyaofficial follow divya agarwal httpswwwinstagramcomdivyaagarwalofficial httpswwwfacebookcomdivyaagarwalindianprincess follow varun sood like share comment subscribe,People & Blogs,Vlogs,"Maldives,Divya Varun,Divya garwal,varun sood,divrun,maldives vlog,travel vlog,vlogger,travel life,maldives cinematic video"
UPvxcZSh_ss,diamond ring vlog,vlog long time finally vlog diamond ring hope like love everyone thank watch like video like share comment forget subscribe youtube channel also forget turn bell social media instagram tiktok facebook iarishfakhan subscribe life arishfa pay collaboration promotion mail eshaan khan nomaan khan arisha khan arshi naz,People & Blogs,Vlogs,"#arishfakhan,#adnaanshaikh,#diamondring,#diamondringvlog,#arishfakhanvlog,#arishfavlogs,#bestvlogs,#makingofdiamondring"
6uJHCyyjccY,saas ke saamne besharmi ep amritsar ss vlogs,query feedback please mail us sambhavnasethentertainmentgmailcom follow youtube httpbitlysambhavnasethentertainment facebook httpswwwfacebookcomimsambhavnaseth twitter httpstwittercomsambhavnaseth instagram httpswwwinstagramcomsambhavnasethofficial sambhavnaseth amritsar vlog ssvlogs travel food,People & Blogs,Vlogs,"sambhavnaseth,ss vlogs,hindi vlogger,celebrity vlogger,indian vlogger,bigg boss,bigg boss contestant,husband wife vlogs,funny vlogs,food vlogger,lifestyle vlogger,travel vlog,amritsar vlogs,amritsar food vlogs"
5bDge4SEtpk,stick together jadoo vlogs,yeah stick real okay make watch vlog know simrans goa vlog jiske ke liye yaha pe aae hai follow httpswwwinstagramcomakashdodeja montages simran dhanwani httpsinstagramcomsimrandhanwani music say good night joakim karud vlog copyright music httpsyoutubeszkvshypkgm,People & Blogs,Vlogs,"akash dodeja,akash,jadoo,jadoo vlogs,vlogs,jaadu,jadu,jado,ashish,ashish chanchlani vines,ashish new video,simran,simran dhanwani,goa vlogs,goa,goa airport,airport vlogs,stuck at airport jadoo,stuck at airport,flight delayed,funny vlogs,funny video,comedy vlogs,comedy videos"
L2GrBzpD7KM,rishikesh kedarnath kedarnath yatra travel vlog,kedarnath yatra vlog hindi rk book cheap hotels book cheap flight shop rk store instagram legendaryrk httpswwwinstagramcomlegendaryrk business email rkofficialemailgmailcom facebook page httpswwwfacebookcomlegendaryrk facebook profile httpswwwfacebookcomrktherapper promote videochannel rk httpswwwfiverrcomshareyldxz gear use gopro camera gopro shorty camera mini tripod laptop desktop mic phone kedarnath kedarnathyatra mahadev today travel video show way kedarnath temple rishikesh go kedarnath yatra rk vlog rk vlogs hey name rk hindi vlogger mostly travel vlogging lifestyle vlogging moto vlogging join channel see lot travel videos see life india subscribe rk httpswwwyoutubecomrkvlog follow rk social media handle instagram httpswwwinstagramcomlegendaryrk facebook page httpswwwfacebookcomlegendaryrk facebook profile httpswwwfacebookcomrktherapper twitter httpstwittercomrklegendary business email rkofficialemailgmailcom thank watch rk kedarnath temple kedarnath yatra kedara please watch pass time lock,People & Blogs,Vlogs,"kedarnath,kedarnath yatra,kedarnath yatra 2019,kedarnath temple,shiv,shiva,mahadev,rishikesh,vlog,travel vlog,temple,shivji,rk,uttarakhand,vlogger,dehradun,shankar,shiv shankar,shiv shambhu,baba,babaji,namo namo,kedara,kedarnath door opening,kedarnath trek kms,trek,trekking,kedarnath travel guide,kedarnath tour guide,kedarnath vlog,temple guide,kedarnath flood,kedarnath tragedy,chardham,yatra,2019,lord shiva,shiv temple,bhole baba"
6TBYa0i0KlE,propose time unusual love story ss vlogs,query feedback please mail us sambhavnasethentertainmentgmailcom follow youtube httpbitlysambhavnasethentertainment facebook httpswwwfacebookcomimsambhavnaseth twitter httpstwittercomsambhavnaseth instagram httpswwwinstagramcomsambhavnasethofficial sambhavnaseth lovestory ssvlogs shwetatiwari sarojkhan,People & Blogs,Vlogs,"sambhavna seth,ss vlogs,hindi vlogs,indian vlogger,celebrity vlogger,love journey,love story,cutest love story,husband wife vlogs,funny vlogs,internet,proposed to my girlfriend,most unusual love story. shweta tiwari."
B9TO61shHH0,emotional live birth vlog meet daughter,today big day finally get meet adorable little baby girl jess pregnant weeks days pregnant shes ever decide induce pregnancy ensure safety baby well mom baby girl deliver monday may time never forget beyond thrill happy healthy little baby girl add family cant wait introduce micah first bear new little sister bond go absolutely incredible youve read far watch video sure check favorites become friend subscribe recommend favs emotional live birth vlog baby girl baby girl live birth vlog wife surprise husband pregnancy announcement wife surprise husband unexpected pregnancy announcement adorable pregnancy time lapse favorite items httpswwwamazoncomshopaustinjessvlogs follow us ladies lattes httpswwwyoutubecomladiesandlattes men try videos httpswwwyoutubecommentryvideos instagram austin httpswwwinstagramcomaustinspomer jess httpswwwinstagramcomjessicaspomer micah kate httpswwwinstagramcommicahspomer babyspomer httpswwwinstagramcompaigespomer twitter austin httpstwittercomaustinspomer jess httpstwittercomjessicaspomer facebook httpswwwfacebookcomaustinandjessvlogs men try httpswwwyoutubecommentryvideos shop equipment sony lens canon lens lens tripod light po box letter card please austin jess n fairfield rd layton ut hashtags subscribe hitthebell birth pregnancy pregnant ftc disclosure post video contain affiliate link mean may receive commission purchase make link,People & Blogs,Vlogs,"pregnant,pregnancy,teen pregnant,teen pregnancy,pregnant teen,pregnancy teen,teen pregnancy vlog,teen pregnant vlog,birth,birth video,labor,labour,baby,newborn,infant,girl,baby girl,girl baby,deliver baby in car,austin and jess,austin and jess vlogs,austin and jess vlogs birth,austin and jess vlogs pregnant,austin and jess vlogs pregnancy announcement,austin and jess vlogs baby,austin and jess vlogs gender reveal,pregnant teen mom"
l9oCIjdjTfs,mi cumpleaños en londres trippar vlogs,instagram httpsinstagramcomcarotrippar tiktok canal de vlogs merchandise oficial internacional httpsteespringcomstorescarotrippar infotripparcom wwwcarotripparcom httpstwittercomstephtsocial euros de descuento en airbnb en tu primera estadia httpswwwairbnbcoukcctripparcurrencygbp para mas httpstwittercomstephtsocial preguntas frecuentes camara que uso canon mark ii httpsgooglvqwfdg nikon httpsgooglypueos editor adobe premiere pro iluminacion httpsgooglbyqqwe tripode httpsgooglkruoes muchas gracias por ver el video por favor asegurense de ponerle like suscribirse mi canal para mas videos todas las semanas beso gigante xoxo caro vlogger argentino bloggero argentino vlog blog vlogs en buenos air youtube argentina,People & Blogs,Vlogs,"steph t,steph t vlogs,caro trippar,steph,caro trippar vlogs,me compro un iphone,caro trippar novio"
w-JTkNS19co,nail extension,nail extensions first time thank watch like video like share comment forget subscribe youtube channel also forget turn bell social media instagram tiktok facebook iarishfakhan subscribe life arishfa 𝐅𝐨𝐫 𝐛𝐮𝐬𝐢𝐧𝐞𝐬𝐬𝐪𝐮𝐞𝐫𝐢𝐞𝐬 𝐌𝐚𝐢𝐥 arshi naz arisha khan eshaan khan nomaan khan,People & Blogs,Vlogs,#arishfakhan #arishfavlog #arishfayoutube #nailextensions #nails #vlog #bestvlog #vlogger
aIYalyLAvWQ,hum kis city shift huy hain new house family vlogs,humairavlogs newhouse familyvlogs instagram samis instagram,People & Blogs,Vlogs,"vlog,housewife,housewife vlogs,vlogger,pakistan,pakistanivlogger,femalevlogger,femalepakistanivlogger,vlogging in pakistan,my first vlog,islamabad,gujranwala,shifting,new city,new home,home sweet home,new place"
sm4Y5IMAm3U,get emotional talk mentor years ss vlogs,query feedback please mail us sambhavnasethentertainmentgmailcom follow youtube httpbitlysambhavnasethentertainment facebook httpswwwfacebookcomimsambhavnaseth twitter httpstwittercomsambhavnaseth instagram httpswwwinstagramcomsambhavnasethofficial emotional moment mentor vlog johny lever,People & Blogs,Vlogs,"sambhavnaseth,ss vlogs,hindi vlogger,celebrity vlogger,indian vlogger,bigg boss,bigg boss contestant,husband wife vlogs,funny vlogs,food vlogger,lifestyle vlogger,johny lever,emotional moment"
Vo2w6nWvErE,haunt flyover delhi find ghost deepti vlog,ashokviharhauntedflyoverbhoot ghost delhihauntedplace facebook insta httpswwwinstagramcomofficialdeeptivlog,People & Blogs,Vlogs,"delhi top haunted places,ashok vihar,delhi cannt,bhuli bhatiyari,flying beast,nikhil mumbaiker,haunted places in india,ashok vihar flyover news,ashok vihar flyover horror,ashok vihar flyover article,haunted places in noida,ashok vihar saraswati flyover,ashok vihar flyover gurgaon,haunted places in delhi in hindi,ashok vihar flyover,haunted,bhoot,scary,pyar,love,sex,couple places,top haunted places"
Gemb2fzTYiE,celebrate eid mouth water dish ss recipe vlogs,query feedback please mail us sambhavnasethentertainmentgmailcom follow youtube httpbitlysambhavnasethentertainment facebook httpswwwfacebookcomimsambhavnaseth twitter httpstwittercomsambhavnaseth instagram httpswwwinstagramcomsambhavnasethofficial eid mubaraq vlog,People & Blogs,Vlogs,"sambhavnaseth,ss vlogs,hindi vlogger,celebrity vlogger,indian vlogger,bigg boss,bigg boss contestant,husband wife vlogs,funny vlogs,food vlogger,lifestyle vlogger,eid mubaraq,eid vlog,celebrated eid"
5tSrOF0saeY,que pasará con los videos de islas vlogs contestando preguntas,heeeermanos contestando algunas preguntas bonitas que mandaron pasará con los videos de talentos cultura general contacto islasvlogsgmailcom,People & Blogs,Vlogs,
LhJl79Ylbs8,eid vlog lockdown wali eid,hey guyz share eid vlog hope apko mera ye vlog pasnd aya hoga masatuber vlog check fb pagehttpsmfacebookcomindexphprdr twittershystyles snap tictok business inquiry copyright content channel make channel owner saimashystyles copy use content pay unpaid without permission email give xoxo,People & Blogs,Vlogs,"sheer khurma,shystyles,eid vlog,shystyles vlog,2020 eid vlog,shystyles eid vlog"
3JNgrRHlIAM,eid vlog eid eid mubarak ibrahim family,instagram account shoaib ibrahim dipika kakar ibrahim saba ibrhaim dipikakakaribrahim sabaibrahim shoaibibrahim shoaika eidmumbarak eid,People & Blogs,Vlogs,
iN7ZL8Wgf8A,eid vlog eid day hanna danish,eidvlog hannadanish follow us instagram httpswwwinstagramcomhannadanish email hannadanishvlogsgmailcom videos httpswwwyoutubecomchannadanishvideos eid vlogs hello friends eid mubarak everyone share moments eid day vlog hope like enjoy video please consider subscribe channel dont forget like share video music credit eid alfitr mubarak ramol music promote ramol nocopyright music produce ramolpro video link short trip roa creative commons attribution unported cc free download stream httpsbitlyroamusicshorttrip music promote audio library,People & Blogs,Vlogs,"eid vlog 2020,eid vlog,eid 2020,lockdown eid,lockdown eid makeup,eid lookbook,hanna danish,hanna danish vlog,hanna danish eid,hanna danish eid vlog,eid day in my life,eid makeup tutorial,eid makeup,eid makeup 2020,mutton biryani,mutton biryani recipe,snickers cheesecake,zoom call with parents,eid mubarak,eid day vlog,eid 2019"
nrVZf8ou-RI,dilli waale rajma chawal ss recipe vlogs,query feedback please mail us sambhavnasethentertainmentgmailcom follow youtube httpbitlysambhavnasethentertainment facebook httpswwwfacebookcomimsambhavnaseth twitter httpstwittercomsambhavnaseth instagram httpswwwinstagramcomsambhavnasethofficial rajma chawal cook vlog recipe,People & Blogs,Vlogs,"sambhavnaseth,ss vlogs,hindi vlogger,celebrity vlogger,indian vlogger,bigg boss,bigg boss contestant,husband wife vlogs,funny vlogs,food vlogger,lifestyle vlogger,rajma chawal,rajma chawal recipe,rajma chawal vlog,how to make rajma chawal"
1URqggPcQhc,girl break security reach us ss vlogs,query feedback please mail us sambhavnasethentertainmentgmailcom follow youtube httpbitlysambhavnasethentertainment facebook httpswwwfacebookcomimsambhavnaseth twitter httpstwittercomsambhavnaseth instagram httpswwwinstagramcomsambhavnasethofficial sambhavnaseth ssvlogs celebrityvlogger,People & Blogs,Vlogs,"sambhavnaseth,ss vlogs,indian vlogger,hindi vlogs,celebrity vlogger,funny vlogs,husband wife vlogs,bigg boss,bhojpuri award night"
Gc4SGdV2wRY,type problems rimorav vlogs,type problems rimorav vlogs,People & Blogs,Vlogs,"rimorav vlogs,rimorav,types of people,types of friends,rishi dev,mohena kumari,gaurav wadhwa,types of problems"
h1mYr3nkZew,catch fake ids abuser ludo part ss vlogs,query feedback please mail us sambhavnasethentertainmentgmailcom follow youtube httpbitlysambhavnasethentertainment facebook httpswwwfacebookcomimsambhavnaseth twitter httpstwittercomsambhavnaseth instagram httpswwwinstagramcomsambhavnasethofficial catch ludo vlog night,People & Blogs,Vlogs,"sambhavnaseth,ss vlogs,hindi vlogger,celebrity vlogger,indian vlogger,bigg boss,bigg boss contestant,husband wife vlogs,funny vlogs,food vlogger,lifestyle vlogger,ludo vlog,dangerous game,caught the man"
Z__nTfVr4mM,rid ferrari mo vlogs dubai,vlog mos vdo fun day dubai go mos house really earth humble guy thereafter go gold souq abra ride relive old memories dubai hope enjoy also dont forget leave like vlogging gear regular camera lens vlogging buy cinematic shots still money small camera action camera fly camera mic cinematic shots tripod camera instagram twitter ritus instagram httpswwwinstagramcomrituratheehlen music fitness gymming follow channel also live new delhi love make vlogs short movies edit also love fitness subscribe channel graduate iit kharagpur currently work captain domestic carrier,People & Blogs,Vlogs,"vlogs,vlog,indian,vlogger,flying,beast,flyingbeast,tech,review,gaurav,ritu,lana rose,mo vlogs,dubai,collab,dubai vlog,gaurav taneja,flying beast,fit muscle tv,ritu rathee,gaurav ritu,gold souk,dubai metro,abra ride,deira dubai,bur dubai,ferrari,supercar,mo vlog,ferrari surprise,new car"
TiuM5h4fO2U,challenge accept featom vlog deepti vlog,hauntednadikhooninadiscaryhauntedplace facebook insta httpswwwinstagramcomofficialdeeptivlog thank lot watch videolike share video support us need love,People & Blogs,Vlogs,"khonni nadi,haunted place,horror place,haunted house,haunted sound,haunted movie part 2,deepti vlog,nikhil mumbaiker,flying beast,bhuvan bam,ankur kashyap,haunted story,haunted place in delhi cantt in hindi,haunted places in noida,haunted places in india,haunted house in delhi lajpat nagar,haunted places in kolkata,haunted house in janakpuri,most haunted place,haunted places in india in hindi"
t3M0RxeKVNk,aladdin naigaon set vlog avneet kaur yasmine aladdin naam toh suna hoga,hey everyone hope great part aladdin set vlog new set new beginnings hope love watch video please let know comment section guy want next love guy,People & Blogs,Vlogs,#Aladdin #AvneetKaur #Yasmine #Vlog #Avneetians
Fg7q25DbmiQ,vlogs,follow business inquiries sponsor collaboration httpsthemotostorein ultimate destination twowheeler part accessories products love use vlogging camera detail video mic btrlaksh borntoride youtube music track use ikson paradise vlog copyright music vlog copyright music,People & Blogs,Vlogs,"born to ride,btr laksh,youtube,leaving youtube,no more vlogs,blog,vlog,blogger,lakshay anand,last vlog,last video,quiting youtube,bahaut hogaya abh"
Nfce8iRSBxQ,turn shakuni mama ludo challenge part ss vlogs,query feedback please mail us sambhavnasethentertainmentgmailcom follow youtube httpbitlysambhavnasethentertainment facebook httpswwwfacebookcomimsambhavnaseth twitter httpstwittercomsambhavnaseth instagram httpswwwinstagramcomsambhavnasethofficial ludo game challenge husband wife,People & Blogs,Vlogs,"sambhavnaseth,ss vlogs,hindi vlogger,celebrity vlogger,indian vlogger,bigg boss,bigg boss contestant,husband wife vlogs,funny vlogs,food vlogger,lifestyle vlogger,ludo game,ludo challenge"
YgDFSUU9SHs,eid vlog lockdown ki pheli eid shy k sath,masatuber eid vlog hey guyz share first eid vlog,People & Blogs,Vlogs,"masatuber,shystyles,masavlog,eid vlog,shystyles vlog,shysttles eid vlog,masatuber vlog"
NxF4nHPU7zA,rescue dangerous bird find family ss vlogs,query feedback please mail us sambhavnasethentertainmentgmailcom follow youtube httpbitlysambhavnasethentertainment facebook httpswwwfacebookcomimsambhavnaseth twitter httpstwittercomsambhavnaseth instagram httpswwwinstagramcomsambhavnasethofficial dangerous bird rescue vlog animal lover,People & Blogs,Vlogs,"sambhavnaseth,ss vlogs,hindi vlogger,celebrity vlogger,indian vlogger,bigg boss,bigg boss contestant,husband wife vlogs,funny vlogs,food vlogger,lifestyle vlogger,bird rescue vlog,animal lover,dangerous bird rescue"
