video_id,title,description,category,sub_category,tags
vobtYMqli3M,world health day heroesinwhitecoat healthforoneandall,world health day celebrate every year april day global health awareness sponsorship ally healthcare organizations themebased approach acknowledge devote focus various aspects healthcare world turn create awareness among healthcare professionals common population theme dedicate support nurse midwives also focus give people access healthcare without prospect financial hardship,People & Blogs,Fitness,"#worldhealthday,#worldhealthday2020,#salutetodoctors,#docplexus,#doctorscommunity,#unitedwestand,#healthcare"
lnJn40CYPuE,dance fitness susan,dance fitness class tons energy class take step dance around miles right music use choreography enjoy,People & Blogs,Fitness,
VpWy63tgJcU,dance fitness susan,dance fitness susan right songs use film video instructional purpose,People & Blogs,Fitness,
SRdEEC4i_3w,gut health ben warrens top tip healthy gut,lead clinical nutritionist ben warren invite les mill internationals office present top tip gut health team gut health microbiome two largest grow areas research field health wellness learn condition gut underpin aspects health video ben explain exactly gut health factor influence gut share simple powerful strategies help start look feel best life educational information ways support gut overall health visit wwwbepureconz,People & Blogs,Fitness,
VbQd_zUFoCY,health fitness journey weight loss sugar addiction amenorrhea,today share health fitness journey include struggle lose weight addiction sugar suffer amenorrhea two years plantbased paleo keto carnivore story 𝗖𝗟𝗜𝗖𝗞 𝗧𝗢 𝗥𝗘𝗔𝗗 𝗠𝗢𝗥𝗘 review primal health coach certification program httpshealthcoachkaitcomblogbecomeaprimalhealthcoach 𝙏𝙊𝙋 𝙑𝙄𝘿𝙀𝙊𝙎 start carnivore start keto carnivore faq carnivore budget eat 𝘾𝙊𝘼𝘾𝙃𝙄𝙉𝙂 keto carnivore transition program ketostart keto crash course httpshckaitcomketostart 𝙈𝙊𝙍𝙀 support channel get extra perk httpshckaitcomjoin recipe channel httpshckaitcomkaitscookbook 𝘾𝙊𝙉𝙉𝙀𝘾𝙏 instagram httpshckaitcominstagram twitter httpshckaitcomtwitter facebook httpshckaitcomfacebook pinterest httpshckaitcompinterest website httpshealthcoachkaitcom 𝙆𝘼𝙄𝙏 𝙍𝙀𝘾𝙊𝙈𝙈𝙀𝙉𝘿𝙎 beef liver capsule httpshckaitcomgrassland collagen powder httpshckaitcomequipcollagen real salt httpshckaitcomrealsalt krill oil httpshckaitcomkrill bone broth kait httpshckaitcomkettleandfire blue light block glass httpshckaitcomblublox red light therapy free gift kait httpshckaitcomjoovv electrolytes httpshckaitcomlmnt save httpshckaitcomdiscounts business hellohealthcoachkaitcom video general informational purpose must never consider substitute advice provide doctor qualify healthcare professional always seek advice physician qualify healthcare professional question may regard health medical condition video sponsor link affiliate link mean make small commission shop extra cost align brand love trust ketodiet carnivorediet healthcoachkait,People & Blogs,Fitness,"health and fitness journey,carnivore diet weight loss,carnivore diet weight loss results,carnivore diet weight loss stories,carnivore diet results,amenorrhea,amenorrhea recovery,amenorrhea story,how i got my period back,how i got my period back naturally,how i got my period back after birth control,why i lost my period and how i got it back,no period,carnivore diet for women,carnivore diet amenorrhea,paleo diet,keto diet,carnivore diet,keto,carnivore,lchf,hflc"
y7de7ksyuJc,may health forum docatoie brgyphilam west avenue quezon city,health concern like message us facebook mmehealthforumwithdocatoie first time follow consultation please visit official webex live stream link zynergiawebexcommeethf like share official social media page facebook httpsfacebookcomhealthforumwithdocatoie twitter httpstwittercomhealthforumph instagram httpsinstagramcomhealthforumph,People & Blogs,Fitness,"zynergia,health forum,doc atoie,hypertension,high blood,bukol,cancer,Rayuma,Gout,Liver Problem,Gall bladder,Leg cramps,Muscle pain,Joint Pain,Cyst,Myoma,Thyroid,Goiter,Lymphoma,Lipoma,Lymph Nodes,Polyp,Tumor,Pancreas,kidney,stroke,allergy,asthma,kidney failure,amazing ag,twingreen,vitzee,moringo,atoie arboleda,boss vic,health forum with doc atoie,cafeteria zynergia,alam niyo ba,virgin culot oil,health awareness campaign"
iDEixwqQ3dA,reduce belly fat focus point change life malayalam tip fitness kerala style food,reduce belly fat focus point change life malayalam tip fitness kerala style food,People & Blogs,Fitness,"malayalam fitness tips,belly fat,how to reduce belly fat,how do reduce fat,kerala style food"
1RrAYLCC168,cardio vs weight fitness influencers lie,vs cardio question answer video cardio weight much cardio want lose weight cardio better weight fat loss want grow booty also want lose belly fat lift weight cardio best cardio workout grow booty stepper good cardio glut want lose fat want booty shrink much cardio ahhh ageold fitness conundrum cardio vs weight better whether want lose body fat gain lean muscle grow booty get rid belly fat im go give honest bs answer burn question vs fake fitness influencers lie deserve truth like video truth fitness vs video basically part ii hold back watch video learn really happen behind scenes fitness industry affect mental health cardio think best way burn fat think need watch fat loss video struggle lose weight get rid belly fat typical less move approach fat loss ebook guide ever need finally get real last result check httpsshelleydarlingtoncomguides want nice round perky booty right forget cardio want get real booty gain finally start see actual result video need watch guarantee one else show tip cardiovsweights cardiovsweighttraining cardioworkouts stay strong shell x social media instagram httpswwwinstagramcomshelleydarlingtonhlen facebook httpswwwfacebookcomstrongbyshelley pinterest httpswwwpinterestcomaushelleydarlington twitter httpstwittercomstrongbyshelleylangen,People & Blogs,Fitness,"cardio vs weights,cardio vs weight training,cardio vs weights for fat loss,cardio vs weights for weight loss,cardio vs hiit,cardio or lifting first,cardio before or after weights,best cardio for booty"
4VrYlFjDLo4,introduction health naush womens health se mutaliq tamam maloomat sirf apkay liye,introduction health naush womens health se mutaliq tamam maloomat sirf apkay liye channel naush kitchen routine channel httpswwwyoutubecomchannelnaushkitchenroutinechannel facebook page httpswwwfacebookcomnaushvlogs iinstagram httpinstagramcomnaushvlogs pinterest httpwwwpinterestcomnaushvlogs email naushkitchenroutinegmailcom,People & Blogs,Fitness,
LMkkHbWsCks,things wish know start fitness journey grab pen paper,things wish know start fitness journey hello guy video give ten things wish know start health fitness journey want grab pen paper avoid make mistake promise achieve goals way quicker fun videos like fitness journey organize workout clothe favorite piece httpsyoutubeindzffgbppe link mention workout follow blog httpskylabelandcom instagram httpswwwinstagramcomkylabeland pinterest httpswwwpinterestcomkylabeland start blog bluehost httpswwwbluehostcomtrackkylabeland shop video canon vlogging tripod canon tripod shop products httpskylabelandcomshop never give jay someday httpssoundcloudcomjaysomeday creative commons attribution unported cc free download stream httpbitlynevergiveup music promote audio library httpsyoutubemulvyspgs video sponsor amazon link bluehost rewardstyle affiliate link mean may receive small commission cost make purchase link thank support channel continue create content another disclaimer information provide base personal experience doctor certify personal trainer strongly recommend consult physician begin exercisenutrition program never rely solely information web place seek professional medical advice information contain video educational informational purpose make available selfhelp tool remember health fitness nutrition success depend relate program service result may vary base many variables include limit individual capacity life experience unique health genetic profile start point expertise level commitment however true hard work dedication believe make change life start video,People & Blogs,Fitness,"things i wish i knew before starting my fitness journey,10 things i wish i knew before starting my fitness journey,fitness journey,fitness tips,how to start your fitness journey,how to get fit fast,fitness journey before and after,my fitness journey transformation,fitness journey transformation,my fitness journey weight loss transformation,top fitness tips,best fitness tips,how to get healthy,body transformation skinny to muscle,body transformation before after"
f0NMc7DtcpA,warm zumba fitness,remix athina bini zumbafitness zumbawarmup find us httpswwwinstagramcomathinabinihlel httpswwwfootloosedancestudiogr,People & Blogs,Fitness,https://www.instagram.com/athina_bini/?hl=el
4tBTv0I5-qk,restore health glyphosate heal gut zach bush md positive university,episode positive university podcast bestselling author jon gordon talk dr zach bush one compel medical mind work improve human health today interview dr bush share science health disease glyphosate food allergies heal gut truly fascinate one nations triple board certify physicians know stuff definitely want listen close one go blow mind wed also love hear post social tag stand resource regenerative farm allow farmers make instead mission httpsfarmersfootprintus reclaim million acres land healthy soil healthy bodiesminds help farmers check could solution zach bush md zach bush md one triple boardcertified physicians country expertise internal medicine endocrinology metabolism hospicepalliative care breakthrough science dr bush colleagues deliver offer profound new insights modern disease epidemics well human health longevity business innovation educational mission provide foundation cuttingedge philosophy science grassroots movement change business legislative structure ultimately upshift consumer behavior bring radical change mega industries big farm big pharma western medicine large learn dr bush httpszachbushmdcom learn jon gordon httpwwwjongordoncom,People & Blogs,Fitness,"jon gordon,zach bush,zach bush md,dr zach bush,zach bush m.d.,restore,restoring health,gut health,healing the gut,glyphosate,glyphosate danger,roundup,disease,health,food allergies,science of health"
XvvHMYVTGqk,wrong fitness wish know,plan online coach httpremingtonjamesfitnesscom boss supplement code discount httpfinalbossperformancecom boss athletics apparel httpfinalbossathleticscom organic meat deliver door new album kitchen essentials ninja foodi rice cooker httpsgooglttbfpj body fat analyze scale httpsgoogljuycya food scale stainless steel mix bowl giant bamboo cut board oven cook rack best value giant double side grill knife set air fryer meal prep containers slow cooker food processor best blender giant bake dish instant read thermometer game channel music channel workout playlist httpsgooglkbwjax channel httpswwwyoutubecomuserhiphapsnappy ig httpinstagramcomtheremingtonjames twitter httptwittercomremingtonjv facebook httpfacebookcomremingtonjamesfitness soundcloud business contact,People & Blogs,Fitness,"Remington James Fitness,fitness myths,fitness,top fitness myths,fitness myths busted,myths,top 5 fitness myths,worst fitness myths,fitness mistakes,nutrition myths,10 fitness myths,home fitness myths,fitness myths top 10,bodybuilding myths,common fitness myths,top five fitness myths,biggest fitness myths,fitness myths vs facts,fitness myths and facts,fitness myths buzzfeed,gym myths,most popular fitness myths,greg doucette"
4-eMPlwmdS0,benefit flaxseeds health benefit flaxseeds side effect urduhindi,flaxseed plantbased food provide healthful fat antioxidants fiber people call mean person eat boost health usual serve size grind flaxseed tablespoons tbsp serve include calories grams g protein g carbohydrate g fat g fiber fatty acids vitamin vitamin folate calcium iron magnesium phosphorus potassium benefit rich help digestion help weight loss reduce cholestrol lower blood sugar lower blood pressure flax seed become popular due high content fatty acids fiber plant compound responsible many benefit may aid weight loss improve blood sugar control well heart digestive health want boost health tiny powerhouses buy locally online instagram httpswwwinstagramcomusmanalif facebook httpswebfacebookcomfitnessusman usmanalifitness flaxseeds benefitsofflexseeds,People & Blogs,Fitness,"health benefits of flaxseed,flaxseed benefits,flax seeds benefits,health benefits of flax seeds,flaxseed,benefits of flaxseed,flaxseed health benefits,health benefits of flaxseeds,benefits of ground flaxseed,benefits of milled flaxseed,health benefits of ground flaxseed,benefits flaxseeds,6 health benefits of flax seeds,flaxseed oil benefits,flaxseed water benefits,ground flaxseed benefits,milled flaxseed benefits,flaxseed oil"
zlr8PP5byGo,work lose weight health vs look simplypodlogical,let taco bout tuesday episode simplypodlogical cristine ben talk workout routines lose weight weight lift woman gym body sham body positivity health vs look cristine play sport grow use pole dance ben really overweight relationship poor mental health poor physical health cristine start work cristine figure workout routine deal insecurity gym cristine go sock weight lifter confidence share workouts social media lift weight woman gym bros strong women gross stay motivate workout good videosresources start weight lift cristine protect nail hand gym need personal trainer weightlift routine split lose weight health vs look body sham body positivity cristine arch back bench press much weight cristine lift listen work motivate us eat healthy ben really like hummus cristine really like overnight oats video content reference job podcast cristine watch youtube keep nail peelies longer follow simplypod drop us episode topic suggestions httpstwittercomsimplypodlogica httpswwwinstagramcomsimplypodlogical httpswwwfacebookcomsimplypodlogical httpswwwredditcomrsimplypodlogical cristine httpswwwyoutubecomsimplynailogical httpswwwholotacocom httpstwittercomnailogical httpswwwsnapchatcomaddsimplynailogica httpswwwinstagramcomsimplynailogical httpswwwfacebookcomsimplynailogical ben httpstwittercomsimplybenlogica httpswwwinstagramcomsimplybenlogical shop items podcast set amazon storefront httpswwwamazoncomshopsimplynailogical affiliate link nailogical inc opinions,People & Blogs,Fitness,"simplypodlogical,simply nailogical,simplynailogical,simplynailogical podcast,simply podcast,nailogical podcast,cristine and ben,cristine & ben,simplynailogical boyfriend,pod logical,youtuber podcast,weight loss,fitness,workout,workout routine,lifting weights,build muscle,lose fat,women muscle,gym anxiety,women's workout,healthy eating,taking care of your health,self-care,simplynailogical weight,strong women,body positivity"
XIPPaTdxiPc,tici ribeiro jump fitness música love,tici ribeiro jump fitness música love,People & Blogs,Fitness,"TICI RIBEIRO,AULA DE JUMP,ACADEMIA,PERDER PESO,AULA EM CASA"
MMRi1Lokoro,fitness flop fitness industry,podcast instagram merch cameo email philionfitgmailcom,People & Blogs,Fitness,"philionfit,phil rusnack,philion,fitness flop,fitness,flop,fitness flop the fitness industry,the fitness industry"
X1QDkpUPiI8,health documentarydocumental eng sub esp,health documentary film critique health impact meat dairy products consumption question practice lead health pharmaceutical organizations primary purpose advocate plantbased diet filmmaker kip andersen uncover secret prevent even reverse chronic diseases investigate nations lead health organizations doesnt want people know health es una película documental de que critica el impacto en la salud del consumo de carne productos lácteos cuestiona las prácticas de las principales organizaciones farmacéuticas de salud su objetivo principal es abogar por una dieta basada en plantas el cineasta kip andersen descubre el secreto para prevenir e incluso revertir enfermedades crónicas e investiga por qué las principales organizaciones de salud de la nación quieren que las personas sepan al respecto,People & Blogs,Fitness,"whatthehealth,health,sickpeople,documentary,tiduscoop,system"
U5NsNHLXGwM,fitness quotient boost stamina endurance,play sport take dog walk appreciable level stamina endurance always help home workout routine help boost stamina endurance order stayfiteveryday lockdown download fitness quotient furo sport app bitlyfqapp fitnessquotient fq furosports fitness flexibilty strength endurance fitnessenthusiasts fitnessfreaks workout fitnesschallenge,People & Blogs,Fitness,
6hV9WGUlzfw,pimples say health get rid best oz collection,collection top clip years oftthe doctor oz show pimples say health get rid best oz collection dermatologist dr sandra lee aka dr pimple popper explain pimples say health share favorite natural remedy get rid pimples watch dr oz show subscribe dr ozs official youtube channel like dr oz facebook follow dr oz instagram follow dr oz twitter,People & Blogs,Fitness,"DR OZ,DOCTOR OZ,THE DR OZ SHOW,pimple,pimple popping,pimple popper blackhead,pimple popping blackheads,pimples removal,pimple popping addicts,pimple vacuum,pimple popping satisfying"
WDME-TQ4bL0,fitness dangers beerbiceps hindi,beerbiceps workout coach gaurav taneja abhinav mahajan jeet selal yash sharma httpswwwyoutubecomuseryashsparx hindi fitness playlist instagram beerbiceps httpswwwinstagramcombeerbiceps twitter beerbicepsguy httpstwittercombeerbicepsguy namaste dosto mein hu apna bada bhai ranveer allahbadia aur aaj hum baat karne wale hai kuch fitness tip hindi ke baare mein hum aaj ye bhi discuss karege ki body kaise banate hai aur hume fitness kaise rakhe chahiye aksar hum muscle kaise banaye aur body kaise banaye ye chakar mein kuch galtiya kar baithe hai ye kuch common fitness mistake aur kuch workout mistake bhi hoti hai hindi video mein hum fitness kaise banaye aur lose weight ke alava kuch gym tip hindi bhi discuss karege workout lose fat ke baare mein soch kar hum gain muscle ke baare bhul jate hai video mein humne kuch workout tip advice ke baat hi hai jo apne fitness mein aapko help kar sakte hai ye mistake agar aap avoid karege toh aap lose fat bhi kar payenge aur ki diet bhi sudar jayegi apka bada bhai aur beerbiceps ki team ki taraf se aapke liye humari taraf se ye holi ka tofa,People & Blogs,Fitness,"hindi,fitness tips in hindi,beerbiceps,body kaise banate hai,fitness kaise rakhe,ranveer allahbadia,muscles kaise banaye,body kaise banaye,fitness kaise banaye,gym tips in hindi,fitness mistakes,workout mistakes,mistakes,diet,lose fat,workout,tips,advice,how to workout,how to lose weight,how to lose fat,how to gain muscle,fitness"
iUPx7DLBE3E,male model vs fitness model girls prefer connor murphy vlogs,get manscaped free ship promo code manscapedcom adonyx clothe get httpsadonyxlifestylecom instagram httpswwwinstagramcomadonyxclothing twitter httpstwittercomadonyxclothing facebook httpswwwfacebookcomadonyxclothing follow lauren httpswwwinstagramcomheyitslaurenkay follow brett httpswwwinstagramcombrettmvrk get video message httpswwwcameocomconnormurphy hybrid physique httpbitlyleanphuck adonyx coach httpadonyxcoachingcom bro labsuse discount code adonyx method httpsamadonyxmencomamenhanceyourphysique adonyx podcastsearch adonyx wherever listen podcast become social media famous httpwwwinfluencerdominationcom get tinder date httptindercheatcodecom subscribe connor murphy talk adonyx free video connor murphy bodybuilder prankster fitness personality head venice beach los angeles ask girls body hair matter trim hair manscaped contest friend brett male model see girls like better connor fitness model subscribe httpbitlyconnormurphyvlogssub check top vlogs httpbitlyconnormurphytopvlogs instagram httpswwwinstagramcomconnormurphyofficial twitter httpstwittercomcmurphyfitness facebook httpswwwfacebookcomconnormurphyofficial connormurphyvlogs connor murphy vlogs bodybuilder prankster fitness personality work hard build aesthetic physique would waste fun daily vlog hope enjoy male model vs fitness model girls prefer connor murphy vlogs connor murphy vlogs,People & Blogs,Fitness,"manscaped,grooming,mens grooming,mens style,style,fashion,mens fashion,fitness,bodybuilding,Male model,fitness model,male model vs fitness model,who do girls prefer,Connor Murphy,Connor Murphy transformation,connor murphy workout,Connor Murphy prank,connor murphy nerd"
UgQR6DyTE_U,fitness industry lie mind pump health theory,sal di stefano adam schafer justin andrews mind pump join tom discuss truth behind fitness industry lead us astray show note mind pump create vulnerability set apart selfhate motivate story get fitness vulnerable make better trainers podcasters sal stop focus physique start fitness journey understand baseline trust natural hunger cue learn tap foods make feel spiritual side fast cardio terrible weight loss resistance train improve metabolic rate lose weight first month new fitness plan biggest loser approach lose weight cultivate awareness practice meals play wellness eat post workout power meditation practice need look body whole optimize sleep find listen mind pump come name one thing change improve health discuss episode mind pump podcast mind pump app fat secret app myfitnesspal paul chek helen messier viome mark divine wim hof method follow mind pump podcast youtube instagram facebook mind pump app follow sal follow adam follow justin,People & Blogs,Fitness,"Tom Bilyeu,Impact Theory,ImpactTheory,TomBilyeu,Inside Quest,InsideQuest,Tom Bilyou,Theory Impact,motivation,inspiration,fitness myths,fitness industry,fitness,mind pump,mind pump tv,mind pump media,sal di stefano,justin andrews,adam schafer,mind pump on health theory,fitness industry lies"
IsJus1R15Ds,take care mental health pandemic,things help love ones remain mentally well pandemic record psychiatrist dr eva adriana wilson information helpful resources go httpwwwinspiredlivingmedicalcom httpwwwdrevaadrianawilsoncom check dr eva adriana wilsons book amazon practical positive psychiatry clinicians things need well start day strong end day stronger,People & Blogs,Fitness,"meditation,guided meditation,ACT group,inspired living medical,dr. wilson meditation,acceptance and commitment,therapy,quick meditation,quick guided meditation,the five things,the five things we need to be well,the 5 things,the 5 things we need to be well,stamp,stamp wellness model,practical positive psychiatry,positive psychiatry,covid19,covid 19,19,covid-19,corona,coronavirus,virus,pandemic,how to stay calm,panic,what to do,epidemic,how to,mental health"
xUMoI0-oT7A,warm retrogroove fitness toot ensomo rgf team,update please follow us follow facebook page link youtube channel link retrogroovefitness retro groove fitness httpretrogroovefitnesscomph,People & Blogs,Fitness,
lLMVefQKyaE,health affirmations reprogram mind sleep,healthaffirmations healyourbody reprogramyourmind health affirmations reprogram mind heal renew live life perfect health increase scientific evidence show mind ability completely heal body listen powerful affirmations reprogram subconscious mind automatically heal sleep restore natural state optimal health enjoy please let know find heal affirmations comment love jess live life love view script entrepreneur mindset affirmations click link buy copy via website httpwwwilivethelifeilovecomshop via itunes store click relevant icons top main channel page follow instagram get weekly abundancemeditation inspiration let build tribe click httpswwwinstagramcomlivethelife check blog please visit httpwwwilivethelifeilovecom music adrift volume christopher lloyd clarke httpswwwchristopherlloydclarkecom license enlighten audio,People & Blogs,Fitness,"health affirmations,affirmations for health,healing meditation,i am affirmations,heal while you sleep,i am affirmations sleep,reprogram your mind,reprogram your subconscious mind,reprogramming the subconscious mind,heal your body,health meditation,affirmations for health and healing,sleep affirmations,healing affirmations,health affirmations subliminal,heal your body meditation,perfect health subliminal,perfect health"
XETddySwLpY,fitness journey qa change life,thank much watch please dont forget like comment subscribe see videos hope see next video subscribe youtubecomcannabellehayes instagram httpswwwinstagramcombellsebobohlen twitter httpstwittercombellsebobolangen snapchat bellsebobo fitness website httpswwwannabellehayescom fitness program blog business email annabellefhayesgmailcom advice email contactbellsebobogmailcom wig httpswwwheavenlyloxcom,People & Blogs,Fitness,"fitness,fitness transformation,fitness trainer,personal trainer,qna,q&a,bellsebobo,annabelle hayes,howtogrowglutes,how to change your life,inspiring,motivation,fitness motivation,workout transformation,fortnite,kylie jenner,funny,fitness journey,drama,glutes,growyourlegs,loseweight,fitness before and after,before and after,howtogetfit,2019,gainweight,howto,howtogainweight,kylie,reaction"
