video_id,title,description,category,sub_category,tags
Y8raTDLQJ_I,spicy beef curry easy beef curry recipe,spicybeefcurry easybeefcurryrecipe beefrecipes ingredients cup mustard oil small bay leave tsp cumin seed large onion slice tbsp gingergarlic paste beef tsp grind turmeric tsp grind coriander tsp garam masala tsp crush black pepper tsp mild red chili powder tsp meat masala medium size ghost chili salt taste tbsp tomato paste roughly tear culantro mexican coriander chop coriander leave,People & Blogs,Recipes,"food,homemadefood,indianfood,easyrecipes,indianfoodinaustralia,easybeefcurryrecipe,spicybeefcurry,indianbeefcurry,indiannonvegetarianrecipes,dhabastylrbeefcurry,homecookbeefcurry,beefrecipes,bluebellrecipesbeefcurry"
AOHI1d6QyIY,easy instant rice recipes lunch box recipes ideas,corriander rice httpshebbarskitchencomcorianderricerecipecorianderpulao tomato rice httpshebbarskitchencomtomatoricerecipethakalirice peanut rice httpshebbarskitchencompeanutricerecipelunchboxrecipe cabbage rice httpshebbarskitchencomcabbagericerecipecabbagepulao music httpwwwhooksoundscom coriander rice recipe cilantro rice coriander pulao kothamalli rice recipe detail photo video recipe authentic south indian ricebased recipe fill veggies infuse fresh coriander aroma south india coriander pulao mainly prepare breakfast also ideal lunch box tiffin box recipe taste great without side dish also serve basic raita kurma recipe tomato rice recipe make tomato rice thakali rice detail photo video recipe healthy flavour rice recipe prepare mainly basmati rice spice tomato masala ideal one pot meal lunch box recipe also serve breakfast dinner generally serve without side dish taste amaze serve choice sour raita peanut rice recipe groundnut masala rice lunch box recipe detail photo video recipe tasty flavour rice base dish prepare roast peanutgroundnut spice mix ideal lunch box recipe kid adults prepare easily jiffy busy mornings generally serve without side also taste great plain raita dal also coconut base chutney recipes cabbage rice recipe cabbage pulao recipe spicy cabbage pulav detail photo video recipe easy healthy lunch box recipe prepare mainly cook rice shred cabbage leave ideal recipe leftover rice unattended cabbage fridge result spicy flavour rice recipe taste great serve combination raita salad lunch dinner,People & Blogs,Recipes,"instant rice recipes for lunch,instant recipes with rice,instant rice recipes veg,instant rice recipes south indian,instant rice recipes quick,instant rice recipes low carb,instant rice recipes indian,instant rice recipes healthy,instant pot rice recipes,instant rice recipes in telugu,lunch box recipes healthy,quick lunch box recipes indian,lunch box recipes south indian,lunch box recipes tamil,diet lunch box recipes,lunch box recipes easy"
RRJgd6bF22k,class dinnerhealthy breakfast recipe,class dinnerhealthy breakfast recipe,People & Blogs,Recipes,"kothumai,wheat,kothumai recipe,wheat recipe,puttu,kothumai puttu,gothumai puttu,wheat flour puttu,puttu recipe in Tamil"
T65EHT0rXhM,dahi papdi chaat papdi recipe dahi papri chaat papdi chaat recipe,full recipe httpshebbarskitchencomdahipapdichaatrecipedahibhalla music httpwwwhooksoundscom dahi papdi chaat recipe dahi bhalla papdi chaat bhalla papdi recipe detail photo video recipe easy quick yoghurt base chaat recipe make deepfried flat puri chaat chutneys popular north indian chaat recipe know sweet sour spicy taste offer chaat recipe typically serve dessert spicy chaat meal due use yoghurt sauce dahi papdi chaat recipe dahi bhalla papdi chaat bhalla papdi recipe step step photo video recipe chaat recipes common seek recipe many young teenage audiences typically serve spicy meal combination flavour yoghurt base chaat recipes one curd dahi base chaat recipe dahi papdi chaat recipe inspire dahi bhalla dahi vada recipe,People & Blogs,Recipes,"dahi papdi chaat recipe,papdi chaat recipe,aloo papdi chaat recipe,punjabi papdi chaat recipe,dahi bhalla papdi,dahi chaat recipe,dahi papdi chaat recipe in hindi,bhalla papdi chaat recipe,papri chaat recipe,dahi papdi chaat,dahi bhalla chaat recipe,holi chaat recipe,dahi bhalla recipe,aloo papdi chaat recipe in hindi,papdi chaat recipe in hindi,chole papdi chaat recipe in hindi,make papdi chaat video,bhalla papdi chaat recipe in hindi,bhalla papdi"
x-NRti3UH28,aloo fry rice recipe potato fry rice recipe lunch box recipe,aloo fry rice recipe potato fry rice recipe lunch box recipe lunchboxrecipe ingredients potato chop cup small onion chop cup small tomato chop cup small oil tbsp green chilli nos garlic chop nos cumin seed tsp mustard seed tsp turmeric powder red chiili powder tsp maggi masala tbsp salt taste freeze peas cup small rice cup,People & Blogs,Recipes,"aloo fried rice recipe,potato fried rice recipe,lunch box recipe,fry rice"
e4F2V-RVQgg,easy quick chutney recipes idli dosa south indian breakfast chutney recipes,dosa chutney recipe httpshebbarskitchencomdosachutneyrecipecoconutchutney kara chutney recipe httpshebbarskitchencomkarachutneyrecipesidedishdosa peanut chutney recipe httpshebbarskitchencompeanutchutneyrecipegroundnutchutney tomato chutney recipe httpshebbarskitchencomoniontomatochutneyrecipe music courtesy insights nazar rybak summer feel nicolai heidlas digital hug vexento rock riff nicolai heidlas hooksoundcom soundcloudcomvexento dosa chutney recipe make coconut chutney chutney dosa detail photo video recipe simple tasty coconut base condiment recipe typically serve restaurants side dish typically serve alongside various dosa recipes breakfast also serve idli upma simple prepare make within minutes freshly available coconut chutney dosa make coconut chutney dosa chutney recipe step step photo video recipe south indian cuisine myriad variations spicy flavour chatni recipes range vegetables spice lentils fruit peel green leafy vegetables mainly serve purpose taste enhancer among common popular recipe coconut chutney serve dosa recipes kara chutney recipe make kara chutney side dish dosa detail photo video recipe spicy tangy red colour chutney recipe especially serve dosa idli appam idiyappam recipe recipe quite famous tamil cuisine restaurants especially saravana bhavan hotel chain simple chutney recipe make tomatoes onions spice kara chutney recipe make kara chutney side dish dosa step step photo video recipe chutney recipe wide range topic region india variation way prepare particularly south india myriad range variations often make south indian breakfast recipes kara chutney one simple spicy flavour chutney recipe dosa idli recipes peanut chutney recipe groundnut chutney recipe shenga chutney detail photo video recipe simple mild nut base chutney side dish serve breakfast items like dosa idli typically prepare roast peanuts groundnuts however taste great combination peanut chutney recipe groundnut chutney recipe shenga chutney step step photo video recipe several variations simple peanut base condiment vary region region typically peanuts roast less oil ground fine paste green chillies garlic salt later ground chutney dilute add water temper mustard urad dal tadka onion tomato chutney recipe tomato onion chutney recipe detail photo video recipe popular south indian chutney recipe mainly serve dosa idli even pongal rice recipe typically prepare breakfast also serve side dish lunch steam rice taste amaze ghee rice combination onion tomato chutney recipe tomato onion chutney recipe step step photo video recipe chutney recipes prepare almost vegetables use daily basis hence find variants tomato chutney onion chutney ginger chutney even capsicum chutney recipe combination vegetables ie onion tomato bring tangy sharp pungent taste chutney,People & Blogs,Recipes,"3 chutney recipes,chutney recipes south indian,chutney recipes raks kitchen,quick chutney recipes,chutney recipes onion,nariyal chutney recipes,making chutney at home,chutney recipes kannada,chutney dish recipes,chutney recipes indian,chutney recipes easy,chutney recipes without onion and garlic,chutney recipes tamil,chutney recipes in hindi,chutney recipes without coconut,chutney recipes for dosa,chutney recipes in tamil,chutney recipes telugu"
SJBgKAcuIxo,instant sweets milk powder milk powder sweets recipes milk powder sweets indian,gulab jamun recipe httpshebbarskitchencomgulabjamunrecipekhoyamilkpowder kesar burfi recipe httpshebbarskitchencomkesarburfirecipekesarkhoyabarfi mathura peda recipe httpshebbarskitchencommathurapedarecipemathurapede kharvas recipe httpshebbarskitchencominstantkharvasrecipejunnurecipe instant malpua recipe httpshebbarskitchencominstantmalpuarecipemilkpowder kala jamun recipe httpshebbarskitchencomkalajamunrecipeblackjamunrecipe music httpwwwhooksoundscom gulab jamun recipe gulab jamun instant khoya gulab jamun milk powder detail photo video recipe classic ballshaped indian dessert recipe make khoya milk powder khoya ball deep fry hot oil ghee later dip rest sugar syrup absorb turn moist special sweet recipe make occasion festival celebrations gulab jamun recipe gulab jamun instant khoya gulab jamun milk powder step step photo video recipe milk solids khoya source many indian sweets recipes make special occasion one immensely popular indian dessert recipe gulaab jamun recipe make milk solids milk powder easily make instant mix recipe easily challenge kesar burfi recipe kesar barfi milk powder kesar khoya barfi detail photo video recipe simple rich barfi fudge recipe make saffron strand milk powder simple easy indian sweet recipe adopt various occasion celebration feast recipe make different ingredients texture recipe soft chewy texture compare traditional barfi recipes kesar burfi recipe kesar barfi milk powder kesar khoya barfi step step photo video recipe barfi recipes common across india make myriad ingredients generally shape like fudge completely open end expose variations alterations one simple easy barfi recipe kesar burfi recipe know flavour saffron colour mathura peda recipe mathura pede mathura ka peda mathura na penda detail photo video recipe classical indian milkbased sweet dessert make milk solids sugar name suggest recipe hail northern indian city mathura generally make janmashtami festival compare traditional white contain dark colour mawa caramelise mathura peda recipe mathura pede mathura ka peda mathura na penda step step photo video recipe milkbased desserts common across india make different purpose famous one come bengali cuisine cuisines also make quality milk desserts one easy simple tasty milk sweet mathura peda know texture taste flavour kharvas recipe junnu recipe make instant kharvas detail photo video recipe traditional indian sweet dessert recipe prepare cow milk colostrum milk cheek texture appearance similar milkbased paneer softer sweet taste moreover dissolve mouth make ideal dessert recipe party occasion kharvas recipe junnu recipe make instant kharvas step step photo video recipe indian sweets world famous many variants flavour sweets prepare full cream milk particularly bengali cuisine full chenna base sweets dip sugar syrup sweeten milk kharvas recipe junnu one sweet recipe make colostrum use milk milk powder instant malpua recipe easy malpua recipe milk powder detail photo video recipe basically sweet pancake snack dessert recipe prepare mainly purpose flour thick sugar syrup say several varieties popular malpua recipe vary region region popular recipes bengali malpua odia malpua rajasthani malpua recipe kala jamun recipe black jamun recipe instant khoya mawa detail photo video recipe exotic indian sweet recipe prepare milk solid know khoya mawa typically gulab jamun kala jamun prepare khova prepare evaporate milk recipe instant mawa khoya prepare milk powder,People & Blogs,Recipes,"sweets from milk powder,sweets from milk powder banana,sweets from milk powder cake,sweets from milk powder easy,sweets from milk powder jamun,sweets from milk powder recipes,sweets from milk powder sweets,sweets from milk powder vegan,sweets made from milk powder,sweets with milk mawa powder,indian sweets from milk powder,sweets from milk powder 3 ingredients,sweets from milk powder at home,sweets from milk powder gulab jamun,sweets from milk powder without milk"
3Rw7Ts4dJP0,must try chutney recipes minutes breakfast easy chutney recipes,idli chutney recipe httpshebbarskitchencomidlichutneyrecipehotelstyle tamatar ki chutney recipe httpshebbarskitchencomtamatarkichutneyrecipe red coconut chutney recipe httpshebbarskitchencomredcoconutchutneyrecipe lahsun ki chatni recipe httpshebbarskitchencomlahsunkichatnirecipelehsunchutney pudina chutney recipe httpshebbarskitchencompudinachutneyrecipemintchatni kara chutney recipe httpshebbarskitchencomkarachutneyrecipesidedishdosa music httpwwwhooksoundscom idli chutney recipe make hotel style idli chutney detail photo video recipe simple easy coconut roast chana dal base chutney recipe make specifically idli consistency chutney key make watery compare others say recipe also serve south indian breakfast like dosa upma even pongal recipe idli chutney recipe make hotel style idli chutney step step photo video recipe chutney recipes mandatory south indian breakfast recipes chutney recipes make coconut side ingredient define purpose name one easy simple purpose base chutney recipe idli chutney know liquid consistency tamatar ki chutney recipe tamatar ki chatni tomato ki chatni detail photo video recipe spicy tasty tomatobased condiment serve taste enhancer choice meal ideal side dish morning breakfast recipes like south indian dosa steam idli also serve rice extremely simple quick make basic ingredients easily available every kitchen tamatar ki chutney recipe tamatar ki chatni tomato ki chatni step step photo video recipe chatni condiment recipes essential many indian households myriad ways make chutney recipes yet crave something different every time one easy simple chutney recipe tamatar ki chutney recipe make ripe tomatoes dry indian spice red coconut chutney recipe red chilli coconut chutney idli red chutney detail photo video recipe authentic south indian spicy chutney make coconut grate red chillies ideal spicy condiment typically serve south indian breakfast dish like idli dosa also serve many dish include upma pongal even side dish rice sambar combination red coconut chutney recipe red chilli coconut chutney idli red chutney step step photo video recipe coconut base chutney recipes native south indians serve myriad dish popular coconut base chutney white colour serve idli dosa popular chutneys red coconut chutney recipe one serve various breakfast dish lahsun ki chatni recipe lehsun chutney lehsun ki chutney detail photo video recipe spicy flavour condiment recipe make fresh garlic pod red chillies essential chatni recipe rajasthani cuisine serve almost every dish like roti rice simple easy make importantly long shelf life compare traditional south indian chutney lahsun ki chatni recipe lehsun chutney lehsun ki chutney step step photo video recipe chatni recipes essential part indian state widely use different purpose establish side dish breakfast snack base modern curry one multipurpose chutney recipe lehsun ki chatni northwest india use myriad purpose pudina chutney recipe mint chutney pudina chatni detail photo video recipe simple easy flavour indian condiment recipe make coconut mint leave ideal chutney recipe serve idli dosa also steam rice many variants pudina chutney make leave dip coconut mint leave use kara chutney recipe make kara chutney side dish dosa detail photo video recipe spicy tangy red colour chutney recipe especially serve dosa idli appam idiyappam recipe recipe quite famous tamil cuisine restaurants especially saravana bhavan hotel chain simple chutney recipe make tomatoes onions spice,People & Blogs,Recipes,"12 chutney recipes in tamil,3 chutney recipes,chutney dish recipes,chutney recipes andhra style,chutney recipes easy,chutney recipes for idli dosa,chutney recipes indian,chutney recipes kannada,chutney recipes onion,chutney recipes pakistani,chutney recipes south indian,chutney recipes tamil,chutney recipes without onion,green chutney recipes,lemon chutney recipes,new chutney recipes in tamil"
Mprr5Q5Z7H4,creamy carbonara pasta christmas recipe,creamy carbonara pasta christmas recipe filipino style carbonara one popular pasta recipe philippines usually serve birthdays christmas noche buena even merienda occasion check recipe videos cook spaghetti pansit canton chicken macaroni salad subscribe ingredients grams pasta linguine spaghetti pasta grams mushroom ml evaporate milk cup sugar optional grams butter whole white onion ml purpose cream grams cheese grams sweet ham salt grind pepper cook oil water creamycarbonara carbonara carbonarapasta,People & Blogs,Recipes,"carbonara recipe,carbonara pasta,easy carbonara,how to make carbonara,pasta recipe,how to cook carbonara,creamy carbonara,filipino style carbonara,carbonara recipe filipino style,carbonara recipe tasty,filipino food,carbonara,pinoy recipe,carbonara pasta recipe,filipino carbonara,noche buena,christmas recipe"
2IMWlViah88,ways uttapam recipe instant vegetable uttapam recipes masala uttapam recipe collection,rava uttapam recipe httpshebbarskitchencomravauttapamrecipeinstantsujiuttapam vegetable uttapam recipe httpshebbarskitchencomvegetableuttapamrecipeveguttapam poha uttapam recipe httpshebbarskitchencompohauttapamrecipeinstantpohauttapa uttapam recipe httpshebbarskitchencomuttapamrecipeonionuttapparecipe music httpwwwhooksoundscom rava uttapam recipe instant suji uttapam recipe sooji uttapam detail photo video recipe extremely popular south indian dosa variety make semolina vegetable toppings ideal morning breakfast recipe make instantly without hassle fermentation ground taste great serve choice spicy chutney also taste amaze without side rava uttapam recipe instant suji uttapam recipe sooji uttapam step step photo video recipe uttapam recipes traditional dosa variety popular south indian morning breakfast cuisine typically make specific dosa batter idli batter include batter ground batter fermentation cheat version make instantly without overnight hassle rava uttapam recipe one popular variation vegetable uttapam recipe veg uttapam mix veggie uttapa detail photo video recipe unique tasty south indian breakfast recipe make multiple veg toppings extension traditional onion uttapam recipe toppings limit finely chop onions make ideal breakfast combo would supply necessary carbs rice batter fibres mix veggie toppings vegetable uttapam recipe veg uttapam mix veggie uttapa step step photo video recipe dosa recipes common across india make different capacity different texture generally come thin thick whitecoloured crepe without extra top yet variations like uttapam finely chop veggies add top mix veggie uttapa one variation poha uttapam recipe instant poha uttapa poha pancake recipe detail photo video recipe ideal instant breakfast recipe make flatten rice batter vegetable toppings recipe extend version traditional uttapam recipe make rice urad dal batter generally make morning breakfast supply require nutrients also serve snack poha uttapam recipe instant poha uttapa poha pancake recipe step step photo video recipe morning breakfast recipes challenge confuse work couple make tricky stressful demand make something unique also tasty time one simple easy instant breakfast recipe poha uttapam recipe poha pancake know simplicity uttapam recipe onion uttapam uthappam recipe masala uttapam detail photo video recipe similar recipe masala dosa plain dosa dosa recipe top vegetables like pizza thicker version dosa top finely chop vegetables like onion tomato capsicum carrot uttapam recipe onion uttapam uthappam recipe masala uttapam step step photo video recipe popular breakfast dosa recipe serve many darshini sagar hotels bangalore south indian restaurants typically serve coconut chutney tomato chutney even sambar recipes,People & Blogs,Recipes,"uttapam recipe,uttapam recipe in hindi,uttapam recipe in telugu,uttapam recipe in tamil,uttapam recipe in marathi,uttapam recipe with idli batter,uttapam recipe in gujarati,uttapam recipe with dosa batter,uttapam recipe at home,uttapam recipe andhra style,uttapam recipe rice and urad dal,uttapam recipe in hindi at home,aloo uttapam recipe,atta uttapam recipe,avalakki uttapam recipe,authentic uttapam recipe,aval uttapam recipe in tamil"
YLzt8X0OMiE,healthy vegetable fry cabbage sunday dinner recipes chef ricardo,healthy vegetable fry cabbage sunday dinner subscribe chef ricardo cook turn notifications subscribe juice bar channel subscribe salad bar channel follow social media twitter httpstwittercomchefricardos google httpsplusgooglecomchefricardocooking instagram httpswwwinstagramcomchefricardocooking facebook httpswwwfacebookcomchefricardocookingbook find recipes website httpwwwchefricardocookingcouk donate cook studio httpswwwpaypalmechefricardo cook book shop httpbitlycaribbeancuisinecookbook httpswwwjamaicavalleycom use code website make money everyday httpsfullscreenmediacocreatorsrefchefricardocooking check top recipes chef ricardo cook ricardo campbell popularly know chef ricardo bear jamaica grow busy hotels restaurants ocho rios one main tourist cities cook prepare first class caribbean dish share passion food world follow chef ricardo mission promote caribbean cuisine healthy vegetable fry cabbage sunday dinner recipes chef ricardo chef ricardo cook httpswwwyoutubecomchefricardocooking,People & Blogs,Recipes,"jamaican,food,chef,ricardo,cooking,world,fat,belly,caribbean,london,uk,Chef,Ricardo,Cooking,Caribbean,Recipe,Book,Apps,Food,Chicken,BBQ,Rice,DVD,book,Money,HOW,Jamaica,Healthy Vegetable Fry Up Cabbage For Sunday Dinner !!,Chef Ricardo Cooking,Caribbean Food,How To,Kitchen,Restaurant,Barbecue Cuisine,Dinner,Cookbook Literary Genre"
rGbq2qwdPGo,easy yummy puff pastry recipes hungry cat,easy yummy puff pastry recipes puff pastry ways recipes video chocolate spiral puff pastry easy recipes httpsyoutubedrkimdpmko chocolate raspberries braid easy recipes puff pastry recipe apple cranberry pastries easy recipes puff pastry recipe bacon cheese puff pastry roll,People & Blogs,Recipes,"video compilation,puff pastry compilation,Puff Pastry,Tasty,how to make,guide,step by step,tasty,food,party foods easy,Puff Pastry Roll,Cheese Puff Pastry,Roll,Buzzfeedtasty,buzzfeed,food recipe,recipe,recipes,How To,Simple,Easy,Fast,Dinner,Lunch,Breakfast,Dinner Recipes,Tasty Food,dessert,sweets,Easy recipes,Hungry cat"
SgZeaAAiZYA,happy happy biscuit cake pressure cooker recipe eggless yummy biscuit cake recipe without oven,happy happy biscuit cake pressure cooker recipe eggless yummy biscuit cake recipe without oven ingredients happy happy biscuits packets gm sugar tbsp milk bowl eno lemon tbsp find happy happy biscuit cake pressure cooker recipe video subscribe channel get regular update find amazon link purchase cook cake popcorn mushroom etc materials follow link,People & Blogs,Recipes,"Happy,Happy Happy,Biscuit,Cake,in,pressure,cooker,recipe,eggless,yummy,biscuit,cake,without,oven"
GM6z1lYRDGo,tiktok recipes need try pt,happy sunday video test new tiktok recipes try find recipes use simple ingredients hopefully guy recreate home try peanut butter mug cake mac n cheese mug amaze chocolate chip cookies banana bread mug infamous pancake cereal also stay tune end see family test weird food combination lol follow instagram httpswwwinstagramcompaigekaiser food instagram httpswwwinstagramcommealsbypaige spotify business inquiries email paigemgmtfullscreencom music use order appearance music gil wander poco pico music rachael ride home music gil wander lose find music gil wander roasn ramen summer night,People & Blogs,Recipes,"tik tok,tiktok,tik tok recipes,tik tok food,tik tok hacks,testing out tik tok,viral tik toks,tik toks"
