video_id,title,description,category,sub_category,tags
VjK5cVFhFhU,primitive technology hunt giant honeycomb forest,primitive technology giant honeycomb forest vs drink honey right,People & Blogs,Technology,"Primitive Technology,Giant Honeycomb,Primitive Technology: Hunting Giant Honeycomb In the Forest"
wZ36HChoEqc,primitive technology upgrade groundwater filter tank build clean water filter tank forest,hi next video video upgrade groundwater filtration system build tank top time clean water well create many layer filter originally layer charcoal gravel sand stone charcoal use clean bacteria heavy metal water sand stone effective water continue new project next video subscribe channel watch latest videos thank,People & Blogs,Technology,"Primitive Technology,Primitive Life,Primitive Skills,Primitive Survival Tool,Primitive Tool,survival,skills,survival skills,Primitive culture,Wilderness,Primitive Wilderness,upgrade,build,water,water filter,filter tank,groundwater,water well,water tank,clean water"
PnyLe6Fd884,amaze unique wild cat trap technology make old wheel pork easy wild cat trap,amaze unique wild cat trap technology make old wheel pork easy wild cat trap,People & Blogs,Technology,"Amazing Unique Wild Cat Trap Technology Make From Old Wheels and Pork - Easy Wild Cat Trap 100%,wild cat trap,Wild Cat Trap Technology Make From Old Wheels,best wild cat trap,Unique Wild Cat Trap,wild cat"
KLGPqnqyFdg,primitive technology eat lemon spicy salt pepper delicious cook lobster,hi day wantto show videos primitive technology eat lemon spicy salt pepper delicious cook lobster like video please ckick like share comment dont get subscribe channel thank somuch,People & Blogs,Technology,"Primitive Technology KH,Primitive,Technology,Eating delicious,eating lemon,Primitive Technology,Eating Lemon With Spicy Salt Peppers Delicious,Cooking Lobster #139,rimitive Technology - Eating Lemon With Spicy Salt Peppers Delicious - Cooking Lobster #139"
2ILAkWciUnE,mind blow latest road technologies,copyright matter please contact us copymanagermngmailcom brain time geo web httpsyoutubenyyngktvw httpsyoutubemjnbnjebiig smart cross httpsyoutubehbscutxmmtk rumble strip dance traffic light tactile pavement httpsyoutubesuqajgelctw intelligent speed bump drone repair roads bridge road stabilise contractor,People & Blogs,Technology,"top 5,top 10,inventions,gadgets,amazing inventions you must see,you won’t believe exist,inventions you must have,things that actually exist,amazing inventions at home,tech,features,specs,homemade 2016,handmade,facts,2017,list,homemade,top5s,maquinas,2016,test,technology,gadget,cool gadgets,accessories,futuristic,awesome inventions"
FNn5DB1Zen4,modern technology agriculture huge machine,hi friends thank much support thank much view watch video hope enjoy great time watch videos thank lot,People & Blogs,Technology,
9vg9L3di4P0,build house underground use wood primitive technology build skill,welcome build skill videos show guy build house underground use wood primitive technology build skill enjoy channel please help subscribe dear mrms thank much value time watch videos likecommentshare subscribe videos build skill channel try best find idea try create videos make assist facilities idea convenience support us please dont hesitate contact us time reply saw recommend question thank much advance best regard build skill stay connect us click videos build skill unbelievable two men build best swim pool ancient skill build skill swim pool bamboo giant mud house thank subscribe watch,People & Blogs,Technology,"building skill,Build House underground Using wood,underground,Primitive technology,Building Skill,house,Primitive Survival Tool,how to build a underground house in the woods,wood roots,house under the wood roots using bamboo,build house under the cliff using bamboo,build swimming pool,ancient skills,build hidden house underground by ancient skills,hidden,tube unique wilderness,underground house,beautiful hobbit house"
qs6rcYnaKvk,mind blow game technologies must,copyright matter please contact us copymanagermngmailcom mind warehouse racingcube httpsfasetechcom bcon gamo cyberith virtualizer middle finger game gloves lexip sensoryx httpwwwsensoryxcom,People & Blogs,Technology,"top 5,top 10,inventions,gadgets,amazing inventions you must see,you won’t believe exist,inventions you must have,things that actually exist,amazing inventions at home,tech,features,specs,homemade 2016,handmade,facts,2017,list,homemade,top5s,maquinas,2016,test,technology,gadget,cool gadgets,accessories,futuristic,awesome inventions"
no50Pgah3mA,unusual abandon technology vehicles,subscribe great inventions change world become essential part way live live every invention success though sometimes work plan case world ready yet unusual vehicles technological developments turn require become abandon turn strange forget curiosities video pack full weird wonderful creations question contact us amazingstockchannelgmailcom,People & Blogs,Technology,"12 most unique abandoned technology and vehicles,abandoned vehicles,abandoned,abandoned technology,unique vehicles,aero train,abandoned plain,abandoned places,amazing abandoned,forgotten vehicles,abandoned train,top 10 abandoned,top 12,12 most"
b4YnZPytMpQ,space technologies amaze,spite enormous scientific technological progress recent years yet explore outer spaceit expensive fly outer space long stay harmful people economic benefit question however number countries various company today develop technologies fundamentally change current situation space technologies im go tell right go,People & Blogs,Technology,"space technology,space,science,space and technology,nasa,NASA,space travel,new technology,new space technology,future space technology,future technology,science and technology,future,amazing space technology,incredible space technology,technology,future of science,Alpha Centauri,Proxima B,scientific and technological progress,space station,space colonies,space elevator,science fiction,spaceship,Earth,moon,Solar system,Mars"
VspXR8_3k_k,insane road construction technologies another level,copyright matter please contact us copymanagermngmailcom mind warehouse,People & Blogs,Technology,"top 5,top 10,inventions,gadgets,amazing inventions you must see,you won’t believe exist,inventions you must have,things that actually exist,amazing inventions at home,tech,features,specs,homemade 2016,handmade,facts,2017,list,homemade,top5s,maquinas,2016,test,technology,gadget,cool gadgets,accessories,futuristic,awesome inventions"
biyvKkKDwXk,primitive technology rescue cruelly trap monkey forest,primitive technology aborigines rescue cruelly trap monkey hunt day,People & Blogs,Technology,"Primitive Technology,Monkey,Primitive Technology: Rescue Cruelly Trapped Monkey In Forest"
hwVdFam0vK8,japan develop technology hindi quick support,japan develop technology hindi quick support इस हम,People & Blogs,Technology,"How Did Japan Develop Technology,How Did Japan Develop Technology in Hindi,Japan technological development,Japan technology history,Japans’ technology advancement,How did Japan become technologically advanced?,Technology and industrial development in Japan,Japanese modern technology,Technology in Japan today"
HqZsFdeJn_o,technology war vol ii,popular mechanics video volume americas new war machine volume americas fighter plan hearst corporation goodtimes home video,People & Blogs,Technology,"F-117A Stealth Fighter,F/A-18 Hornet,AH-64 Apache,Patriot Missile,F-15 Eagle,F-14 Tomcat,Dogfights,Sorties,Bombing Runs,YF-22,Aerial Combat,WWI,Air Power,F-22 Raptor,The Technology of War"
UvfnPVWuCTk,event technology trend,event technology make event awesome top event technology trend keep eye want httpseventmanagerblogcomeventtechnology,People & Blogs,Technology,"#eventtech,event management,event trends,event technology,eventtech,event tech,facial recognition,artificial intelligence,chatbots,better events,julius solaris,eventmb,event manager blog,technology trends,run better events,personalization,influencer marketing,event marketing,event planning,event professional,event tips,event planner,future technology,events management,being an event planner,event technoloy trends,eventtech 2019"
ovlTUUyfzKg,joe rogan talk bob lazar technology evolution alien life,take jre wbob lazar,People & Blogs,Technology,"Joe Rogan,JRE,Joe Rogan Experience,JRE Clips,PowerfulJRE,Joe Rogan Fan Page,Joe Rogan Podcast,podcast,MMA,Joe Rogan MMA Show,UFC,comedy,comedian,stand up,funny,clip,favorite,best of"
MWcBFSwTDl4,philosopher nick bostrom human innovation technology joe rogan,take jre wnick bostrom,People & Blogs,Technology,"Joe Rogan,JRE,Joe Rogan Experience,JRE Clips,PowerfulJRE,Joe Rogan Fan Page,Joe Rogan Podcast,podcast,MMA,Joe Rogan MMA Show,UFC,comedy,comedian,stand up,funny,clip,favorite,best of"
QeajYcltm5c,oldest technologies scientists still cant explain,subscribe human be capable build incredible structure latest cuttingedge office block artistic sculpture cathedrals sport arenas monuments world testament creative skill species modern era though technology help us huge mechanical drill laser cut curve glass builders luxuries ancient time manage create ancient wonder show video science still answer question contact us amazingstockchannelgmailcom,People & Blogs,Technology,"oldest technologies,scientists still can't explain,mysterious buildings,ancient structure,ancient building,scientists couldn't believe,mysterious,strange,unexplained,mysterious stone,underground structure,megalithic stone,mysterious object,top 12,12 most"
DL99deFJYaI,technology vs humanity future already film futurist gerd leonhard,delight present new film future technology humanity shoot footage pretty amaze locations barcelona film explain key theme new book technology vs humanity see link face exponential change begin could heaven could hell depend collaborate go forward future already us havent notice explain job probably automate yet vast majority new job even invent yet humanonly job future must seek become exponentially human embrace technology dont become technology seek seek read key message httpwwwtechvshumancomtechnologyvshumanitygerdsbottomlinesandkeymessages check artwork httpswwwflickrcomphotosgleonhard special thank director jean francois cardella jeremy joly studio chamberlin team cannes music credit inspiration amaksi download lowres version share video via whatsapp social media httpsgerdfmtvhbcndllow download highres reuse subject creative commons oncommercial attribution license technology vs humanity futurism meet humanism gerd groundbreaking new work critical observation discuss multiple megashifts radically alter society economy value biology wherever stand scale technomania nostalgia lose world book challenge provoke warn inspire technology vs humanity lastminute wake call take part important conversation humanity may ever blindly outsource abdicate big chunk live global technology company take back autonomy demand sustainable balance technology humanity supply socratic humanistic critique megashifts currently recast world gerd leonhard provide prologue great debate buy book via httpwwwtechvshumancom via amazon httpgerdfmamazontvh gerd leonhard futurist author keynote speaker zürich switzerland httpwwwfuturistgerdcom httpwwwgerdleonhardde new book technology vs humanity httpwwwtechvshumancom please note audioonly versions many videos make available via soundcloud httpssoundcloudcomgleonhardtracks previous book presentations slideshows available via httpwwwgerdcloudcom,People & Blogs,Technology,"gerd leonhard,futurist,speaker,keynote speaker,inspiring,motivational,gerdtube,@gleonhard,TheFuturesAgency,zukunft,redner,gerdleonhard.de,futurist keynote,futurist gerd,implants,genome editing,techvshuman,singularity,artificial intelligence,IoT,technology humanity,bots,BCI,Silicon valley,Hellven,digital ethics,man machine,transhumanism,machine thinking,robots,exponential,humanism,humanity,jobs,megashifts"
CD0iIJBxP0I,unreal build technologies another level,copyright matter please contact us copymanagermngmailcom mind warehouse,People & Blogs,Technology,"top 5,top 10,inventions,gadgets,amazing inventions you must see,you won’t believe exist,inventions you must have,things that actually exist,amazing inventions at home,tech,features,specs,homemade 2016,handmade,facts,2017,list,homemade,top5s,maquinas,2016,test,technology,gadget,cool gadgets,accessories,futuristic,awesome inventions"
PRSntGkTGLQ,holy grail beauty hack look awesome diy tattoo makeup tip girls,ever want make tattoo one party special date permanent get solution problem need marker baby powder hair spray draw tattoo always want cover powder hair spray time shock mom restyle clothe fix wardrobe problems simple fashion hack youll know survive awkward girly problems look gorgeous everyday funny comedy beauty timestamps diy temporary tattoo make cute heart tattoo marker clothe hack smart girls restyle wardrobe clothe transformation stylish accessorize hack clever clothe hack style awkward moments beauty routine funny outtakes awkward moments subscribe go music epidemic sound epidemicsoundcom stock materials httpswwwdepositphotoscom httpswwwshutterstockcom httpselementsenvatocom,People & Blogs,Fashion,"123go! Genius,123go!,123 go! genius,123 go genius,pranks,challenges,123gogenius,fun,funny,comedy,comedy video,funny video,DIY,DIY project,do it yourself,awkward,awkward moment,awkward situation,funny situation,funny moment,sketch,funny sketch,comedy sketch,funny role play,comedy role play,funny DIY,funny trick,beauty,beauty hack,makeup,makeup hack,girl,beauty routine,fake tattoo,temporary tattoo,DIY tattoo,clothes,clothing hack,fashion,style"
4s8uR5AMvUQ,wear fashion trend,outfit ideas use fashion trend outfit ideas use trend instagram tiffanygracestyle link affiliate link mean receive percentage revenue make purchase products link affect price product link exact product mine things sell find closest match one wear always try update link try find something similar black bralette nude bodysuit split hem jeans open toe heel white high neck top adidas shoe black trench coat black handbag black crop top green cargo pant black high neck dress faux leather jacket sheer tights biker boot gray cardigan good american jeans size im get httpsshopstyleitlbdqwr booties white tee black blazer circle belt polka dot cami black skirt faux leather pant httpsshopstyleitlbdnes one shoulder top bra top black pant fashiontrends,People & Blogs,Fashion,"2020 trends,2020 fashion trends,Outfit ideas,outfit ideas 2020,outfits,outfits 2020,fashion trends,fashion trends 2020,trends 2020,outfits for girls,women outfits,womens clothes,womens trends,streetwear trends,bra top,wide leg denim,leather blazer,guide to 2020 fashion,how to wear,wear trends,2020 outfits,trend alert,wearable trends,wearable trend,casual trends,casual outfits,casual outfit,style 2020 trends,canadian fashion"
ZVlzU2tBZN8,beauty khan tiktok video viral girl beauty khan musically video beauty khan latest tiktok video,download helo app httpsbitlyheloytstar hindi funny video hindi comedy video tiktok video vigo videos trend videos comedy videos musically video latest video funny funny latest dance musically best dance musically compilation best dance musically tik tok hit dance musically best dance musically videos best dance musically india best newest dance musically dance tik tok video new tik tok video tik tok funny videos team tik tok video faisu tik tok video jannat tik tok video tik tok new tik tok latest tik tok tik tok new video tiktok tik tok videos new tik tok video awez tik tok video riyaz tik tok video lucky arishfa tik tok video musically video viral tik tik video vigo india mr faisu musically nagma tik tok video lucky tik tok video avneet tik tok hope video please subscribe thank watch,People & Blogs,Fashion,
DtjKCmT9PL4,merium pervaiz karachi ki garami khaty huye fashion beauty,welcome channel please like subscribe channel meriumpervaiz meriumpervaizinstagram meriumpervaizinstagramstories instagram instagramstories maryampervaizhusband meriumpervaizdaughter maryampervaiz maryampervaizhusband maryampervaizdaughter meriumpervaizdaughter meriumpervaizhusband meriumpervaizweighloss meriumpervaizweightlosstips maryampervaizhusband maryampervaizinstagram merium meriumpervaizdailyhouseroutine maryampervaiz fashion maryam meriumpervaizsandwichrecipe,People & Blogs,Fashion,"Merium pervaiz,Merium,Merium pervaiz instagram stories,Merium pervaiz instagram,Maryam pervaiz,Maryam pervaiz instagram stories,Maryam pervaiz instagram,Instagram,Instagram stories,Maryam,Merium pervaiz weight loss tips,Merium pervaiz Enjoying with her daughter,Merium pervaiz Enjoying with her husband"
sJnDlP3wosM,man woman makeup jabardasth ydtv beauty,forget subscribe follow channel jabardasth deevena jabardasth yd tv jabardasth ydtv vegfood jabardasth ydtv beauty jabardasth yodha world connect jabardasth yd tv team social media please like facebook page httpswwwfacebookcomjabardasthydtvteam follow us httpswwwinstagramcomjabardasthydtvteam jabardasthydtv jabardasthydtvvegfood jabardasthydtvbeauty jabardasthdeevena jabardasthyodha deevena yodha patasanan yodhaakka yodhachildartist jabardasthdeevenateam jabardasthdeevenaofficial jabardasthyodhaworld dear girls boys click bell icon near subscribe button mobile app desktop get instant notification upcoming videos channel jabardasth ydtv beauty category beauty fashion language telugu brand partnerships promotions collaborations business enquiries reach us digistepegmailcom copyright make mistake find copyrightprotected material videos please let us know rather submit copyright takedown notice dont intentionally plan include copyrightprotected material video sometimes happen mistake please notify us remove content immediately channel manager naga contact digistepegmailcom power digistepe,People & Blogs,Fashion,"Man To Woman - Makeup Transformation Boy To Beauty Queen,makeup,Man To Woman,boy to girl,beauty,makeup tutorial,Makeup Transformation,Makeup Transformation Boy To Beauty Queen,beauty queen,Queen makeup,Drag queen,Bridal makeup,Miss fame,brides boy,power of makeup,makeover,makeup boy,boy to girl full body,ఇండియన్ Man to Woman Makeup..,drag queen,makeup transformation,Jabardasth ydtv Beauty,ydtv Beauty,Beauty"
Bj9vBXhJR38,work home beauty routine use kkw beauty,walk stepbystep quick natural makeup routine stay home unexpected cameo north use kkw beauty essentials liquid concealer shade bake powder shade crème contour highlight set medium powder contour highlight palette medium classic shimmer blush palette mascara nude lip liner icon matte lipstick brighten powder shade,People & Blogs,Fashion,"makeup,tutorial,get ready with me,Kim Kardashian,kkw beauty,contour,kkw,Kim Kardashian west,keeping up with the kardashians,kuwtk,Kendall jenner,Kylie jenner,Khloe kardashian,Kourtney kardashian,kris jenner,Kanye west,north west,beauty,beauty tutorial,makeup tips"
f7WlYv2E5IQ,classy hm haul summer part classy fashion,sign weekly newsletter classy hm haul summer second part hm summer haul bits show along alternative outfit inspiration ways wear piece items show earrings dupe top wear us top wear uk bag background ava croco bag background kim stampatto uk white trousers us white trousers basket bag uk basket bag us uk polka dot dress short trench coat pleat skirt beige shirt straw bag stripe shirt hm white short wedge black flats nude heel similar nude heel similar navy print skirt silk shirt wear pleat skirt cream blazer uk thumbnail cream blazer us thumbnail gold chain thumbnail shoe thumbnail white jeans uk shopper bag uk bracelet thumbnail us polka dot dress short trench coat pleat skirt beige shirt straw bag stripe shirt white short wedge black flats nude heel similar nude heel similar navy print skirt silk shirt wear pleat skirt shopper us white jeans us shoe thumbnail bracelet thumbnail photo credit extrapetitecom katieconsiderscom thepinkscarfgirlcom watch videos youtube channel designer look elegant jeans haul try women youtube tool get tubebuddy httpswwwtubebuddycomwhattowearblogg camera hard drive light find social facebook httpswwwfacebookcomwhattowearblogg twitter httpstwittercomwhattowearblogg instagram httpswwwinstagramcomwhattowearblogg disclaimer description contain affiliate link allow find items mention video support channel cost channel may earn small commission viewer use link viewer way obligate use link thank support elegantfashion classyfashionforwomen elegantwomen,People & Blogs,Fashion,
GiYK0ZJsRok,last minute fix easy fashion hack party fashionistas like,hey fashionistas feel trendy ever fashion emergencies get great quick fixit tip save day dignity improve look learn upgrade clothe transform old outfit new learn fix tear damage clothe plus many diy fashion tip trick create new accessories stylish cut out stand line spend money diy clothe hack dont forget give thumb subscribe youtube page go like see soon hack diy fashion music epidemic sound httpswwwepidemicsoundcom stock materials httpswwwdepositphotoscom httpswwwshutterstockcom,People & Blogs,Fashion,"DIY,hacks,tricks,craft,crafts,prank,pranks,123 go,123 go like,123GO!,tutorial,how to,know how,fashion,girly hacks,party hacks,party,clothes hacks,reuse clothes,reuse old clothes,diy clothes hacks,upgrade,reuse,recycle,outfit,new outfit,party dress,halloween costume,halloween DIY,superhero costume,clothes diy ideas,fashion hacks,fashion ideas,style ideas,fix it,last minute fix"
wjaIRPAxGgA,cool girly beauty hack smart diy beauty hack girls,kinds life hack us ladies whole mess girly hack serve us way better whether makeup trick fashion shortcuts diy haircare us girls use help possible sure share hack friends subscribe youtube page helpful videos like one catch ya later girly diy makeup music epidemic sound httpswwwepidemicsoundcom stock materials httpswwwdepositphotoscom httpswwwshutterstockcom,People & Blogs,Fashion,"DIY,craft,crafts,prank,pranks,challenge,challenges,fun,funny,123GO!,123 go,123go,friends,friendly,tutorial,howto,how to"
gtrjierqnnU,kk children vietnam asian kid fashion week,kk children vietnam asian kid fashion week,People & Blogs,Fashion,
0X2juZWOLYk,genius beauty recipes look gorgeous,trendy beauty tip actually work treat dark armpits remove blackheads clog pore youll know whiten teeth make face mask clean skin clean clog pore homemade natural remedy charcoal recipes extremely popular reason charcoal lot benefit skin body hair check collection jawdropping recipes spend lot money products store whiten teeth use charcoal powder whiten teeth instead mix charcoal powder water teeth toothbrush watch result embarrass moment display dark armpits yoga workout us stop wear sleeveless top ready help diy remedy make activate charcoal honey bowl mix honey charcoal powder exfoliate underarms armpits look amaze use aloe vera gel rise petals yogurt prepare perfect mask dry skin cellulite real disaster ready share treatment help reduce visibility cellulite bowl mix coconut oil aloe vera gel beat use mixer apply mixture daily shower rub cream cellulite affect areas prefer deodorants natural ingredients go love next recipe bowl mix olive oil vegetable glycerin aloe vera gel bake soda stir mixture warm refrigerate use stain teeth longterm black tea coffee consumption use charcoal powder whiten teeth mix charcoal powder water teeth toothbrush repeat days teeth look perfect besides save ton money find shock lifehack change life change hair color blond girl change color become brunette try recipe hair dye mix aloe vera gel charcoal flaxseed hot water apply mixture wear shower cap wait two hours enjoy result popular mask make charcoal mask blackheads mask make two ingredients charcoal powder pva glue try incredible recipe skin clear next recipe totally amaze make charcoal bath bomb bowl mix bake soda charcoal powder citric acid aroma oil form bomb use mold bomb look cool also rejuvenate skin exfoliate perfect recipe skin inflammation antibacterial soap absorb toxins need castile soap chamomile oil charcoal dont forget subscribe click timestamps dark armpit homemade treatment whiten teeth activate charcoal use aloe vera beauty recipes hair mask charcoal face mask get rid blackheads pimples clean black face mask reduce dandruff natural cosmetic homemade face treatment makeup hack social media craft youtube facebook instagram twitter subscribe decor subscribe craft girly httpsgooglfwbjqz subscribe craft kid httpsgooglpeulvt subscribe craft men bright side youtube httpsgooglrqtjzz videos article visit httpwwwbrightsideme music epidemic sound httpswwwepidemicsoundcom video make entertainment purpose make warranties completeness safety reliability action take upon information video strictly risk liable damage losses viewers responsibility use judgment care precautions one plan replicate follow video might feature activity perform actors within control environment please use judgment care precaution plan replicate,People & Blogs,Fashion,"5-minute recipes,kitchen hacks,cooking tips,kitchen tips,kitchen lifehacks,recipes,easy recipes,delicious recipes,how to cook,food hacks,kitchen crafts,dinner,best recipes,easy food to make at home,quick recipes,how to make,recetas,cooking hacks,5 min,life hack,funny,trick,makeup,beauty,beauty hack,girl,face clean,face mask,face cream,whiten teeth,whiten,hair mask,scrub,armpit,natural beauty,natural cosmetics,makeup hack,charcoal,black mask"
