video_id,title,description,category,sub_category,tags
XaQAltAvaZE,make india smartphone possible atmanirbhar,atmanirbhar bharat campaign let talk reality make india smartphones find even possible make complete smartphone india watch video till end many amaze facts information need know buy make india smartphone smartphone india madeinindia makeinindia watch video best deal amazon best flipkart deal follow place update twitter httpstwittercomutsavtechie instagram httpswwwinstagramcomutsavtechie find loststolen phone android huawei honor apple glass future miui global best feature update list best sell android smartphones xiaomi vs apple dont expect another poco big problem oneplus pro camera last video httpsyoutubemppctlzygy business email contactutsavtechieenlyftin,Science & Technology,Smartphones,"made in india,make in india,smartphones,indian smartphones,made in india smartphone,make in india smartphone,indian smartphone,india,china phone,india phone,Chinese Electronics,Made in India Phone,Chinese Ban,Made in Chinese,Chinese Goods,Fabrication,Chips,Chip manufacturing,Make in India,policy,manufacturing,plan,assembling,assembly,plant,factory,China,Xiaomi,Samsung,Poco,Pocophone,made in India,Realme,OPPO,Vivo,atmanirbhar bharat,local products"
Xi1hXLYyLAg,kind computer buy get information technology,kind computer buy get go college video give personal opinion know shop computers extremely tech orient release spec relate video future feel free leave comment remember opinion equipment use video followsaffiliate link sony camera google pixelside camera httpsstoregooglecomusproductpixelphonehlenus zoom digital recorder giant squid microphone flexispot sit stand desk frequently ask question please see playlist thank visit youtube channel facebook httpswwwfacebookcompcsimplest twitter httpstwittercompcsimplest website httpwwwitcareerquestionscom resume httpwwwzachhillnet information systems httpwwwinformationsystemsnet,Science & Technology,Information Technology,"information technology,i.t.,i.t. career questions,tech careers,tech questions,what kind of computer should you buy getting into information technology,computer,what kind of computer,macbook,2017 macbook,macbook pro,2017 macbook pro,pc,dell,lenovo,hp,new computer,laptop,desktop,ssd,ram,gaming computer,windows 10,osx,best computer,best computer to buy"
XsuZSlx-Y14,mp dslr camera smartphones top beautiful upcoming smartphones,mp dslr camera smartphones top beautiful upcoming smartphones upcoming mobiles india upcoming mobiles india upcoming mobiles new smartphones come soon upcoming mobiles india upcoming android phone new mobile launch new mobile phone price stream thefatrat xenogenesis platforms httpslnktothefatratxenogenesis follow thefatrat free music httpswwwyoutubecomthefatrat,Science & Technology,Smartphones,"243+108+64+48 MP DSLR Camera Smartphones,Top 5 Beautiful Upcoming Smartphones,top 5 upcoming mobiles in april 2020,best flagship phones 2020,upcoming mobiles in april 2020,best flagship mobiles 2020,upcoming phones in april 2020,upcoming smartphones in april 2020,upcoming mobiles in april 2020 india,best flagship smartphones 2020,best flagship phones 2020 india,best flagship killer phones 2020,best upcoming flagship phones 2020,upcoming flagship smartphones 2020"
XuuOUWCqDeY,whats difference astronomer astrophysicist,like content please consider become patron httpsdeepastronomycomdeepastronomy ever wonder difference astronomer astrophysicist youre alone get question time ill answer todays deep astronomy vlog post follow deepastronomy twitter deepastronomy like deepastronomy facebook httpswwwfacebookcomdeepastronomy like space fan news facebook httpswwwfacebookcomspacefannews,Science & Technology,Astronomy,"deep astronomy vlog,astronomy,space,cosmology,astronomy vlog,astronomy education,astronomy career,astronomy job,astrophysics major,studying astrophysics,astronomy major,astronomy career info,astronomy career in india,physics major,astronomy blog,physics research,astronomer astrophysicist difference,becoming an astronomer,astronomer,astrophysicist"
XvzNuw5VjBU,artificial intelligence change world better worse,science fiction dream critical part everyday live artificial intelligence everywhere probably dont see ai work thats design ai change everything want dtvideoembed last decade artificial intelligence go science fiction dream critical part everyday live use ai systems interact phone siri alexa cars like teslas interpret analyze surround intelligently drive amazon monitor browse habit intelligently serve us products think like buy even google decide kinds search result give us base think artificially intelligent algorithms already change live better worse begin one day look back ai laugh primitive future ai go everything want well exactly ai maybe better question might exactly intelligence simplest descriptor collect data world use data make predictions short long term apply people machine talk ai live talk everything computer able read handwritten document like ocr reader robot perform complex surgery massive database categorize personality base write look online world ai incredibly large let take look groundbreaking developments expect see near future whether step forward backward society first foremost ai systems already prim take thousands millions job job consist human take information humans inputting system likely go obsolete cashier receptionists telemarketers bank tellers way selfdriving cars selfoperating drone conveyors atob get complex also lose job like truck drivers postal workers courier service even pizza delivery factories also become fully automate car wash movie theaters even job journalist threaten rapidly improve news algorithms gather information deliver faster accurately develop better ai discover replace human labor also think ways humans algorithms monitor process massive amount data make conclusions base pattern data poise change every avenue society start something small like optimize traffic pattern time figure best rout take fix roads rebuild highways something much serious like monitor epidemics disease stop spread machine learn even show analyze human behavior predict warn sign recognize common language use people like sexual predators terrorists alert law enforcement take action technology use track political dissidents serve fake news vulnerable people block compete opinions information study develop artificial intelligence clearer become massively powerful tool come great deal responsibility futurists try plan rapidly change advance world biggest hurdle technological economic political tech monopolies control latest breakthroughs data collect process analyze may hope ai help advance society may end work benefit tech industry afford take advantage cheaper smarter human replacements maybe detriment society know future hold subscribe latest videos httpbitlydtyoutubesub visit digital trend httpswwwdigitaltrendscom dt series behind wheel awesome tech cant buy yet innovators connect crib follow us httpswwwfacebookcomdigitaltrends httpstwittercomdigitaltrends httpswwwinstagramcomdigitaltrends httpsplusgooglecomdigitaltrendsposts,Science & Technology,Artificial Intelligence,"artificial intelligence,machine learning,artificial intelligence robot,artificial intelligence documentary,future of ai,future of artificial intelligence,future of artificial intelligence and its impact on society,ai,artificial intelligence explained,digital trends,tech,news,reviews,Ai workforce,jobs,automation,tech news,digital trends 2018,digital trends 2019,alexa,siri,amazon,apple,google assistant,self driving cars,AI 2019,2019"
Y4hV_OksQM8,amd laptops,asus rog zephyrus one best around game laptops period right truly unique interest tech podcast really enjoyahem httpswwwrelayfmtestdrivers buy worst new pc second channel httpwwwyoutubecomthisis subscribe httpwwwyoutubecomaustinevans instagram httpinstagramcomaustinnotduncan twitter httptwittercomaustinnotduncan,Science & Technology,Laptops & Desktops,"amd,asus,rog,ryzen,laptop,gaming laptop,zephyrus,zephyrus g14,g14,rog zephyrus g14,ryzen mobile,ryzen 4000,ryzen mobile 4000,ryzen 4000 mobile,notebook,rtx,nvidia,intel,gaming,tech,review,teardown,benchmark,gameplay,the test drivers,test drivers,this is,austin evans"
Y8288eEEsmc,aruba rise iot healthcare,rise iot healthcare potentially lifesaving applications collect data bedside devices view patient information diagnose realtime iot healthcare improve patients experience providers roi,Science & Technology,IOT,"IoT,Network Security,Wirless Networking,WLAN,WiFi,IoT Devices,Internet of Things,healthcare,Aruba IoT,Aruba Healthcare,Aruba Healthare Solutions,Healthcare Solutions,Patient Care Solutions,Healthcare Wifi,Hospital Mobile Device"
YItUGypX28k,game laptops worth,game laptops offer portability cost buy laptop desktop pc centric share insight amazon affiliate link us uk ca subscribe pc centric biweekly pc game tech videos follow pccentric twitter httpstwittercompccentric like pc centric facebook httpswwwfacebookcompccentric add pc centric instagram httpsinstagramcompccentric add pccentric snapchat join pc centric steam community httpsteamcommunitycomgroupspccentric massive thank asus rog sponsor channel acer loan laptops intro music httpssoundcloudcomlakeyinspiredwarmnights review ethics httpswwwyoutubecomwatchvnfzduswuqzo image use video use good spirit believe fair use feel example work wrongly publish please contact pccentricgmailcom pc centric participant amazon eu associate programme amazon service llc associate amazon ca associate affiliate advertise program design provide mean sit earn advertise fee advertise link amazoncouk amazoncom amazonca,Science & Technology,Laptops & Desktops,"pccentric,Are Gaming Laptops Worth It?,pc gaming,personal computers,laptops or desktop,personal computer,pc centric,gaming pc,ultimate gaming pc,gaming laptop,gaming notebook,laptop or desktop,desktop or laptop,gaming computer,gaming,laptops worth it,are laptops worth it?,should you buy a gaming pc,should you buy a gaming laptop,laptop gaming setup,laptop gaming,acer predator 17,predator 17,predator 21x,acer 21x,acer predator 17x"
YMAFN6PZRrw,top ways kill career information technology zach hill,top ways kill career opinion possibly destroy career base experience work field pretty accurate watch video learn ways avoid kill career equipment use video followsaffiliate link sony camera sony camera google pixel xlside camera httpsstoregooglecomusproductpixelphonehlenus zoom digital recorder giant squid microphone flexispot sit stand desk frequently ask question please see playlist thank visit youtube channel facebook httpswwwfacebookcompcsimplest twitter httpstwittercompcsimplest website httpwwwitcareerquestionscom resume httpwwwzachhillnet information systems httpwwwinformationsystemsnet,Science & Technology,Information Technology,"information technology,i.t.,i.t. career questions,tech careers,tech questions,top 5 ways to kill your i.t. career,top 5 list,top 5 i.t. list,top 5 i.t. job list,career,job interview,interview questions,it jobs,information technology careers,it job,it career,what is information technology,i.t. career donts,dont do this,kill your job,job killers"
YOjC-vtH3tI,astronomy phd research swinburne university technology,phd student andy green discuss experience swinburne student research extra galactic astronomy httpwwwresearchswinburneeduau,Science & Technology,Astronomy,"Swinburne,University,Melbourne,PhD,Extra,Galactic,Astronomy,spiral,galaxies,galaxy,research,uni,study,student,technology,course,science"
YSyRzJVd364,genomics sequence fight disease artificial intelligence intel,bryce olson diagnose advance prostate cancer sequence dna tumor open doors new treatment options disease bryce explain genomic cancer patients tell doctor sequence learn httpsintelcomhealthcare intel intel world leader silicon innovation develop technologies products initiatives continually advance people work live found build semiconductor memory products intel introduce worlds first microprocessor decade mission create extend compute technology connect enrich live every person earth connect intel visit intel website like intel facebook follow intel twitter follow intel instagram genomics sequence fight disease artificial intelligence intel httpswwwyoutubecomuserchannelintel,Science & Technology,Artificial Intelligence,"Austin,Intel,Jim Parsons,Internet of Things,iot,Intel edison,computer,video,company,innovation,computer hardware,official,channel,tech,technology,mobile,semiconductor,processors,blutetooth,flash memory,microprocessors,interface cards,PC,Commercial,TV,X Games,Snowboarding,Inside Intel,Genomics Sequencing,Artificial Intelligence,Fighting Disease,Bryce Olson,advanced prostate cancer,DNA,tumor,Bryce,Sequence Me,cancer patients,cancer treatment"
ZFu5gpGEYj0,iot cloud industrial applications google cloud next,video indranil chakraborty willem sundblad edwin poot giby raphael explain use iot cloud pubsub dataflow biqquery cloud machine learn solve business need utilities manufacture segment google cloud customers verticals showcase theyre use google cloud products transform industries miss conference watch talk watch talk big data machine learn,Science & Technology,IOT,"IoT,Cloud Pub/Sub,Dataflow,Biqquery,Cloud Machine Learning,business,utilities,manufacturing,Cloud NEXT,Google Cloud,GCP,Cloud,#GoogleNext17"
ZIDti1H1UgY,applications industrial iot industrial,welcome industrial power internet things iot technology technology bring disruption many industries make operations efficient well safe endtoend iot solutions provider deliver box iot solutions help businesses reap benefit cut edge technology click demo iot product know help business obtain operational efficiencies dashboard demo applications industrial iot hospitality guestroom automation room service improvements smart maintenance mine plant automation equipment check predictive maintenance asset track oil gas oil tank monitor pipeline leakage detection oil well monitor transportation fright monitor fleet monitor optimum route management healthcare child health monitor smart wearables realtime health monitor water water quality monitor water body level monitor water distribution management visit website,Science & Technology,IOT,"Application industrial IoT,Industrial IoT,Industrial 4.0,Industrial Internet of things,benefits of industrial IoT,IIOT,IoT in transportation,IoT in oil and gas,IoT in water,IoT in hospitality,IoT in healthcare,IoT in mining,IoT in agriculture"
ZPmgZ0bVinM,best one desktops,acer aspire hp envy lenovo yoga apple imac microsoft studio surface traditional desktop often cater specific users partially customizable allinones usually good overall performers days many allinones become specialize different user need video compare best allinone desktops design different kinds users take account performance feature price decide best products list select base inherent strengths feature compare acer aspire hp envy lenovo yoga apple imac microsoft surface studio great options market allinone desktop break allinone desktop best expect get return money help decide one model list seem like great purchase disclaimer portion footage find video original content produce best portion stock footage products gather multiple source include manufacture fellow creators various source something belong want remove please hesitate contact us thefivebestmanagementatgmailcom company pay part list receive sponsorship money creation video link provide affiliate link earn qualify purchase,Science & Technology,Laptops & Desktops,"Top 5,5 Best,best all in one desktop,best all in one desktop 2020,best all in one computer,best all in one computer 2020,all in one desktop,all in one computer,best all in one computer under 500,best all in one computer under 1000,all in one desktop computer,best all-in-one computer,best all in one pc,best all in one computer for gaming,all in one pc,all in one gaming pc"
ZQXvoFvXiXc,laptops engineer students need know best,need engineer laptop students find best engineer laptops buy click description link hp spectre amazon us amazon uk amazon ca microsoft suface pro amazon us amazon uk amazon ca dell amazon us amazon uk amazon ca dell xps amazon us amazon uk amazon ca asus vivobook amazon us amazon uk amazon ca luigis product review support audience may earn affiliate commission successfully purchase doesnt affect review always make sure research well gather multiple opinions dont hesitate comment question il answer soon possible make good laptop engineer student guy work hard university get best grade learn everything get next level succesfuly need fully function laptop student scholar want something fast snappy efficient lightweight importantly want good batterylife dont worry charger time engineer program usually use lot process lot ram main components look cpu ram generally would recommend need many core possible good option ramwise need around minimum preferably around gbs important investment make student gon na main tool engineer want last long time serve finish study land job order achieve cant go cheap engineer laptop happen go cheap end push pc components max time wear laptop pretty fast thats generally need invest good amount money good laptop way laptop last much longer meantime futureproof see fast technology evolve engineer program always evolve dont get something fast regret years time dedicate graphics card definitely helpful engineer software program take advantage process however generally requirement definitely good futureproofing make sure enjoy play game love give options best laptops possible engineer students number asus vivobook laptop laptop best budget laptop student number dell xps legendary laptop well concern one best laptops build year cant go wrong place dell laptop option give highest performance price ratio best option game enthusiasts place microsoft surface pro amaze laptop microsoft definitely good engineer students finally place hp spectre laptop many amaze feature amaze stylus pen extremely accurate useful engineer type whether mechanical chemical civil electrical management geotechnical software architectural engineer gon na good options still confuse check httpsluigisproductreviewscombestlaptopsforengineering disclaimer footage use video own owner footage would like footage remove contact luigisproductreviewsatgmailcom make sure check channel get footage jarrodstech jon rettinger mikenstein dont forget support music creators stomp clap beatbox anita latina le gang httpssoundcloudcomthisislegang free download stream httpsbitlyanitalatina music promote audio library wait inossi httpssoundcloudcominossi free download stream httpbitlywaitforyou music promote audio library kira new world ncs release music provide nocopyrightsounds watch funk city reatch yusuf aleve yoros debris jonth game time,Science & Technology,Laptops & Desktops,"Engineering laptop,best engineering laptops,best engineering laptop,engineering laptop for students,engineering laptop for scholars,engineering best laptop,what is the best laptop for engineering,what laptop is the best for engineering,student laptop,university laptop,engineer laptop"
ZgOVCh_cYnk,guy learn build robots without formal train,patrick mccabe always like build things stumble upon website give stepbystep instructions build electronics become instant robotmaking junkie utilize websites like instructablescom letsmakerobotscom able hone skills lead snag spot dream school mit,Science & Technology,Robotics,"self taught,patrick mccabe,mit,space x,elon musk,rockets,building robots online,robotics,robots,letsmakerobots,lets make robots,letsmakerobots.com,instructables,how to,instructables.com,how to make robots,internet,learning,education,webucation,internet learning,autodidact"
ZsgFqE4cV38,future ai evolution language information technology,evolution language information technology elit bring stateoftheart natural language process nlp machine learn technology research community primary focus project provide endtoend nlp pipeline scalable big data analysis use rich resources cloud unlike nlp frameworks elit support web apis make platform independent researchers enjoy large scale compute anytime anywhere elit develop emory natural language process research group active collaboration amazon mxnet team learn httpselitcloud catch excitement reinvent aws launchpad feature launch announcements demo newly launch technology interview expert guests live qa aws reinvent tech education conference global cloud compute community host amazon web service see record aws launchpad reinvent learn aws live stream httpsawsamazoncomtwitch,Science & Technology,Information Technology,"AWS,Amazon Web Services,Cloud,cloud computing,AWS Cloud"
_ECEdXuFjB8,bite bachelor information technology sinhala tutorial,video contain bite bachelor information technology external degree programme conduct university colombo university moratuwa bite universityofcolombo universityofmoratuwa external degree audio credit background music rain jayjen music enine httpssoundcloudcomjayjenmusic creative commons attribution unported cc free download stream music promote audio library intro audio track tonyz road far ncn release youtube httpsyoutubemvmiwijtmdu streamfree download httpsncnlnktoroadsofar photo bruce mar pexels,Science & Technology,Information Technology,"Bachelor of Information Technology,Degree,Voice Record,Ranjan,NSBM,IIT,Database,Hirunika,Iraj,Software Engineering,After Alevel,Tissa,TechHCD,wasthi,Higher Diploma,Information Technology,ratta,BIT,Web development,Network Engineering,Call Record,IT,Emoney,Dilina Dakshila,Education,Diploma,Bachelor of IT,University of Colombo,External Degree,SLIIT,University of Moratuwa,bachelor's degree,university,information technology,Corona,sri lanka zimbabwe match,external"
_GhHpACoLB8,internet things iot applications mikrotik devices,internet things iot applications mikrotik devices ratchanon piemjaiswang data motion thailand introduction use mikrotik devices iot application pdf,Science & Technology,IOT,"mikrotik,routerboard,routeros,latvia"
_h9BgyGv4Mc,artificial intelligence automation,artificial intelligence ai commonly know automation weeks discussion point soe visit quite number factories innovation tour shenzhen definitely noticeable trend towards automation manufacture businesses others tour group discuss implications along others try make sense automation new world luddites smash cotten gin early inventions combine harvester robotics car manufacture cnc sort machine etc bring change labour force however recent improvements ai machine learn neural network particularly desire implement make possible manufacturers remove human component process arent obvious repetitive type process job many roles previously think safe automationai like legal researchers medical staff even programmingdesign roles many tour group real concern job career even humans ultimately discussion much result tour newly learn knowledge possible manufacture specifically today hytera ems visit website httpwwwhyteraemscom hlh prototypes visit httpwwwhlhprototypescom information kaier wo visit httpwwwprototypeinchinacom lifx visit httpswwwlifxcom hardworx visit httpswwwhardworxio series visit httpswwwstateofelectronicscom jon oxer visit httpswwwsuperhousetv tom partridge visit httpswwwtectonicanet dont forget like share contribute channel support much need keep go note comment policy please understand video neither condone comment reputation labour practice standards particular relate safety intend educational purpose allow viewer participate tour company kindly open doors us allow us come see free open manner state electronics respect ask well video sponsorship influence company highlight comment make participants result personal tour personal opinions witness understand however state electronics understand viewers concern standards please post comment relate opinions safety labour practice video vary greatly country country subsequently delete express view video use footage put name make count thank understand,Science & Technology,Artificial Intelligence,"State of Electronics,Karl von Moller,Andy Gelme,Jon Oxer,Manufacturing,Prototyping,Shenzhen,China,Factory,Tour,Vela Georgiev,Simon Holmes a Court,Noor Magesh,Tom Partridge,Liam Brennan,Kemal Ajay,Sarah Last,Brian Gilbert,Hardworx,Robots,Automation,Gen four factory,Industry 4.0,Hytera EMS,AI,Artificial Intelligence,Jobs,Machine Learning,Neural Networks,gen5 factory,Angus Gratton,factory in a box"
_sBBaNYex3E,parkour atlas,atlas use whole body legs arm torso perform sequence dynamic maneuver form gymnastic routine create maneuver use new techniques streamline development process first optimization algorithm transform highlevel descriptions maneuver dynamicallyfeasible reference motion atlas track motion use model predictive controller smoothly blend one maneuver next use approach develop routine significantly faster previous atlas routines performance success rate information visit us httpswwwbostondynamicscom,Science & Technology,Robotics,"Boston Dynamics,Robot,legged locomotion,parkour,gymnastics,Atlas Robot,Athletic AI"
