video_id,title,description,category,sub_category,tags
-I2qNEgbjZM,top best student laptops,use code toptechnow worlds versatile comfortable desk httpscomfydeskstorecom macbook air best value macbook price price price chromebook flip best chromebook price price price aspire slim laptop great budget laptop students price price price surface pro great windows laptop price price price xps best overall laptop students price price price today students need wellfunctioning laptop school task video compare laptops design different kinds students take build quality feature display quality account price well decide best products list choose due inherent strengths feature compare apple macbook air asus chromebook flip acer aspire slim microsoft surface pro dell xps great options market great school laptop break laptop best certain kind student expect get return money help decide one items list seem like great purchase disclaimer portion footage find video original content produce top tech portion stock footage products gather multiple source include manufacture fellow creators various source visual reference thoughts opinions express video unique top tech issue content something belong want remove please hesitate contact us toptechnowbusinessatgmailcom top tech participant amazon service llc associate program amazon associate earn qualify purchasesthis video also contain affiliate link earn amazon associate qualify purchase video sponsor comfydesk,Science & Technology,Laptops & Desktops,"best laptop for students,best laptop for students 2020,laptop for students,best laptop for college,best laptop for college 2020,laptop for college,best laptop for college students,laptop for college students,best laptop for college students 2020,best value macbook,best 2 in 1,best chromebook,best 2 in 1 chromebook,best windows 2 in 1,best affordable laptop,good laptops for college,best value laptop"
-J3rh3YbwiQ,information technology good career get hire,guy know feel recently ask though think worth people seem problems get hire let talk little bite thank visit youtube channel please find see place find see subscribe httpwwwyoutubecomuserpcsimplest facebok httpswwwfacebookcompcsimplest twitter httpstwittercompcsimplest google plus website httpwwwitcareerquestionscom resume httpwwwzachhillnet,Science & Technology,Information Technology,"Technology,Tutorials,i.t.,career,questions,pcsimplest,is i.t. worth it,i.t. jobs,getting hired in i.t.,information technology,i.t. job choices,i.t. career questions,trouble getting hired,i can't get hired,help me get hired,help me get a job,job help,i.t. job help,information technology job help,information technology career,tech careers,information technology career questions,highest paying jobs,it questions,it careers,information technology careers"
-tsPuHaHFDw,abb robotics engineer lego transform future,take eight months build use spare time fully programmable near lifesize abb robot make lego bricks spectacular thing behold yes age limit attention span viralitydriven media perhaps cool enough near lifesize industrial robot recreate lego bricks theres much behind story would sad stop particular clear mismatch skills currently exist workforce skills need robotics tech heavy world future better way get kid young adults interest science technology engineer math stem programmable lego come along join us explore story,Science & Technology,Robotics,"LEGO (Interest),Robot,Robotics (Industry),ABB Ltd (Business Operation),Engineering (Industry),Electronics,Math,Technology (Industry),Manufacturing (Industry),Gadget"
02Lt0xKXM8U,power industry artificial intelligence,bring nextgen manufacture achieve effort save tech mahindra ai base automation learn reduce machine failure improve quality control increase productivity lower cost artificial intelligence create new opportunities manufacture detail httpswwwtechmahindracomautomationaqthtml,Science & Technology,Artificial Intelligence,"Tech Mahindra,Automation,Industry 4.0,Manufacturing,AI,Artificial Intelligence"
0BxVPCInS3M,program robotics ros course,slide available record course part program robotics ros lecture eth zurich httpwwwrslethzcheducationstudentslecturesroshtml lecturers péter fankhauser dominic jud martin wermelinger course cover follow topics ros architecture philosophy ros master nod topics console command catkin workspace build system launchfiles gazebo simulator course course give introduction robot operate system ros include many available tool commonly use robotics help different examples course provide good start point students work robots learn create software include simulation interface sensors actuators integrate control algorithms objective ros architecture master nod topics message service parameters action console command navigate analyze ros system catkin workspace create ros package structure launchfiles best practice ros c client library roscpp create ros c program simulate ros gazebo simulator robot model urdf simulation environments sdf work visualizations rviz user interface tool rqt inside ros tf transformation system time bag,Science & Technology,Robotics,"Programming,Robots,ROS,Robot Operating System,ETH,Zurich,C++,master,roscore,rosnode,node,topic,catkin,launch,launch file,Gazebo,simulator,tutorial"
0MfJ3VmoqvE,health information technology,health information technology health become top priority us use technology electronically use exchange health information securely healthcare stakeholders improve overall quality safety efficiency health care delivery standards interoperability key nist conduct research help enable health network correct complete secure usable testable,Science & Technology,Information Technology,"NIST,information technology,healthcare,health IT,healthcare network,computer technology,interoperability,standards,health,hospitals,health records,EHRs,medical records,security,usability,certification"
0XD7TDEr0yU,futuristic inventions freak awesome,get ready dive another amaze episode futuristic gadgets modern innovation youll find latest installment include smallest smart camera awesome structure sensor highly anticipate new smart tech inventions need see enjoy video learn even awesome new futuristic inventions visit websites official websites luna httplunacamera innovative new smart camera super small size also ultra durable oh chalk full cut edge technology structure sensor httpstructureio revolutionary new ipad accessory allow yo scan object surround excellent game development work relate frameworking knocki httpknockicom incredibly clever smart device let control functionality electronics simple tap knocki gobone httpsmygobonecom ultimate futuristic dog toy boneshaped smart toy keep fourlegged friend active engage home away iscout httpwwwspadetechscom dashboard mount smart display allow access map music text whole lot without distract drive also excite blindspot feature new huds subscribe future feature latest futuristic inventions cool gadgets awesome technological advancements may may already hear thank watch next time look future price feature video reflective date publish,Science & Technology,Futuristic Technology,"futuristic technology,new inventions,futuristic gadgets,must have tech,must see inventions,modern innovations,things you never knew existed,smart tech products,smart 360 camera,3d structure sensor,smart surface tap,futuristic dog toy,interactive dog bone,smart pet toy,car HUD,car smart display,crowdfunding tech projects,successful kickstarter tech,tech devices available now,knock activated,smallest 360 camera,awesome technology,amazing innovations"
0b87mZb-Hg0,biggest mysteries astronomy,black hole dark energy dark matter alien life biggest mysteries still exist us figure support us httpwwwpatreoncomuniversetoday stories httpwwwuniversetodaycom follow us twitter universetoday follow us tumblr httpuniversetodaytumblrcom like us facebook httpswwwfacebookcomuniversetoday google httpsplusgooglecomuniversetoday instagram httpinstagramcomuniversetoday team fraser cain fcain jason harmer jasoncharmer susie murph susiemmurph brian koberlein briankoberlein chad weber weberchadgmailcom kevin gill kevinmgill create fraser cain jason harmer edit chad weber music leave spine xray learn realize much dont know word albert einstein assume talk minecraft guess apply universe many examples astronomers try discover rate expansion universe learn dark energy accelerate expansion nasa cassini spacecraft finally image saturn moon iapetus find strange equatorial ridge heck get celestials forget trim come package always let go far say always mysteries astronomy although nature mysteries may change total number always go hundreds years ago people want know planets move sky conservation angular momentum old earth billion years keep moon fly space gravity century ago astronomers sure galaxies islands star sun generate energy nuclear fusion decades ago know cause quasars feed supermassive black hole old universe billion years mysteries solve least get pretty good understand go science continue explore seek answer mysteries open new brand doors fortunately anyone think go astronomy career handful really compel mysteries explore right universe finite infinite see light leave shortly big bang billion years directions expansion universe carry regions billion lightyears away us universe probably much larger may even infinite dark matter thank gravitational lensing astronomers perceive vast halos invisible material around galaxies stuff interact matter dark energy try discover expansion rate universe astronomers discover expansion actually accelerate happen something cause force understand gravity largest scale supermassive black hole heart pretty much every galaxy supermassive black hole form first galaxies around way around big bang occur billion years ago expansion universe continue ever since come big bang fact even cause big bang big bang alone universe life world star system anyone could talk shortly big bang incomprehensible amount matter antimatter annihilate reason slightly higher ratio matter matter dominate universe universe multiverse universes get whedonverse,Science & Technology,Astronomy,"universe today,fraser cain,Astronomy (Field Of Study),Dark Matter,Dark Energy,Black holes,alien life,guide to space,astronomy,astronomy mysteries,astronomy mystery,what are the biggest mysteries in astronomy,alien,energy,astronomical mysteries,nasa,galaxy,science mysteries,biggest mysteries in astronomy,greatest astronomical mysteries,big bang,star,cosmos,solar system,gravity,antimatter,black hole,white holes,multiverse"
0kGEsnack68,start discover roadmap information technology,todays video talk start youre look get discover path roadmap submit ama question httpswwwitcareerquestionscomaskmeanything comptia roadmap link httpscertificationcomptiaorgdocsdefaultsourcedownloadablefilesitcertificationroadmappdf pluralsight train platform httpbitlyitcqpluralsight product certification book recommendationsaffiliate link httpswwwamazoncomshopitcareerquestions top recommendations comptia net guide troubleshoot affiliate link comptia allinone exam affiliate link mcsa server study guide affiliate link mcsa sql study guide affiliate link mta os fundamentals affiliate link ccent official cert guide affiliate link ccna rout switch affiliate link career questionszach talk tech merchandise httpsteespringcomstoresitcareerquestions equipment use video followsaffiliate link sony camera sony camera google pixel xlback camera httpsstoregooglecomusproductpixelphonehlenus zoom digital recorder giant squid microphone flexispot sit stand desk nanoleaf lead light thank visit youtube channel facebook httpswwwfacebookcomitcareerquestions twitter httpstwittercomtalktechdaily instagram httpswwwinstagramcomitcareerquestions snapchat zachtalkstech website httpwwwitcareerquestionscom information systems httpwwwinformationsystemsnet,Science & Technology,Information Technology,"where do i start,how to start,where to start in i.t,information technology path,i.t. path,i.t. learning path,i.t. training path,comptia,pioneers,comptia certifications,comptia training,security+,a+,comptia A+,i.t. careers,i.t. career path,i.t. roadmap,roadmap in i.t.,what certifications to get,what to know about i.t.,pluralsight,pluralsight training"
0me3utG1rgk,fastest way build iot applications,video show app development templates available use sap cloud platform web ide templates enable create application select ui pattern connect ui elements data source use iot application service generate code modify enhance fit require use case,Science & Technology,IOT,"SAP,IoT,Internet of Thing,SAP IoT Application Enablement,Marcus Behrens,SAP Leonardo,SAP Leonardo Foundation,SAP Cloud Platform,WebIDE,web-based development,Rapid deployment perspective,WYSIWYG,templates,drag and drop,build applications,code-free,Sensor chart,gauges,User Interface,UI"
0o-yCyOicI4,best laptops top pick game work students,link laptops list video huawei matebook microsoft surface book apple macbook pro razer blade stealth hp envy huawei matebook microsoft surface book apple macbook pro razer blade stealth hp envy huawei matebook microsoft surface book apple macbook pro razer blade stealth hp envy eu huawei matebook microsoft surface book apple macbook pro razer blade stealth hp envy today review best laptops market year make list base personal opinion try list base price quality durability recommendations let us know leave comment thank watch guy hope like video video helpful please remember leave like subscribe channel see videos like future question relate products list leave comment get back soon footage use video original content produce portion stock footage products gather multiple source include manufacture fellow creators various source something belong want remove please hesitate contact us participant amazon service llc associate program affiliate advertise program design provide mean sit earn advertise fee advertise link amazoncom amazon associate earn qualify purchase,Science & Technology,Laptops & Desktops,"Best 13-Inch Laptops,best laptop,best laptops,best 13 inch laptop,best laptop for students,best gaming laptop,best gaming laptops,best laptop 2018,best laptops for gaming,best 13 inch laptop under 600,laptop,best laptops 2018,best laptop 2019,best 13 inch laptop 2018,best 13 inch laptop under 500,best 13 inch laptop under $500,best 13 inch laptop 2017,best budget laptops,laptops,best 13 inch laptops"
0pss7E6IF_8,top best smartphones,youve hear samsung galaxy fold galaxy note huawei mate pro oneplus smartphones best overall top smartphones subscribe content free would make day could also follow instagram httpsgooglouqbba twitter httpsgooglefhwql facebook amazon affiliate link amazon us amazon uk httpsgooglgvrsgz film gear music epidemic sound httpshareepidemicsoundcomphdft,Science & Technology,Smartphones,"best smartphone,best smartphone 2019,best phone 2019,mkbhd,smartphone awards,smartphone awards 2019,samsung s10,samsung galaxy fold,samsung galaxy note 10 plus,samsung note 10 plus,iphone 11,iphone 11 pro max,xiaomi,xiaomi mi note 10,huawei p30 pro,huawei mate 30 pro,best smartphone camera,android,ios,iphone,smartphone"
10Nelw2nL-Q,build iot applications cloud iot firebase cloud next,iot solutions complex data need proceed different systems layer ingest application presentation layer especially true involve many role type system designers oems corporate consumer end users learn google provide complete set fully manage serverless components build solution combine iot core device identity data ingest firebase authentication user identity firestore realtime application data build iot applications watch next iot sessions next sessions playlist subscribe gcp channel httpsbitlygcloudplatform session id productcloud iot corecloud firestorefirebase auth fullnamezoltan aratopreston holmes,Science & Technology,IOT,"IoT solutions,OEMs,IoT Core,user identity,Firestone,Google Cloud Next,Next,2019,Next19,Google Cloud Platform,talks,session,keynote,official"
16659nqb0mY,cool gadgets futuristic technology gadgets buy amazon,check price buy charger power bank ygivo qi power bank qi wireless portable charger iphone plus samsung galaxy httpgrbestjpoye iris contact sensor skybuds nimbus amazon vr headset iphone android phone premium virtual reality goggle goggle play best mobile game videos new adjustable glass vr viewer bnext svakom luxury siime eye wireless light camera vibemassager oz premium waterbased lubricant forplay premier gel business inquiries contact gadgetsinventionsgmailcom payments internationally free prepay card trust copyright issue please contact us gadgetsinventionsgmailcom keywords,Science & Technology,Futuristic Technology,"gadgets,awesome inventions,parents,parenting,family,baby,top 10,top 5,new,review,unboxing,5 new,5 products,5 gadgets,5 inventions,new gadgets,new inventions,cool gadgets,never seen before,you have never seen before,you have never heard about,you didn’t know existed,amazing inventions,5 amazing inventions you didn’t know existed,awesome,technology,products,futuristic,tech,on amazon,raybaby,4moms,tech gifts,black friday deals,howmuchtech"
1PJsZwpwZ7k,ai artificial intelligence telugu future ai telugubadi,interest information httptelugubadiin telegram group httpstmetelugubadi videos httpsgooglvcpwxg page facebook us twitter httpstwittercomasktelugubadi bill gate biography telugu jack biography telugu elon musk biography telugu asktelugubadi episode asktelugubadi episode asktelugubadi episode asktelugubadi artificial intelligence ai area computer science emphasize creation intelligent machine work react like humans artificial intelligence ai ability digital computer computercontrolled robot perform task commonly associate intelligent be term frequently apply project develop systems endow intellectual process characteristic humans ability reason discover mean generalize learn past experience music credit time pass audionautix license creative commons attribution license artist httpaudionautixcom disclaimer content use educational purpose fair use copyright disclaimer section copyright act allowance make fair use purpose criticism comment news report teach scholarship research fair use use permit copyright statute might otherwise infringe nonprofit educational personal use tip balance favor fair use copyright relate matter please contact us telugubadiofficialgmailcom aiartificialintelligence,Science & Technology,Artificial Intelligence,"Telugu badi,Telugu badi channel,Telugu badi videos,AskTeluguBadi,telugu badi latest videos,telugu badi episode,AI,Artificial intelligence,Machine Learning,AI in telugu,Artificial intelligence in Telugu,technology,future technology,The Rise of AI,technology in the future,neural network,robots,robotics,singularity,deep mind,artificial intelligence and robotics,ibm watson,Machine Learning Vs Artificial Intelligence,danger with AI,documentary,Google,Singularity"
1RPntz5gfcA,secure iot applications mbed tls part,attack iot products increase recent years result vulnerabilities relate communication security among others compromise however attack prevent add security iot device mbed transport layer security tls straightforward achieve,Science & Technology,IOT,"Arm Architecture,Arm Holdings,Arm,Arm Processors,Mbed TLS,keil,Securing IoT,DTLS,TLS,mbed,security,webinar"
1ac_JqEBaWY,get start information technology,video try help get start world information technology grind knowledge field whatsoever get go find link refer video comptia exam objectives httpscertificationcomptiaorgtrainingexamobjectives comptia itf information httpscertificationcomptiaorgcertificationsitfundamentals comptia information httpscertificationcomptiaorgcertificationsa comptia certmaster learn train httpscertificationcomptiaorgtrainingcertmaster itprotv train httpsitprotv use coupon code save subscription cybraryit train httpscybraryit use coupon code save premium membership please consider support channel become exclusive career question community member exclusive live stream behind scenes much stock image courtesy pixabay httpspixabaycom product certification book recommendationsaffiliate link httpswwwamazoncomshopitcareerquestions top recommendations comptia net guide troubleshoot affiliate link comptia allinone exam affiliate link mcsa server study guide affiliate link mcsa sql study guide affiliate link mta os fundamentals affiliate link ccent official cert guide affiliate link ccna rout switch affiliate link career questionszach talk tech merchandise httpsteespringcomstoresitcareerquestions thank visit youtube channel facebook httpswwwfacebookcomitcareerquestions twitter httpstwittercomitcareerhelp instagram httpswwwinstagramcomitcareerquestions website httpwwwitcareerquestionscom information systems httpwwwinformationsystemsnet,Science & Technology,Information Technology,"IT Career Questions,cyber security,it careers,technology,information technology,information technology (industry),it jobs,entry-level job,i.t. careers,how to get into information technology,it careers for beginners,it careers 2019,it careers path,it careers explained,it career switch,best it careers,best it careers 2019,technology daily,information technology basics,technology 2019,comptia A+,comptia ITF,comptia ITF+,comptia it fundamentals"
1ye3PjKtopo,best video edit laptops top pick,link video edit laptops list video alienware dell xps apple macbook pro msi msi alienware dell xps apple macbook pro msi msi alienware dell xps apple macbook pro msi msi eu alienware dell xps apple macbook pro msi msi today review best video edit laptops buy year make list base personal opinion try list base price quality durability model would like recommend leave comment thank watch guy hope like video video helpful please remember leave like subscribe channel see videos like future question relate products list leave comment get back soon footage use video original content produce portion stock footage products gather multiple source include manufacture fellow creators various source something belong want remove please hesitate contact us participant amazon service llc associate program affiliate advertise program design provide mean sit earn advertise fee advertise link amazoncom amazon associate earn qualify purchase,Science & Technology,Laptops & Desktops,"Best Video Editing Laptops,best video editing laptop,best laptop for video editing,video editing laptop,video editing,best budget laptop for video editing,best video editing laptop 2019,best laptop for 4k video editing,best laptop for video editing 2019,best laptop,video editing laptops,best laptops for video editing,best video editing laptops,best video editing software,video editing laptop 2019,video editing computer"
2017kmkEukE,wonderful humanoid robots emotions artificial intelligence best robots,wonderful humanoid robots emotions artificial intelligence best robots join amazon prime amaze offersfree days trial need support subscribe subscribe idea smart home robots futuristic modern robots available market intelligent robots expert helpful part daily life lot work even think like human help every task dailies life imagine guide work like teachers entertainer security guard postman anything deserve word superb incredible detail link robots give jia jia sofia httpwwwhansonroboticscomrobotsophia asuna httpsgoogleuttjn actroid httpwwwroboticstodaycomrobotsactroid erica httpwwwjstgojperatoishiguroenrobothtml best robots intend buy future best robots intend buy future best camera worlds smallest video camera gopro camera nico moka luna two eye vr best fidget spinners youll intend buy infinity cube zerohour centerspin revoq triportal best drone wan na buy mini drone waterproof drone hovercraft airblock bionic bird biki first bionic wireless underwater fish drone underwater drone underwater camera best underwater drone underwater camera best drone camera waterproof camera best humanoid robotsnew generation super robotsrobothespian asimo atlas robotvalkyrie best robots intend buy future,Science & Technology,Artificial Intelligence,"lady robot,emotional robot,jia jia,sofia,sofia robot,asuna,actroid,erica,personal robot,robot,smart robots,robot rock,best robots,robot kit,robot videos,robotics,robot voice,robot boy,robot baby,robot dancer,robot overlords,robot operating system,robot pets,robot games,robot spider,robot toys,robot transformer,robot man,home robots,cool robots,robot wars,household robot,programming robots,humanoid robots,advanced robot"
28ktlzCn2lU,elon musks starlink shtshow astronomers vs starlink,try explain backlash space xs recent starlink network launch astronomy community dylan gear video canon mkii dslr dylan link patreon httpswwwpatreoncomdylanodonnell web httpsdeographycom facebook httpsfacebookcomdylanodonnell twitter httpstwittercomerfmufn instagram httpsinstagramcomdylanodonnell intro music move ocean aerologic edit blastculture,Science & Technology,Astronomy,"starlink,elon musk,astronomy,astronomers,astrophotography,satellite networks,dylan o'donnell,twitter,satellites,night sky,images,drama"
