video_id,title,description,category,sub_category,tags
nIBZLg33D6w,need iot application iot iot explain work free online coursehindi,iot expand improve data connect billions devices capable immediately share receive analyze massive amount better meet business need improve decisionmaking immediacy data collect iot devices mean faster analysis distribution information enjoy tutorial please like share subscribe want stay update upcoming videos press bell icon follow us social media handle linkedin facebook twitter httpstwittercomtonursery instagram youtube httpswwwyoutubecomcnurserytovarsity iot needofiot applicationsofiot nurserytovarsity importanceofiot iottutorial disclaimer nursery varsity youtube channel initiative raise awareness online education among mass population help various online course sole objective channel enlighten global public knowledge miscellaneous field form online videos creators videos put best efforts develop videos neither developers take responsibility representation respect accuracy applicability fitness completeness information impart use information provide advisable use solely basis personal judgement nothing contain youtube channel intend constitute advice substitute advice professional respective field generic market recommendations provide us base solely personal judgment consider opinions news research analyse price information contain channel provide general market commentary constitute investment advice certain videos image obtain routine google search image might copyright solely use educational noncommercial purpose possible us give scholarly credit creators image impart utmost gratitude contribution education process wholesomely promote viewers verify information provide use professional endeavor,Science & Technology,IOT,"Need of IoT,Applications of IoT,Importance of IoT,IoT Tutorial.,What do you mean by IoT?,What is IoT with example?,What is IoT in simple words?,What is the purpose of IoT?,what is iot,iot applications,iot tutorial,iot architecture,how iot works,introduction to iot ppt,introduction to iot course,Why is IoT useful?,Why do we need IoT platform?,How is IoT useful?,features of iot,benefits of iot,Nurserytovarsity"
nKkXTPyIS8A,top upcoming smartphones june,top upcoming smartphones june top best upcoming mobile phone june top upcoming mobile phone june smartphones come new oppo smartphones upcoming smartphone launch smartphone launch new smartphones launch mid range smartphone launch flagship launch hindi new vivo launch new asus launch new realme launch new redmi launch realme redmi vivo oppo samsung new samsung launch upcoming mobile phone await smartphones mobile launch smartphone launch top upcoming mobile phone top smartphone launch new smartphone launch top new smartphones smartphone launch january best phone june upcoming phone top smartphones june smartphone launch foldable smartphone upcoming smartphone upcoming phone top top top top upcoming smartphones june huawei samsung upcoming smartphones upcoming smartphones india best smartphones launch mobile phone launch top upcoming mobile phone poco india top upcoming mobile phone top smartphone launch new smartphone launch top new smartphones smartphone launch june best phone june upcoming phone top smartphones december smartphone launch foldable smartphone upcoming smartphone upcoming phone top top top best smartphone top best smartphone top best smartphone top best smartphone top smartphone best smartphone best smartphone best smartphone best smartphone top top upcoming smartphone feature smartphone budget smartphone smartphone best best buy smartphone phone best phone smartphone best phone india best phone best mobile best mobile best mobile india smartphone top best phone best phone india best phone best smartphone best phone best mobile india best phone best mobile upcomingsmartphones topmobilelaunches enquire product promotions get touch us smartttechnicalgmailcom अगर अगर और videos httpswwwyoutubecomsmartttechnical copyright disclaimer section copyright act allowance make fair use purpose criticism comment news report teach scholarship research fair use use permit copyright statute might otherwise infringe nonprofit educational personal use tip balance favor fair use,Science & Technology,Smartphones,"top 10 upcoming mobile phones,Upcoming Smartphone Launches,top smartphone launches,Smartphone Launches of 2020,new smartphone launches,top new smartphones,new smartphones launching in 2020,smartphone launches June 2020,Mid Range Smartphone Launching in 2020,top 5 smartphones,Foldable SmartPhone,upcoming,smartphone,Upcoming Phones,TOp 5,Top 10,samsung upcoming smartphones,upcoming smartphones in india,best smartphones launches,mobile phone launches in 2020"
nOX4QdgXHrY,use machine learn artificial intelligence apps innovation track playtime emea,hear examples practical advice developers already successfully use machine learn artificial intelligence improve performance apps help onboarding engagement churn reduction speakers albert reynaud partner development manager google play daniel zohar cto memrise harsimrat sandhawalia computer vision engineer eyeem watch rest sessions httpsgoogloxbuud subscribe android developers channel httpsgooglvlydu,Science & Technology,Artificial Intelligence,"Android,Google Play,Google,Play,Playtime,app,game,innovation,mobile,best practices,tips,Berlin,EMEA,Albert Reynaud,Daniel Zohar,Memrise,Harsimrat Sandhawalia,EyeEm,artificial intelligence,AI,machine learning,ML,onboarding,engagement,churn,performance,success,now,GDS: Upload only"
nQzTEexpN60,research innovation information technology,research innovation information technology role regional university research center luis orozcobarbosa professor universidad de castillala mancha abstract european commission recognize important role play universities build european knowledge society creators new knowledge universities find core knowledge society regional level sustainable development highly depend ability education research institutions actively participate innovation program focus transfer technology local regional industry activity central place regional development throughout europe large number initiatives promote participation regional highlevel education institutions university therefore call participate main actor improve regional economic competitiveness actively contribute solve regional need strategies talk review successful stories first give focus rtd activities carry albacete research institute informatics recently create research institute make part science technology park castilla la mancha speaker bio luis orozcobarbosa receive bsc degree electrical computer engineer universidad autonoma metropolitana mexico diplome détudes approfondies école nationale supérieure et de mathématiques appliquées ensimag france doctorat de université pierre et marie curie france computer science faculty member school information technology engineer site university ottawa canada join department computer engineer universidad de castilla la mancha spain also appoint director albacete research institute informatics regional centre excellence conduct numerous research project private sector serve technical advisor canadian international development agency cida current research interest include wireless communications wireless sensor network use many different areas range environmental monitor manufacture,Science & Technology,Information Technology,"CITRIS,UCBerkeley,Research,Science,Technology"
neWc5I9IdQ4,top industrial robots must see,top industrial robots must see abb irb high performance id robot arc weld machine tend kuka kr agilus compact sixaxis robot httpswwwkukacomendeproductsrobotsystemsindustrialrobotskragilus kuka autonomous lbr iiwa httpswwwkukacomendeproductsmobilitymobilerobotskmriiwa daihen synchrofeed ultralowspatter robotic weld httpwwwdaihenusacomproductcategoryrobots yaskawa motoman mobile robotics platform httpswwwmotomancom amazon prime free day like comment subscribe follow facebook httpswwwfacebookcomawesometechq followtwitter httpstwittercomawesometechq also see top latest printers top printers buy top desktop cnc machine workshop top desktop cnc machine workshop top desktop cnc machine workshop top robotic arm desktop top robotic arm desktop disclaimer video description contain affiliate link mean click one product link receive small commission help support channel allow us continue make videos like thank support,Science & Technology,Robotics,"industrial robots 2018,industrial robot,industrial robotics companies,kuka robot 2018,industrial robots,abb robot 2018,robotics (industry),industrial robotics,industrial,kuka robot,robots,kuka robot arm,robotics,robot arm,technology,robot,gadgets,awesometech,desktop cnc machine,desktop cnc,robotics engineering,robotics competition 2017,material handling robots,robotics and automation,robotic arm,cnc,cnc machine,robotics engineering tutorial"
nl7O99dh_Co,best skill succeed career information technology,today talk best skill need learn succeed please consider support channel become exclusive career question community member exclusive live stream behind scenes much product certification book recommendationsaffiliate link httpswwwamazoncomshopitcareerquestions top recommendations comptia net guide troubleshoot affiliate link comptia allinone exam affiliate link mcsa server study guide affiliate link mcsa sql study guide affiliate link mta os fundamentals affiliate link ccent official cert guide affiliate link ccna rout switch affiliate link career questionszach talk tech merchandise httpsteespringcomstoresitcareerquestions equipment use video followsaffiliate link sony camera sony camera google pixel xlback camera httpsstoregooglecomusproductpixelphonehlenus zoom digital recorder giant squid microphone flexispot sit stand desk nanoleaf lead light thank visit youtube channel facebook httpswwwfacebookcomitcareerquestions twitter httpstwittercomtalktechdaily instagram httpswwwinstagramcomitcareerquestions snapchat zachtalkstech website httpwwwitcareerquestionscom information systems httpwwwinformationsystemsnet,Science & Technology,Information Technology,"soft skills,most in demand skills,customer service skills,information technology (industry),information technology jobs,soft skills training,soft skills in the workplace,soft skills professionalism,soft skills communication,soft skills for career success,soft skills enthusiasm and attitude,soft skills vs hard skills,customer service skills for success,customer service skills and techniques,it jobs without degree"
o9j6ah_kHA8,top astronomical discoveries,best year ever let relax glance back last year arrokoth betelgeuse anton petrov,Science & Technology,Astronomy,"Europa,Enceladus,Moon,K2-18b,water exoplanet,tardigrades,beresheet,water,exomoon,exomooons,2I/Borisov,comet borisov,borisov,mars,methane,oxygen,mars methane,mars oxygen,martian methane,martian oxygen,venus,absorbers,dark absorbers,arrokoth,betelgeuse,M87,black hole image,black hole"
oYoHZVwCUcY,futuristic technology may come true soon,technology never stand still always change adapt progress oftentimes things seem improbable even impossible one year quickly start become possible short years afterwards wearable computers seem like fanciful idea recently pretty much next big thing go mainstream emergence oculus rift could probably catapult virtual augment reality literal reality mind list interest futuristic technologies probably see near future future invention ideasnew vehicle technologynew car technologynew upcoming technology invention computer technologynew technology things technologylatest technology inventionsnew technology automobilefuture technologyupcoming technologiesfuture carsjet print foodadvanced prostheticsfuture weaponsironmanfast charginglife change technologymodern engineeringfuture engineer,Science & Technology,Futuristic Technology,"future invention ideas,new vehicle technology,new car technology,new upcoming technology 2017,latest invention in computer technology,new technology 2017,new things in technology,latest technology inventions,new technology in automobile,Future Technology,Upcoming Technologies,Future Cars,Jet packs,3D printed Food,Advanced Prosthetics,Future weapons,Ironman,Fast charging,Life Changing Technology,Modern Engineering,Future Engineering,Top 10"
ooqiY7hFWE8,amaze bionic robots festo robotics,amaze bionic robots festo robotics amazon prime free day disclaimer video description contain affiliate link mean click one product link receive small commission help support channel allow us continue make videos like thank support,Science & Technology,Robotics,"festo robotics,bionic robots,festo robot,bionic robot,festo bionic,festo robotic animals,festo robotic arm,festo robotic butterfly,robotic arm,artificial intelligence,artificial intelligence robot,bionic robotic arm,bionic robot hand,festo robotic hand,amazing robots,bionic learning network,festo bionic dragonfly,robot arm,bionic robots with artificial intelligence,festo soft robotics,bionic learning network festo,festo robot arm,festo robot hand"
oxYhGVHihnA,upcoming google project,google alphabet project might know subscribe similar content share video share knowledge highly appreciate subscribe free kit httpskitcomexploregadgets smartphone myths unique gadgets might know google tip trick youtube tip trick source credit httpswwwyoutubecomusergoogle httpswwwyoutubecomuserflightbotschannelabout httpswwwyoutubecomusernmanewsdirectabout httpwwwbostondynamicscom httpswwwyoutubecomuseramazonabout httpswwwyoutubecomuserthepatentyogiabout httpswwwyoutubecomuserhomeofgrapheneabout httpsverilycom music distrion electrolight feat kenekt ncs release ksafo alex skrindo future vibes feat stewart wallace httpswwwfacebookcomexploregadgets httpstwittercomexploregadgets httpsplusgooglecomexploregadgets httpinstagramcomexploregadgets support us,Science & Technology,Information Technology,"google,upcoming google projects,future google projects,google alphabet explained,google alphabet,alphabet,google's parent company,largest company in the world,google x,upcoming alphabet projects,google genomics,google projects,explore gadgets,10 ambitious google project,technology,youtube tips and tricks,top technologies,upcoming technology,future technology,future tech"
p78wOul8-FU,iot applications connect sensors,sort useful applications sensors log data cloud video show build internet things application log temperature data send email alert specify individuals temperature fall outside expect range although choose use temperature sensor type sensor could use connect application httpstemboocomiotapplicationssoilqualitymonitor part samsung artik temperature sensor breadboard wire php web server track upbeat artist jon luc hefferman cc bync,Science & Technology,IOT,"Internet Of Things (Industry),IoT,Connected Sensors,Sensors,Temperature,Building Management,Agriculture,Farming,Samsung Artik,Arduino"
p9wudsLOeW8,astronomy calendar secrets universe,calendar astronomy events highlight january quadrantids meteor shower january partial lunar eclipse february first supermoon march second supermoon march spring equinox april third supermoon april lyrids meteor shower may eta aquarids meteor shower may fourth supermoon june partial lunar eclipse june annular solar eclipse june summer solstice july partial lunar eclipse july jupiter opposition july saturn opposition august perseid meteor shower september neptune opposition september autumn equinox october mar opposition october orionids meteor shower october blue moon october uranus opposition november taurids meteor shower november leonids meteor shower november partial lunar eclipse december geminids meteor shower december total solar eclipse december winter solstice december ursid meteor shower follow us social media facebook httpswwwfacebookcomsecretsofuniverse website wwwsecretsofuniversein instagram httpswwwinstagramcomthesecretsoftheuniverse twitter httpstwittercomcosmicsecrets,Science & Technology,Astronomy,"Astronomy Events 2020,Astronomy,Astronomy Calendar 2020,2020,Supermoon,Geminid Meteor Shower,Perseid Meteor Shower,Leonids Meteor Shower,Quadrantid Meteor Shower,Solar Eclipse 2020,Lunar Eclipse 2020,Sky gazing 2020,Night Sky"
pWLVXv0s3N0,top astronomy events month may,top space apps httpswwwsecretsofuniverseinastronomyapps astronomy events may may eta aquariid meteor shower earth pass debris halleys comet may fourth last supermoon may eta lyrid meteor shower may conjunction moon jupiter may conjunction moon saturn may conjunction moon mar may close approach jupiter saturn may close approach venus mercury may new moon may conjunction moon venus may mercury reach highest point sky secrets universe well know social media platform physics astronomy half million followers facebook online presence facebook httpswwwfacebookcomsecretsofuniverse instagram httpswwwinstagramcomthesecretsoftheuniverse website wwwsecretsofuniversein twitter httpstwittercomcosmicsecrets pinterest httpsinpinterestcomthesecretsoftheuniverse,Science & Technology,Astronomy,"Astronomy Events In May 2020,Night Sky May 2020,Aquarid Meteor Shower,Halley's Comet,Supermoon,Astronomy,Aquarids"
pifcsQ4ZNZE,best laptops video edit choose powerful video edit laptop,top best laptops video edit msi stealth httpsgeniusajpjfvd lenovo thinkpad httpsgeniusximfupb apple macbook pro httpsgeniusyyqthx microsoft surface book hp zbook studio httpsgeniusxopvbya razer blade studio edition dell xps huawei matebook x pro httpsgeniusppwt macbook pro macbook pro infos link rest gear httpskitcohypetech portable camera gear httpskitcohypetechsuperportablecameragear subscribe subscribe wont miss videos thank much watch hope like video video helpful leave like subscribe channel see videos future question products leave comment best answer hypetech relate word best laptops video edit best cheap laptop edit youtube videos best laptop video edit best laptops video edit best laptop video edit best laptop photo video edit best budget laptop video edit india look laptop video edit budget laptop video edit best laptop video edit best laptop video edit best budget laptop video edit best laptop video edit best laptop video edit best laptop video edit reddit best laptop video edit best laptop video edit best laptop video edit best laptops consumer report best laptop best laptop photo edit best laptop photo edit best budget laptop photoshop best laptop video edit best desktop photo edit best laptop photoshop best computer photo edit game laptop photo edit surface laptop video edit video laptop,Science & Technology,Laptops & Desktops,"Best laptop for video editing,best laptop for video editing 2019,best video editing laptop 2019,best video editing laptop,video editing laptop,4k editing laptop,video editing laptop 2019,best laptop for video editing,laptop for video editing 2019,best budget laptop for video editing 2019,laptop for video editing,best budget laptop for video editing,video editing laptops"
psDO1rPFQ1Y,smartphones make factory,process manufacture smartphones line use people machine invite visit world amaze technique advance technology review copyright email techworldreviewschgmailcom official sit cubot httpswwwcubotnet spidermall httpswwwspidermallcom mobtek wholesale httpwwwmobtekwholesalecom ulefone httpulefonecom,Science & Technology,Smartphones,"smartphone,smartphones,process,line,machines,factory,making,manufacturing,video,how to make,how to,cubot,ulefone,smartphone ulefone,smartphone factory,smartphone factory tour,smartphone making factory,smartphone manufacturing,smartphone manufacturing process,smartphone manufacturing process in the factory,smartphone production process,smartphone production line,smartphone making,smartphone making process,smartphone making machine,tech,reviews,tech world reviews"
pul9r0jfbug,unsettle astronomical incidents phenomena,exploration ten unsettle astrophysical events include dyson sphere candidates star contain plutonium wow signal others httpswwwpatreoncomjohnmichaelgodier httpswwwyoutubecomeventhorizonshow paper pulsar position system quest evidence extraterrestrial engineer clement vidal fast radio burst extragalactic light sail lingham loeb discovery peculiar periodic spectral modulations small fraction solar type star borra trottier music cylinder eight chris zabriskie license creative commons attribution license source httpchriszabriskiecomcylinders artist httpchriszabriskiecom cylinder five chris zabriskie license creative commons attribution license source httpchriszabriskiecomcylinders artist httpchriszabriskiecom night forever miguel johnson httpsmigueljohnsonbandcampcom cylinder three chris zabriskie license creative commons attribution license source httpchriszabriskiecomcylinders artist httpchriszabriskiecom,Science & Technology,Astronomy,"universe,astronomy,asmr,alien,astrobiology,exobiology,fermi paradox,10,top ten,Wow signal,KIC 8462852,astrophysics,extraterrestrial,Tabby's star,przybylski,mystery,strange,JMG,godier,SETI,radio,signal,science"
qAKNnM9-i9U,best laptops top pick,link laptops mention today asus vivobook lenovo ideapad acer chromebook lenovo flex acer aspire asus vivobook lenovo ideapad na acer chromebook lenovo flex na acer aspire asus vivobook na lenovo ideapad acer chromebook lenovo flex acer aspire eu asus vivobook lenovo ideapad na acer chromebook na lenovo flex na acer aspire today list best laptops buy year make list test many different model rank base price quality durability recommendations let us know leave comment thank watch guy hope like video video helpful please remember leave like subscribe channel see videos like future question relate products list leave comment get back soon footage use video original content produce portion stock footage products gather multiple source include manufacture fellow creators various source something belong want remove please hesitate contact us participant amazon service llc associate program affiliate advertise program design provide mean sit earn advertise fee advertise link amazoncom amazon associate earn qualify purchase,Science & Technology,Laptops & Desktops,"Best Laptops Under $300,best laptop under 300,best budget laptop,best laptops under $300,best laptops under $500,best laptop under 500,best laptops,best laptop,best cheap laptop,best budget laptops,best gaming laptop under 300,best budget gaming laptop,laptops,best laptops for college,cheap laptops,best laptops under 500,best laptops for students,laptops under $300,best laptop under $300,best laptop under"
qBikQcRmGyE,cool robotics gadgets invention robots buy amazon aliexpress,todays video see enjoy cool robotics gadgets invention robots buy amazon aliexpress ai show todays video use concept make live easier ever samsung company many robotics company create artificial intelligence device robots ability think ordinary human robots kinds work without control ability think things right take decisions watch youtube video know detail devices buy xiaomi mijia dlp projecto samsung ballie robot glamos lua smart planter neorhythm samsung ai bots ironman toy suit place creators popular videos view unique bicycle inventions view amaze shoe invention view unique smart bicycle invention view robotics smartphone gadgets view new kitchen gadgets invention view amaze technology gadgets view amaze game gadgets invention view cartoon gadgets real life view smart toy gadgets invention view pubg mobile gadgets invention creators youtube channel topics video cool gadgets amaze gadgets gadgets technology gadgets invention amaze gadgets new technology technology invention amaze gadgets top gadgets top gadgets new invention amaze gadgets cool technology cool gadgets aliexpress amazon flipkart aliexpress products aliexpress gadgets china gadgets amazon gadgets smartphone gadgets cool smartphone gadgets gadgets rupees rupees gadgets free products get free products buy gadgets gadgets video free gadgets video thank subscribe creators,Science & Technology,Robotics,"5 cool gadgets,gadgets,cool gadgets,new gadgets,latest gadgets,amazon,electronic gadgets,top 5 gadgets,inventions,gadgets invention,technology,new technology,5 gadgets,advance gadgets,aliexpress,top 5,gadgets under 500 rupees,unique gadgets,100 rupees products,7 MI SUPERHERO GADGETS INVENTION,RC ROBOTS,ROBOTS UNDER 350 RUPEES,ROBOTS $4,samsung ballie,250 RUPEE ROBOT,rs 500 gadgets,ROBOT GADGETS 400 RUPEES,AI ROBOTS,7 COOL ROBOTICS GADGETS INVENTION"
qIRjytgNuhM,lgs future display technology blow away,lg oled display concept video future oled displaysexperience whole new future create oled see oled bring significant change life lg believe oled fundamentally change future home portable devices see concepts oled technology enable next years samsungs future display technology httpsyoutubeluzeyhdlve subscribe new amaze inventions cool gadgets futuristic new technology things didnt know exist mind blow amaze gadgets know nothing latest gadgets news httpwwwtechfooglecom enjoy content well dont forget subscribe like comment favorite share friends social media follow twitter like facebook subscribe channel visit official website techno source endorse products,Science & Technology,Futuristic Technology,"4k,high dynamic range,uhd,display,oled display future,oled display tv,oled display vs amoled display,oled display test,lg oled 4k tv,lg oled wallpaper tv,lg oled 2017,lg oled55b6p,lg oled tv,lg oled display,lg oled demo video,oled tv,oled display,oled iphone,oled samsung,oled ad,oled commercial,oled,lg oled,oled future,future technology,future of displays,best drone,lg,best smartphone 2016,lg electronics (business operation)"
