video_id,title,description,category,sub_category,tags
C5qSK1QpHow,destination mar space astronomy,search ultimate vacation destination check gough island kamchatka peninsula set next destination mar wealthiest individuals able afford journey red planet rocket develop scientists lead cavalcade businessmen ready spend billions help astrophysicist stephen hawk dream martian exploration come true destination mar examine current interest internationally man flight mar portray scientists engineer get us global competition already set send first humans oneway trip mar race capture imagination world know find lot firsts channel offer full episodes high quality documentaries enjoy dont forget subscribe channel might interest criminals crimefighters hazard catastrophes,Science & Technology,Astronomy,"destination mars,destination mars space,destination mars space and astronomy,destination mars full documentary,destination mars science documentary,destination mars space documentary,destination mars planet documentary,destination mars astronomy documentary,destination mars documentary,destination mars full documentaries,destination mars red planet,destination mars exploration,destination mars Stephen Hawking,destination mars NASA"
C7MchkzEw1s,secure iot applications dtls,part four webinar series secure iot applications mbed tls talk data transport layer security dtls secure udp base datagram protocols use tls work tcp connections dtls offer security udp connections well nonipbased communication lowpower wan protocols webinar explain use dtls embed application base handson example,Science & Technology,IOT,"Arm Architecture,Arm Holdings,Arm,Arm Processors,mbed tls,keil,arm,secure software,communication,dtls,tls,udp,tcp"
C7P7ur7tTb4,best sell android smartphones,list best sell android smartphones accord report samsung galaxy capture percent share overall smartphone market redmi second bestselling android smartphone account percent market share third position samsung galaxy phone percent share fourth fifth position samsung galaxy redmi note percent market share samsung say ship lakh units smartphone globally redmi come second among top sell android phone top six smartphones list include four devices samsung two xiaomi smartphone best android watch video best deal amazon best flipkart deal follow place update twitter httpstwittercomutsavtechie instagram httpswwwinstagramcomutsavtechie second channel httpswwwyoutubecomchannelucdyt real reason ads go anywhere real ad problem explain xiaomi vs apple dont expect another poco snapdragon processors explain last video business email contactutsavtechieenlyftin,Science & Technology,Smartphones,"Smartphones,mobile phones,mobile phones ranking,phone ranking,Smartphone,smarthpone ranking,best-selling smartphones,top 10 phones,best Smartphone,best smartphone under 20000,best phone under 20000,top smartphones 2020,best smartphones 2020,best mobile brands,highest selling mobile phones.,Best Phone in market,Best Mid Range Phone,xiaomi,mi,samsung,google,asus,realme,moto,lenovo,vivo,oppo,oneplus,nokia,honor,huawei,poco,redmi,apple,iphone,iphone 12,iphone 2020"
CEIUrF7iOXk,fetch automate warehouse robots,silicon valley startup fetch robotics unveil pair robots design work warehouse autonomously pick deliver goods read httpspectrumieeeorgautomatonroboticsindustrialrobotsfetchroboticsintroducesfetchandfreightyourwarehouseisnowautomated,Science & Technology,Robotics,"Robots,Robotics,Robot,Automation,Startup,Silicon Valley,Fetch Robotics,Fetch,Freight,IEEE Spectrum,Automaton,Melonee Wise,Willow Garage,Amazon,Google,Kiva Systems,Warehouse,editorial"
C_g7C9rttn0,advent islam pave way astronomy scientific think,advent islam pave way astronomy condemn astrology lead scientific think thereby affect entire civilizations hasan alhariri chief executive dubai astronomy group say read like us facebook httpswwwfacebookcomalarabiyaenglish follow us twitter httpstwittercomalarabiyaeng follow us instagram httpstwittercomalarabiyaeng like us google al arabiya english website httpsenglishalarabiyanet subscribe youtube channel english site arab worlds lead news channel,Science & Technology,Astronomy,"News,Saudi Arabia,Al Arabiya,Al Arabiya English,English News,Saudi,Arabic,Middle East,Arab,Arabs,middle east news,Arab news,Astronomy,Astrology,Islam,Islamic History,Science"
CxR53AJtABY,amaze tech gadgets buy online amazon futuristic technology future smart technology,purchase link amaze tech gadgets alwayshome vpn dongle xiaomi wowstick mini camera kado world thinnest wallcharger laer laptop sleeve charge excite free gift giveaway follow httpinstagramcomsunielmalviya amaze tech gadgets buy online amazon futuristic technology future smart technology grab low price product offer flipkart app download install httpsgooglufucsy gadgets low price bluetooth speaker amazon flipkart httpfkrtitypusfonnnn spy camera amazon flipkart httpfkrtitylrwonnnn best base earphone amazon flipkart mobile dslr lens kit photography amazon flipkart httpfkrtityjumonnnn sim mobile phone amazon flipkart httpfkrtitarplufuuun powerbank amazon flipkart tiktok camera stand amazon flipkart tiktok camera light amazon flipkart httpfkrtitaxcqlfuuun pubg game controller amazon flipkart httpfkrtityoifonnnn get touch us want product feature channel admingenrontechcom thank lovable support fair use category news teach,Science & Technology,Futuristic Technology,"suniel malviya,genron tech,AlwaysHome VPN Dongle,XIAOMI Wowstick,Electric Screw Driver,Mini Camera SQ11,KADO - The World’s Thinnest Wall-Charger,LAER A Laptop Sleeve,charger,new technology,futuristic,5 hitech cool gadgets,hitech,future technology,gadgets in 2050,2050 technology,inventions,smartphone gadgets,products,technical guruji,technology,mobile gadgets,you can buy on amazon,new gadgets,latest gadgets,electronic gadgets,top 5 gadgets,cool gadgets"
Dk7h22mRYHQ,rise ai,theres ai revolution sweep across world yet people know real story technology come suddenly take groundbreaking episode hello world story ais rise tell detail first time journalist ashlee vance head unexpected birthplace technology canada bloomberghelloworld hello world webby emmynominated video series bloomberg invite viewer come journey across globe find inventors scientists technologists shape future join journalist bestselling author ashlee vance quest find freshest weirdest tech creations beautiful freak behind watch hello world episodes httpswwwbloombergcomhelloworld bloomberg first word business news deliver break news analysis uptotheminute market data feature profile httpwwwbloombergcom connect us twitter httpstwittercombusiness facebook httpswwwfacebookcombloombergbusiness instagram httpswwwinstagramcombloombergbusiness,Science & Technology,Artificial Intelligence,"News,bloomberg,wall street,business news,lyrebird,hello world,digital voice,voice recording,artificial intelligence,AI,Google Voice Assistant,Google Duplex,Ashlee Vance,Canada,justin trudeau,Geoff Hinton,Richard Sutton,Prime Minister Trudeau,The Terminator,computing,neural networks,what is AI"
E-rWW6TIw3c,best laptops students,samsung chromebook acer aspire slim laptop asus vivobook flip macbook air dell xps student look laptop want one give flexibility freedom work assignments anytime anywhere want laptop deliver enough horsepower crunch work one small lightweight easy take class class library cafe video compare best laptops students design different kinds students take account performance feature price decide best products list select base inherent strengths feature compare samsung chromebook acer aspire slim laptop asus vivobook flip macbook air dell xps great options market laptop students break laptop students best expect get return money help decide one model list seem like great purchase disclaimer portion footage find video original content produce best portion stock footage products gather multiple source include manufacture fellow creators various source something belong want remove please hesitate contact us thefivebestmanagementatgmailcom link provide affiliate link earn qualify purchase,Science & Technology,Laptops & Desktops,"Top 5,5 Best"
E8Hs1B9LPHY,budget smartphones still worth philippines,read full article tech news review httpwwwyugatechcom get yugatech merch facebook httpswwwfacebookcomyugatech twitter httpswwwtwittercomyugatech instagram httpswwwinstagramcomyugatechph fps benchmarking tool gamebench android app,Science & Technology,Smartphones,"budget smartphones philippines,budget smartphones yugatech,smartphones under 10k philippines,smartphones under 5k yugatech,xiaomi redmi note 8 price philippines,xiaomi redmi 8 price philippines realme 5 price philippines,realme c2 2020 philippines,xiaomi redmi note 8 yugatech,huawei y7 pro 2019 price philippines,oppo a5s price philippines,cheap smartphones philippines"
EFILXHlDihs,best astronomy binoculars top buy,best astronomy binoculars top buy great pair binoculars invitation slow look world greater detail always favorite tool among birders hunters spot things far away binoculars also use add perspective adventure see play close baseball game even stargaze night scour internet find best binoculars us celestron cometron bincoulars celestron skymaster giant binoculars skygenius x powerful binoculars orion astronomy binoculars esslnb giant binoculars astronomy uk celestron cometron bincoulars celestron skymaster giant binoculars skygenius x powerful binoculars orion astronomy binoculars esslnb giant binoculars astronomy ca celestron cometron bincoulars celestron skymaster giant binoculars skygenius x powerful binoculars orion astronomy binoculars esslnb giant binoculars astronomy ger eu celestron skymaster giant binoculars skygenius x powerful binoculars orion astronomy binoculars esslnb giant binoculars astronomy inspire video list best astronomy binoculars top buy market year make list base many hours research also base personal opinion try list base feature design durability sure leave comment check channel lot videos social media facebook instagram twitter reddit feel free support channel paypal video gon na check best astronomy binoculars top buy market today find link products description youve get another product mind would like us review please comment well look soon possible let know compare items list roundup amazon todays deal freetime unlimited free trial amazonfresh free trial twitch prime amazon music unlimited free trial amazon home service unlimited membership plan amazon prime free trial gift amazon prime amazon wed registry audible get two free audiobooks amazon channel free trial amazon family free trial student trial gift card amazon portion footage find video original content produce buzz prime channel portion stock footage products gather multiple source include manufacture fellow creators various source something belong want remove please hesitate contact us channel participant amazon service llc associate program affiliate advertise program design provide mean sit earn advertise fee advertise link amazoncom bestastronomybinoculars,Science & Technology,Astronomy,"#buzzprime,best binoculars for astronomy,best binoculars for astronomy 2019,best binoculars for long distance,best binoculars for long distance viewing,best binoculars for moon viewing,best binoculars for sky watching,best binoculars for stargazing,best binoculars for stars,the best binoculars 2019,astronomy,best astro binoculars,best astronomy binoculars,best astronomy binoculars 2018,best astronomy binoculars 2019,best astronomy binoculars 2020,best binoculars"
EHI8ZWBnMes,new technology gadgets must futuristic technology smart gadgets,please like share comment subscribe channel amazon affiliate link netvue belle video doorbell smartgadgets gadgets amazinggadgets music beach mbb httpssoundcloudcommbbofficial creative commons attributionsharealike unported cc bysa music promote audio library,Science & Technology,Futuristic Technology,"top 5 gadgets you must have,gadget,top 5 smart gadget,5 COOL GADGETS YOU SHOULD BUY,Top 5 Smart Gadgets You Must buy,5 New Technology Gadgets Available Online,5 AMAZING GADGETS INVENTION,Electronics Gadgets,5 Futuristic Gadgets,available on amazon"
E_HxLqlhzuI,nanoelectronics highly efficient structure tomorrows information technology,manage large data stream future need new strategies solutions energyefficient mean avoid buildup heat enable faster data rate helmholtzzentrum dresdenrossendorf research focus one electron property particular spin film produce march cooperation avanga filmproduktion gmbh co kg,Science & Technology,Information Technology,"spintronics,nanoelectronics,magnetism,electronics,spin waves"
En0TlXWzJ3k,mercedes benz futuristic technology today next level future car,mercedes benz futuristic technology today next level future car please subscribe welcome wow tech hd feature amaze interest technology futuristic inventions gadgets video around worldmore top top next level tool futuristic awesome feature technology accessories tech gadgets interest inventions believe exist amaze inventions cool gadgets must see inventions feature must add amaze facts specs homemade inventions home things exist find list source mercedes benz massive thank support channel start please help us reach subscribers please subscribe like share please make sure subscribelike share hit bell icon update newly release content follow us facebook instagram twitter technology inventions futuristic gadgets copyright issue please contact wowtechhdnowgmailcom category,Science & Technology,Futuristic Technology,"Mercedes AVTR,Mercedes AVTR test drive,demo drive,avtr,avatar,mercedes,las vegas,ces,ces 2020,concept cars,future cars,mercedes benz,concept car,luxury cars,future cars 2020,futuristic cars,mercedes benz world premiere,mercedes 2020,mercedes news,mercedes benz ces,mercedes car,las vegas headlines,ces showstoppers,gran turismo,latest updates,mercedes ces 2020,mercedes-benz,vision avtr,mercedes avatar,mercedes benz concept car,avatar car"
FAMJpijwQnQ,digitize construction sit scale robotics,barcelonabased scale robotics build walle doppelgänger navigate around build map construction sit fuse image video data capture robots read techcrunch lead technology media property dedicate obsessively profile startups review new internet products break tech news subscribe techcrunch today,Science & Technology,Robotics,"construction robots,scaled robotics,barcelona startup,artificial intelligience,ai robotics,location mapping,construction mapping,robots mapping sites,remote mapping robots,cool new robots,cool construction,future of construction,futuristic robotics,building the future,robotics of the future"
FEhgLcnFVWw,degree vs certifications better information technology question,recently ask whether better get year degree go certifications usually would seem like pretty straight forward answerbut check video see personal opinion degree vs certification please share thoughts thank visit youtube channel please find see place find see subscribe httpwwwyoutubecomuserpcsimplest facebok httpswwwfacebookcompcsimplest twitter httpstwittercompcsimplest google plus website httpwwwitcareerquestionscom resume httpwwwzachhillnet,Science & Technology,Information Technology,"Technology,Tutorials,i.t.,career,questions,pcsimplest,i.t. career questions,i.t. degree,i.t. certifications,information technology degrees,4 year i.t. degree,associates degree in i.t.,bachelors degree in i.t.,degree vs certifications,a+ certification,network + certification,networking certifications,computer certifications,technology certifications,technology degrees,tech degree,tech certifications"
FEuboaG8rJY,top best smartphone may,follow instagram httpswwwinstagramcomoubaid hope like video please share subscribe channel content social media instagram httpswwwinstagramcomoubaid facebook httpswwwfacebookcomosonlinesolution twitter httpstwittercomonlinesolution buy affiliate link samsung samsung realme pro realme realem pro samsung redmi note pro xiaomi mi vivo pro realme realme x realme coolpad note samsung poco samsung redmi note pro realme xt realme x redmi redmi pro phone one plus one plus pro vivo redmi realme zenfone max moto realme redmi poco samsung gadget camera lens mic blue ice mic tripod vlog tripod light music use thank watch,Science & Technology,Smartphones,"Top 5 Best Smartphone Under 20000 May 2020,best smartphone under 20000,under 20000,mobile under 20000"
FIcWnYgf1fI,interview ronnie wong itprotv information technology professional,interview talk ronnie wong httpsitprotv discuss get field work pro tv havent check httpsitprotv yet please check signup free trial youre interest use coupon code subscription equipment use video followsaffiliate link sony camera sony camera google pixel xlside camera httpsstoregooglecomusproductpixelphonehlenus zoom digital recorder giant squid microphone flexispot sit stand desk frequently ask question please see playlist thank visit youtube channel facebook httpswwwfacebookcompcsimplest twitter httpstwittercompcsimplest website httpwwwitcareerquestionscom resume httpwwwzachhillnet information systems httpwwwinformationsystemsnet,Science & Technology,Information Technology,"i.t.,i.t. career questions,tech careers,tech questions,ronnie wong itprotv,ronnie wong,itprotv,itpro,itpro tv,itpro.tv,itprotv review,itprotv a+,itprotv podcast,itprotv security,itprotv virtual labs,itprotv vs pluralsight,itprotv discount,itpros,it training,it courses,itprotv coupon,it certification courses,it certification training,it tutorials,online it classes,online it certification training,it jobs"
FXqoPVC72xs,buy cheapest smartphones ever,buy cheapest smartphones wishdont try home get surfshark vpn httpssurfsharkdealsboss enter promo code boss month free subscribe content free would make day could also follow instagram httpsgooglouqbba twitter httpsgooglefhwql facebook amazon affiliate link amazon us amazon uk httpsgooglgvrsgz film gear music epidemic sound httpshareepidemicsoundcomphdft,Science & Technology,Smartphones,"best smartphones 2020,top smartphones 2020,wish,smartphones,wish tech,unboxing,smartphone unboxing,smartphone,android,tech,iPhone se unboxing,iphone se 2020 unboxing,iphone unboxing,iphone,best phones 2020,wish.com"
FeQ771a-PA8,top best budget smartphones rs may,hello dosto video maine aap logo ko top best budget game smartphone ke bare bataya hu jo hame india dekhne ko milte haiumeed hai aapko video pasand aayega game phone redmi note pro realme narzo vivo samsung galaxy realme httpfkrtitwfvrdqnnnn redmi note pro honor pro httpfkrtitwonieqnnnn honorable mention realme pro httpfkrtitwfckfqnnnn vivo pro httpfkrtitlcvghuuun realme pro httpfkrtitwfngdqnnnn interest videos best rs india realme narzo launch india top best game smartphones touch sample vs higher screen refresh rate edit photos like pro simple step redmi note mi note lite launch amaze free websites try mediatek vs snapdragon vs kirin miui top feature know top upcoming smartphones may mi youth edition poco india best camera apps android delete malicious apps phone tip improve battery life android dangerous harmful sideeffect smartphones top free android apps april security tip protect social media account secret feature youtube android tip grow youtube fun cool google search trick secret hide settings android battery charge tip top offline game intro background music music epidemic sound httpwwwepidemicsoundcom music jinglepunks httpsmyjinglepunkscom follow like page facebook httpswwwfacebookcomtechnoruhez follow twitter httpstwittercomamreliaruhez follow instagram httpswwwinstagramcomtechnoruhez leave like subscribe awesome videos like daily business enquiries technoreviewwwgmailcom gear camera canon monitor aoc light mic laptop note content use copyright techno ruhez use commercial display edit content without proper authorization allow,Science & Technology,Smartphones,"top 7 best phones under 15000 in 2020,best gaming phones under 15000,best phones under 15000 in india may 2020,top mobiles under 15000 hindi,best gaming phones 2020,best smartphones under 15k,top mobiles under 15000,top smartphones under 15000,top phones of 2020,best gaming smartphones,msmartphones,best mobiles,phone under 15000 2020,best phone under 15000,realme 6,redmi note 9 pro,realme narzo 10,redmi note 7 pro,vivo u20,gaming phone under 10000"
Gt8xiJyJ2Sc,information technology hear,hear information technology get stuff connect download upload create share play mix matchingand thats thats theres talk school counselor take class go get,Science & Technology,Information Technology,"educational,electronics,software,IT,Information,Technology,School,Careers,Computers,Connecting,Downloading,Uploading,Creating,Sharing,Playing,Programming,Mixing,Matching,North,Dakota,ITCND,processing,storage,computer,hardware,data,constructs,render,multimedia,management,networking,engineering,database,cell,phones,televisions,automobiles,telecommunications"
H2hGMzj6Roo,robotics kid beginners robotics build robot kid,robotics kid build robot kid introduction robotics kid beginners test knowledge min quiz httpsrootsaidcomsnaxquizarduinoquizbasics video series explain everything need know robotics get start show plan beginner robot things take care set robot chassis choose battery microcontroller everything take care build diy robot amaze arduino project cool robotics project end series able build beginners robot check website wwwrootsaidcom video focus different part robot build robot must know different part robot function talk video new channel let know upload share video tutorials raspberry pi arduino accessory board build robots home automation systems fun hobby project create upload new project tutorials every week hobbyist raspberry pi arduino enthusiast make sure subscribe youtube channel click subscribe button click bell icon next wont miss future project arduino raspberry pi commonly use controllers field robotics talk arduino raspberry pi differences similarities next video choose best one robot make sure subscribe youtube channel click subscribe button click bell icon next wont miss future videos welcome rootsaid place interact share ideas arduino raspberry pi electronic project hobbyists professionals find lot project tutorials use latest board technology play live nerdy network connect hobbyists arduino raspberry pi enthusiasts around world post discussions publish project ask help share knowledge lot latest arduino raspberry pi project tutorials tinker lot diy tutorials large collection project tutorials base raspberry pi arduino linux wifi project experiment fun project crazy ideas want show talents dedicate space show case project find amaze robots join coronavirus battle fight covid robots,Science & Technology,Robotics,"robotics,robot,rootsaid,raspberry pi robotics,2019 robotics,arduino robots,beginners,diy,arduino robotics,arduino robot,kids,robotics for kids,kids robotics,kids robot,robot for kids,how to build a robot,what is a robot,robot explained,diy robot,what is robotics,building a robot,how to,robotics for beginners,beginners robot,simple robot,how to make a robot,make a robot,make a simple robot,robot for beginners,How to Build a Robot for Kids?"
HBvrDtOOGMo,great laptops mid buy guide tech chap,laptop buy round top best value laptops get surfshark vpn httpssurfsharkdealstechchap enter promo code techchap extra month free amazon pay link macbook air us uk asus zenbook us uk acer swift us come soon uk acer swift us come soon uk asus vivobook us uk huawei matebook us na uk honor magicbook us na tbc uk asus vivobook us uk acer aspire slim us uk acer aspire us uk notice pay link amazon associate earn qualify purchase tech chap member amazon associate program earn fee link amazoncom amazoncouk matthew moniz acer swift httpswwwyoutubecomwatchvqebbvvmops laptop pc tech cant get enough tech subscribe free youtube instagram httpswwwinstagramcomthetechchap httpstwittercomthetechchap music epidemic artlist,Science & Technology,Laptops & Desktops,"Tech Chap,The Tech Chap"
HSA5Bq-1fU4,meet robots amazon,robots take world researchers think job nova facebook httpswwwfacebookcomnovaonline nova twitter novapbs nova instagram novapbs production credit digital producer michael rivera nova wonder animals say producers michael bicks anna lee strachan wgbh educational foundation,Science & Technology,Robotics,"NOVA,science,Amazon,robotics,computer science,automation,researchers,PBS,documentaries,robots"
I0cmD9igO-o,best telescope beginners visual astronomy,best telescope beginners order apertura full specs buy first astronomy telescope step towards new level appreciation night sky almost years ago buy first telescope dobsonian reflector like one smaller experience telescope early propel love astronomy believe dob like one feature video apertura best telescope beginner could start specs optical design newtonian reflector focal length aperture inch focal ratio astronomy telescope,Science & Technology,Astronomy,"best telescope for beginners,best telescope,astronomy telescope,beginner telescope,Apertura AD8,visual astronomy,review,buying guide,buying your first telescope"
